"Bhojia Institute Of Nursing , Solan",SOLAN ,Himachal Pradesh,01795-244721,bhojianursing@gmail.com,-
Bholanath College,DHUBURI ,Assam,03662-230573,principal@bncollege.org,-
Bhonsale Military College, ,Maharashtra,-,-,-
Bhonslas Education Trust Bhonsla Polytechnic, ,Maharashtra,-,ibhonsle@rediffmail.com,www.bhonslapoly.org
BHONWAL SCHOOL OF EDUCATION, ,Uttar Pradesh,-,-,-
"Bhopal College Of Nursing,Bhopal",BHOPAL ,Madhya Pradesh,-,-,-
BHOPAL DEGREE COLLEGE, ,Madhya Pradesh,	9826447765,-,-
Bhopal Engineering College, ,Madhya Pradesh,+91-755-2553875,-,-
Bhopal Institute of Technology,BHOPAL ,Madhya Pradesh,0755-2577772,biutsbhopal@gmail.com,-
Bhopal Institute of Technology & Science,BHOPAL ,Madhya Pradesh,"07480-262363,4650441,2577772","bits@globusgroup.org,suveesha@sancharnet.in",www.geocities.com
"Bhopal Nursing College , Bhopal",BHOPAL ,Madhya Pradesh,-,-,-
Bhopal School of Social Sciences, ,Madhya Pradesh,-,-,-
"Bhoramdev College of Agriculture, Kawardha", ,Chhattisgarh,-,-,www.igau.edu.in/igkv/?q=taxonomy/term/302
"Bhubananada Orissa School of Engineering,Cuttack", ,Orissa,0671-2414092/2414086,principabose@rediffmail.com,http://www.boseorissa.org/
BHUBANESWAR INSTITUTE OF MANAGEMENT & INFORMATION TECHNOLOGY,BHUBANESWAR ,Orissa,06742587282/2580771,bimit@bimit.net,www.bimit.net
Bhubaneswar Polytechnic, ,Orissa,-,-,-
"Bhubaneswar School Of Nursing , Bhubaneswar",BHUBANESWAR ,Orissa,-,-,-
"Bhubaneswar School Of Nursing , Khurda",KHURTA ,Orissa,-,-,-
Bhulabhai Vanmalibhai Patel Institute, ,Gujarat,91-2625-255882,director.bvp@utu.ac.in,www.bvpinst.edu.in
Bhupal Nobels Law College, ,Rajasthan,0294-2413181,-,-
"Bhupal Noble College of Pharmacy , Udaipur",UDAIPUR ,Rajasthan,"+91-294-2410406,+91-294-2413181,+91294241032","bngcpudr@yahoo.co.in,info@bngcp.org",www.bngcp.org
"Bhupal Noble Girls College of Pharmacy , Udaipur",UDAIPUR ,Rajasthan,"+912942410325,+912942413181",info@bnphysical.org,www.bnphysical.orgwww.bninstituteofhighereducat
Bhupal Nobles' P.G. College, ,Rajasthan,-,-,-
Bhusawal Arts Sc& P.O.Nahata Commerce College, ,Maharashtra,-,-,-
BHUTEACHERS TRAININGA TEACHER TRAINING COLLEGE, ,Punjab,-,-,-
Bhutta College Of Engineering And Technology, ,Punjab,"0161-2852913,2853256,57,2458971",bcet@sify.com,http://www.bcetldh.org/
"Bhuvan College Of Nursing , Bangalore",BANGALORE ,Karnataka,"9448079180,080-22712111",bhuvancollegeofnursing@yahoo.com,-
BHUVAN D.ED COLLEGE, ,Karnataka,-,-,-
bhuvan polytechnic yelahanka, ,Karnataka,-,-,-
"Bhuvan School Of Nursing , Bangalore",BANGALORE ,Karnataka,-,-,-
Bibhuti Bhusan Govt. Primary Teacher's Training Institute, ,West Bengal,-,-,-
Bibhuti Kanungo College of Arts and Crafts, ,Orissa,-,-,-
"Bibi Chhan Kaur Colege Of Nursing , Mansa",MANSA ,Punjab,-,-,-
"Bibi Chhankaur College Of Nursing , Mansa",MANSA ,Punjab,-,-,-
Bibi Fatma Teacher's' Training College, ,Bihar,-,-,-
"Bibi Halima College Of Nursing & Med. Technology,Srinagar", ,Himachal Pradesh,-,-,-
"Bibi Halima College Of Nursing & Med. Technology,Srinagar",SRINAGAR ,Jammu and Kashmir,-,-,-
"Bibi Halima College Of Nursing & Medical Technology , Srinagar",SRINAGAR ,Jammu and Kashmir,-,-,-
Bibi Raza Degree College for Women, ,Karnataka,-,-,-
"Bibi Rehmete Christian College Of Nursing , Gurdaspur",GURDASPUR ,Punjab,"01870-254171,9878030123|01870-254171",-,-
"Bibi Rehmete Christian Nursing Institute , Gurdaspur",GURDASPUR ,Punjab,-,-,-
"Bibi Rehmete Christians Nursing Institute , R S Dam", ,Punjab,-,-,-
"Bibi Rehmete Ghristian College Of Nursing , Gurudaspur",GURDASPUR ,Punjab,-,-,-
"Bidar Institute of Medical Sciences, Bidar", ,Karnataka,"08482-229970,08482-228366",director@brims-bidar.in,www.brims-bidar.in
BIDAR VIDYA KENDRA AMABIGARA CHOWDAIAH T.T.I, ,Karnataka,-,-,-
BIDAR VIDYA KENDRA COLLEGE OF EDUCATION, ,Karnataka,-,-,-
"Bidhan Chandra College,Burdwan", ,West Bengal,-,-,-
"Bidhan Chandra College,Hooghly", ,West Bengal,-,-,-
Bidhan Chandra Krishi Vishwavidyalaya, ,West Bengal,"033-25879772,03473-222666",vcbckv@vsnl.net,www.bckv.edu.in
Bidhannagar College, ,West Bengal,-,-,-
BIDMT, ,Uttar Pradesh,7235072805,bidmtgkp@gmail.com,bidmt.in
Biff & Bright College of Engineering & Technology, ,Rajasthan,+91-1428-218302,:bbcet@live.com,http://www.bbcetindia.org
Biff & Bright College of Engineering & Technology, ,Rajasthan,98290-55945,bbcet@live.com,-
Bihar Agricultural University, ,Bihar,"0641-2452609,",vcbausabour@gmail.com,http://bausabour.ac.in
Bihar College Engineering, ,Bihar,-,-,-
"Bihar College of Pharmacy , Patna",PATNA ,Bihar,-,-,www.biharcollegeofpharmacy.com
Bihar Institute of Law, ,Bihar,0612-2295531,-,http://www.bilpatna.com/
"Bihar Institute Of Nursing & Paramedical , Patna",PATNA ,Bihar,-,-,-
Bihar Institute of Silk & Textiles,BHAGALPUR ,Bihar,0641-23372,-,-
BIHAR Institute of Technology, ,Jharkhand,-,-,-
"Bihar Institute of Technology,",DHANBAD ,Jharkhand,2350495/2350496,bit_sindri@yahoo.com,www.bitsindri.ac.in
Bihar Lal Smarak Kisan Mahavidyalaya, ,Uttar Pradesh,-,-,-
BIHARI MAHILA MAHAVIDYALAYA, ,Uttar Pradesh,-,-,-
BIHARI PHYSICAL COLLEGE, ,Madhya Pradesh,-,-,-
Bihpuria College, ,Assam,-,-,-
Bihpuria PG Training, ,Assam,0263018,-,-
BIJAPUR JILLA BANJARA VIDHYA VARDHAKA SANGHA BANJARA PHYSICAL EDUCATION COLLEGE, ,Karnataka,-,-,-
BIJENDRA TEOTTA MEMORIAL MAHAVIDYALAYA, ,Uttar Pradesh,-,-,-
Bijepur College, ,Orissa,-,-,-
Bijni College, ,Assam,-,-,-
Bijoy Krishna Girls College, ,West Bengal,-,-,-
Bijoy Krishna Girls College, ,West Bengal,"+91(033)26412341,+91(033)26414877",bkgc_howrah@yahoo.com/info@bkgc.org,www.bkgc.org
Bijoy Pal Memorial B.Ed. College, ,West Bengal,-,-,-
Biju Patnaik College, ,Orissa,-,-,-
Biju Patnaik Inst. of Technology, ,Orissa,(06842)-256057,info@bpitphulbani.ac.in,www.bpitphulbani.ac.in
BIJU PATNAIK INSTITUTE OF INFORMATION TECHNOLOGY & MANAGEMENT STUDIES, ,Orissa,06742743735/3617,biitmbbsr@yahoo.com,www.biitm.org
Biju Patnaik University of Technology BPUT, ,Orissa,(0661)2501349,bput@bput.ac.in,http://www.bput.ac.in/
Biju Pattanaik Film and Television Institute of Orissa, ,Orissa,0671-2615480,bpftio@lycos.com,http://www.orissa.gov.in/
Biju Pattnaik Degree College, ,Orissa,-,-,-
Biju Pattnaik Degree Women's College, ,Orissa,-,-,-
Biju Pattnaik Homoeopathic Medical College, ,Madhya Pradesh,-,-,-
Bijupatnaik Institute of Industrial Rehabilitation Training and Research,JAYPORE ,Orissa,"06728-230018,230552",sahakari_avas@rediffmail.com,-
"Bijupattanaik G N M Training School , Mayurbhanj", ,Orissa,-,-,-
Bikali College,GOLAGHAT ,Assam,03663-284331,-,-
"Bikaner College Of Nursing,Bikaner",BIKANER ,Rajasthan,0151-2207716,info@bikanercollegeofnursing.com,http://www.bikanercollegeofnursing.com/
"Bikaner Institute Of Medical Science , Bikaner",BIKANER ,Rajasthan,-,-,-
Bikash Bharati Law College, ,West Bengal,09434364331,-,http://bblc.co.in/home/
Bikash Bharati Welfare Society,MEDINIPUR ,West Bengal,-,-,-
Bikashayan,KOLKATA ,West Bengal,-,-,-
"Bilahara Academy Of Nursing Sciences , Bangalore",BANGALORE ,Karnataka,-,-,-
BILAL COLLEGE OF EDUCATION FOR WOMEN, ,Karnataka,8472-227136,bilalbed@gmail.com,-
Bilasipara College,DHUBURI ,Assam,250323,-,-
Bilaspur Vishwavidyalaya, ,Chhattisgarh,"07752-260294,077522-214203,07752-214204",bilaspur.university2012@gmail.com,www.bilaspuruniversity.ac.in
BILLGATES COLLEGE OF EDUCATION, ,Tamil Nadu,-,-,-
"Billroth College Of Nursing , Chennai",CHENNAI ,Tamil Nadu,-,-,-
"Bilwa Institute Of Nursing , Bellary",BELLARY ,Karnataka,-,-,-
Bimal Chandra College of Law, ,West Bengal,03484-258071,-,http://bcckandi.org/
"Bimla Devi Sewa Sadan Nursing School , Ranchi",RANCHI ,Jharkhand,-,-,-
Binayak Acharya College, ,Orissa,-,-,-
BINDESHWARI DEGREE COLLEGE, ,Uttar Pradesh,-,-,-
"Binit Nursing Institute,Solapur",SHOLAPUR ,Maharashtra,-,-,-
Binod Bihari Mahato College, ,Jharkhand,-,-,-
Bipin Behari Degree College, ,Uttar Pradesh,-,-,-
Bir Bikram Evening College, ,Tripura,-,-,-
Bir Lachit Borphukan College, ,Assam,-,-,-
Bir Narain Chand College, ,Bihar,-,-,-
Biraja Law College,CUTTACK ,Orissa,-,info@birajalawcollege.in,-
Biramangol College, ,Manipur,-,-,-
Birapara College, ,West Bengal,-,-,-
BIRBAL MEMORIAL TEACHERS TRAINING COLLEGE, ,Rajasthan,-,-,-
Birbhum Institute of Engineering & Technology,BIRBHUM ,West Bengal,03462-256839/258487/225557,dir.biet@yahoo.com.,www.bietsuri.com
Birbhum Mahavidyalaya, ,West Bengal,-,-,-
Birbhum Vivekanand Homoeopathic Medical College and Hospital,BIRBHUM ,West Bengal,-,-,-
Birchand Patel Smarak Mahavidyalaya, ,Bihar,-,-,-
Bird Society Bachelor Social Work College, ,Karnataka,-,-,-
Bird Society' Bachelor of Social Work College, ,Karnataka,-,-,-
Bird'S Society Bachelor Of Social Work College, ,Karnataka,-,-,-
Bird'S Society Bachelor Of Social Work College, ,Karnataka,-,-,-
"Birender Singh College & Nursing , Jind",JIND ,Haryana,-,-,-
"Birender Singh College Of Nursing ,Jind",JIND ,Haryana,01684-230165,-,www.bscnuchana.com
Birjhora Kanya Mahavidyalaya,BONGAIGAON ,Assam,-,-,-
Birjhora Mahavidyalaya, ,Assam,-,-,-
BIRKHA RAM TEACHER TRAINING COLLEGE, ,Haryana,-,-,-
Birla College of Arts Science & Commerce, ,Maharashtra,-,-,-
"Birla College Of Nursing ,Jhunjhunu", ,Rajasthan,-,-,-
"Birla College Of Nursing,Jhunjhuna", ,Rajasthan,-,-,-
Birla Government College, ,Rajasthan,-,-,-
Birla Institute of Applied Sciences,NAINITAL ,Uttaranchal,05942-247032,bias@birlainstitute.com,www.birlainstitute.co.in
Birla Institute of Management Technology, ,Uttar Pradesh,+91-120-2323012/22/25,-,www.bimtech.ac.in
Birla Institute Of Technology,RANCHI ,Jharkhand,91-651-2276249,skmukherjee@bitmesra.ac.in,www.bitmesra.ac.in
Birla Institute of Technology, ,West Bengal,2557-6742,-,-
Birla Institute Of Technology And Science, ,Rajasthan,"01596-242210,01596-245073",arvindr@bits-pilani.ac.in,http://www.bits-pilani.ac.in
Birla Institute Of Technology Ranchi,MESRA ,Bihar,910651300615,skbose@bitmesra.ac.inn,www.bitmesra.ac.in/
"Birla Sarvajanik Hospital , Birla School Of Nursing,Pilani",PILANI ,Rajasthan,-,-,-
Birla Vishvakarma Mahavidyalaya,ANAND ,Gujarat,"02692-230104,230192",bvm_princi@yahoo.com,www.bvmengineering.ac.in
Birmaharajpur College, ,Orissa,-,-,-
Birpur College, ,Orissa,-,-,-
Birsa Agricultural University, ,Jharkhand,91-651-2450500,root@bau.bih.nic.in,http://www.baujharkhand.org/
Birsa College, ,Jharkhand,-,-,-
BIS College of Engineering and Technology, ,Punjab,+91-92572-93603,info@bisinstitutes.com,www.bisinstitutes.com
BIS TEACHER TRAINING COLLEGE, ,Punjab,-,-,-
Bishambar Sahai Law Institute, ,Uttaranchal,"01332-273024,01332-264070,9837127404,9412903",-,http://www.bsigrouprke.com/law.html
BISHAMBAR SAHAL B.P.ED INSTITUTE, ,Uttaranchal,-,-,-
Bishamber Sahai Diploma Engineering College (BSDEC), ,Uttaranchal,(01332)264070,sourabh_bsi07@yahoo.com,http://www.bsigrouprke.com/
BISHAMBHAR SAHAI MANAGEMENT INSTITUTE,ROORKEE ,Uttaranchal,"01332-273024,9837127404,9412903436",sourabh_bsi07@yahoo.com,-
Bishnupur Public Primary Teacher's' Training Institute, ,West Bengal,-,-,-
"Bishnupur Public School Of Nursing , Bankura",BANKURA ,West Bengal,-,-,-
Bishop  Kurialacherry  College For Women,KOTTAYAM ,Kerala,"0481-2597384,04812598677",compcolg@md5.vsnl.net.in,-
Bishop Abraham Memorial College, ,Kerala,-,-,-
BISHOP AGNISWAMY COLLEGE OF EDUCATION, ,Tamil Nadu,-,baceducationmuttom@yahoo.co.in,-
Bishop Ambrose College,RAMANATHAPURAM ,Tamil Nadu,-,-,-
BISHOP APPASAMY COLLEGE OFEDUCATION, ,Tamil Nadu,0422-6523129,info@csibaced.co.in,-
BISHOP ARULSWAMY TEACHER TRAINING INSTITUTE, ,Tamil Nadu,-,-,-
Bishop Azaraiah Degree College,WARANGAL ,Andhra Pradesh,-,-,-
"Bishop Benziger College Of Nursing , Kollam",KOLLAM ,Kerala,-,-,-
Bishop Calldowell College,TUTICORIN ,Tamil Nadu,-,-,-
Bishop Chulaparambil Memorial College of Women, ,Kerala,-,-,-
"Bishop College Of Nursing , Erode",ERODE ,Tamil Nadu,-,-,-
"Bishop Conard Memorial School Of Nursing, Sitapur",SITAPUR ,Uttar Pradesh,-,-,-
BISHOP COTTON ACADEMY PROFESSIONAL MANAGEMENT, ,Karnataka,-,-,-
Bishop Cotton Women'S Christian College, ,Karnataka,-,-,-
Bishop Cotton Womens Christian Law College, ,Karnataka,22121898,bcwclc_apporkodi@yahoo.co.in,http://www.bcwclc.com/
Bishop Heber College, ,Tamil Nadu,0431-2770059/2773345,principal@bhc.ac.in,www.bhc.ac.in
Bishop Jerome Institute, ,Kerala,+91-474-2764052/53,info@bjgi.in,www.bjgi.in
Bishop Kurialacherry College for Women, ,Kerala,-,-,-
Bishop Moore College,ALAPPUZHA ,Kerala,"0479-303260,0473-428486",mail@bishopmoorecollege.in,-
BISHOP NEWBIGIN COLLEGE OF EDUCATION, ,Tamil Nadu,-,-,-
BISHOP PACKIAM AROKIASWAMY COLLEGE OF EDUCATION, ,Tamil Nadu,-,-,-
BISHOP PETER TEACHER TRAINING INSTITUTE FOR MEN, ,Tamil Nadu,-,-,-
BISHOP SARGENT TEACHER TRAININGINSTITUTE, ,Tamil Nadu,-,-,-
Bishop Thorp College,DHARAPURAM ,Tamil Nadu,(4258)220496,bishiop@as250.bharathi.ernet.in,-
"Bishop Vayalil Medical Centre , School Of Nursing , Idukki",IDUKKI ,Kerala,-,-,-
"Bishops College Of Nursing , Erode",ERODE ,Tamil Nadu,-,-,-
Bishp Azariah Degree College For Women,VIJAYAWADA ,Andhra Pradesh,"0866–2480458,94401–73584",-,-
Bishwanath Singh Institute of Legal Studies, ,Bihar,06344-220018,-,-
Biswanath College,SONITPUR ,Assam,-,-,-
Biswanath college of Education, ,Assam,-,-,-
bit institute of technology hindupur, ,Andhra Pradesh,8556249677,principal.bitit@gmail.com,http://www.bitit.org/
"BIT Polytechnic,Balasore", ,Orissa,06782-653076/77,bit_balasore@rediffmail.com,www.bitpolytech.org
BITS College of Polytechnic, ,Haryana,-,-,http://www.bitsbhiwaniindia.org/polytechnic/
BITS polytechnic, ,Haryana,01664-290003,-,www.bitsbhiwaniindia.org
BIYANI GIRLS TEACHER TRAINING COLLEGE, ,Rajasthan,-,-,-
BIYANI INSTITUTE OF SCIENCE & MANAGEMENT, ,Rajasthan,-,acad@biyanicolleges.org,-
"Biyani Institute Of Science And Managment,Jaipur",JAIPUR ,Rajasthan,"91-141-2336226,2338371,2338591-95",-,http://www.biyanicolleges.org
"Biyani School Of Nursing ,Jaipur",JAIPUR ,Rajasthan,-,-,-
BJR College of Arts Commerce & Science,NAMPALLY ,Andhra Pradesh,"23230354,23321506",-,-
BJR College of Arts Commerce & Science, ,Andhra Pradesh,-,-,-
BKM TEACHER TRAINING COLLEGE, ,Punjab,-,-,-
Black Dimond School of Engineering, ,Orissa,"(06645)242202,242403,242987",blackdiamondorissa@rediffmail.com,www.blackdiamond.org.in
"BLDE Association Polytechnic, Bijapur", ,Karnataka,08352261649,-,-
BLDEA A.S PATIL COLLEGE OF COMMERCE,BIJAPUR ,Karnataka,08352-262770Extn.2206/220508352-265485,directormbain@indiatimes.com,-
Bldea Commerce Bhs Arts Tgp Science College, ,Karnataka,-,-,-
Bldea'S Association Arts Commerce College For Women, ,Karnataka,-,-,-
Bldea'S New Arts College, ,Karnataka,-,-,-
"Bless College Of Nursing,Chittoor",CHITOOR ,Andhra Pradesh,-,-,-
BLESSY COLLEGE OF EDUCATION ALAN EDUCATIONAL TRUST, ,Tamil Nadu,-,-,-
"Blind  Peoples Association, Jagdish Patel Chowk",AHMEDABAD ,Gujarat,-,-,-
Blind Relief Association,DELHI ,Delhi,-,-,-
Blind Welfare Council,DAHOD ,Gujarat,-,bwcdahod@yahoo.co.in,-
Blooming Buds Degree College, ,Uttar Pradesh,-,-,-
BLOOMING BUDS DEGREE COLLEGE, ,Uttar Pradesh,-,-,-
BLOOMS TEACHER TRAINING COLLEGE, ,Himachal Pradesh,-,-,-
BLS Institute of Management, ,Uttar Pradesh,0120-4192500,-,www.blsim.org
BLS Institute of Technology Management, ,Haryana,"01276-304264,67,68,69,72",blsitm@gmail.com,http://www.blsitm.com
Blue Mountains College of Hotel Management, ,Uttaranchal,0135-2608128,info@bluemountains.com,www.bluemountainsdoon.com
BLUE MOUNTAINS COLLEGE OF TEACHERS EDUCATION, ,Uttaranchal,-,-,-
BM College of Technology, ,Madhya Pradesh,0731-2572131,mail@bmcollege.ac.in,www.bmcollege.net.in
Bm H E C S College Commerce, ,Karnataka,-,-,-
BM Institute of Engineering & Technology, ,Haryana,"0130-2242163,2233662,2236911-14",director@bmiet.net,-
BMB Girls College, ,Madhya Pradesh,-,-,-
BMS College of Engineering,BANGALORE ,Karnataka,080-26527424/2266130-135,mvk2759@yahoo.co.in,www.bmsce.ac.in
BMS Institute of Technology Management,BANGALORE ,Karnataka,080-28567187/28561576,principal_bmsit1@rediffmail.com,www.bmsit.org
BMSPM's Ashokrao Mane Polytechnic, ,Maharashtra,"(0230)2407760,2407740",amppolytechnicvathar@gmail.com,http://www.amietv.org
BNG Hotel Management Kolkata, ,West Bengal,09830796307,bngkolkata@gmail.com,http://www.bngkolkata.com/
BNM Institute of Technology,BANGALORE ,Karnataka,080-26711780-82,inmaanay@vsnl.com,ww.bnmit.org
BNR Training College, ,Bihar,-,info@bnrcollege.in,http://www.indiasite.com/
"Bodhini Devi Nursing Institute,Jagdalpur",JAGDALPUR ,Chhattisgarh,-,-,-
"Bodhni Devi Educational Society,Jagdalpur",JAGDALPUR ,Chhattisgarh,-,-,-
Bodofa UN Brahma Colege, ,Assam,-,-,-
Bodoland University, ,Assam,03661-277149,registrar@bodolanduniversity.org,http://bodolanduniversity.ac.in/s24c/
Boggavarapu Guravaiah (Bg) Degree College,SATTENPALLI ,Andhra Pradesh,"08641–234288,233049",-,-
Bojirout Memorial College, ,Orissa,-,-,-
"Bojjam Narasimlu College of Pharmacy for Women , Saidabad",HYDERABAD ,Andhra Pradesh,"040-2453-2171,040-2433-1173",-,www.bnpcw.ac.in
"Bokaro General Hospital, School Of Nursing , Bokaro",BOKARO ,Jharkhand,-,-,-
Bokaro Mahila College, ,Jharkhand,-,-,-
Bokaro Steel City College, ,Jharkhand,-,-,-
Bokaro Steel City College, ,Jharkhand,"065442-277112(o),247209(r)",-,-
"Bollineni College of Nursing , Nellore",NELLORE ,Andhra Pradesh,+91-861-2368242,bollinenicollege@yahpoo.co.in,-
"Bollineni School Of Nursing , Nellore",NELLORE ,Andhra Pradesh,-,-,-
Bolpur College, ,West Bengal,-,-,-
Bombay College Of Pharmacy, ,Maharashtra,-,-,-
Bombay College of Pharmacy, ,Maharashtra,-,-,-
"Bombay Hospital College Of Nursing , Indore",INDORE ,Madhya Pradesh,-,-,-
"Bombay Hospital College Of Nursing , Mumbai",MUMBAI ,Maharashtra,-,-,-
"Bombay Hospital Institute of Medical Sciences, Mumbai",MUMBAI ,Maharashtra,022-2067676,2080871,http://www.bombayhospital.com
BOMBAY TEACHERS TRAINING COLLEGE, ,Maharashtra,-,-,-
Bombay Teachers' Training College, ,Maharashtra,-,-,-
Bombay Teachers' Training College, ,Maharashtra,-,-,-
Bomma Institute Of Tech. & Science, ,Andhra Pradesh,08742-323887,principal@bomma.ac.in,www.bomma.ac.in
Bon Hooghly College Of Commerce, ,West Bengal,-,-,-
BON MAHARAJ INSTITUTE OF MANAGEMENT AND TECHNOLOGY, ,Uttar Pradesh,-,-,-
BON SECOURS COLLEGE OF EDUCATION, ,Tamil Nadu,-,-,-
Bon Secours College Womens,THANJAVUR ,Tamil Nadu,-,-,-
Bonaigarh College, ,Orissa,-,-,-
Bonam Venkata Chalamayya Engineering College, ,Andhra Pradesh,-,-,www.bvcec.org
Bonam Venkata Chalmayya Institute Of Technology, ,Andhra Pradesh,08856-235416,Principal.bvts@bvxgroup.in,www.bvcits.ac.in
Bongaigaon B.Ed. College, ,Assam,-,-,-
Bongaigaon College,BONGAIGAON ,Assam,03664-220310,-,-
Bongaigaon Law College, ,Assam,03664-231345,-,-
BONI MADHAV SINGH MAHAVIDYALAYA, ,Uttar Pradesh,-,-,-
Bonifoi College, ,Madhya Pradesh,"0755-2587877,2284884",-,http://www.bonniefoicollege.org/
Bonifoi College, ,Madhya Pradesh,-,-,-
BONNIE FOI COLLEGE, ,Madhya Pradesh,0755-3257041/3257042,-,http://bonniefoicollege.org
"Bora Institute Of Allied Health Sciences School Of Nursing , Lucknow",LUCKNOW ,Uttar Pradesh,-,-,-
"Bora Institute Of Allied Health Sciences,Lucknow", ,Uttar Pradesh,"(0522)3295335,3294535,Mob.:+91-9936826124",borapolyclinic@gmail.com,www.biahs.com
BORA INSTITUTE OF MANAGEMENT & SCIENCES, ,Uttar Pradesh,"+91-9453034900,+91-8573808499,0522-2734900","bims.lko@gmail.com,placement_bims@in.com",http://www.bims.in
Bordoloni Central College, ,Assam,-,-,-
Borhat B P B Memorial College,BORHAT ,Assam,-,-,-
Borholla Collgeg,BORHOLLA ,Assam,-,-,-
Bosco College of Teacher Education, ,Nagaland,-,-,-
"Bose School Of Nursing, , Madurai",MADURAI ,Tamil Nadu,-,-,-
BOSTAN COLLEGE FOR PROFESSIONAL STUDIES, ,Madhya Pradesh,0751-3296283/3296299,"admission@bostoncollege.in,placement@bostoncolleg",http://www.bostoncollege.in
Boston College For Professional Studies, ,Madhya Pradesh,"+91-751-3296283,3296299,",info@bostoncollege.in,www.bostoncollege.co.in
"Boston Institute Of Nursing , Morena", ,Madhya Pradesh,-,-,-
"Boston School For Nursing,Gwalior",GWALIOR ,Madhya Pradesh,-,-,-
Botadkar Arts and Commerce College, ,Gujarat,-,-,-
Boudh Panchayat College, ,Orissa,-,-,-
"Bowring & Lady Curzon Hosp. Nursing School , Bangalore",BANGALORE ,Karnataka,-,-,-
BPR TEACHER TRAINING COLLEGE, ,Haryana,-,-,-
"BPS Government Medical College for Women, Sonepat", ,Haryana,01263-283063,directorbpsgmc@yahoo.com,-
BR NATH PAI ADHYAPAK MAHAVIDYALA, ,Maharashtra,-,-,-
"Br Nath Pai School Of Nursing,sindhudurg",SINDHUDURG ,Maharashtra,-,-,-
"Br. Nath Pai College Of Nursing , Sindhudurg",SINDHUDURG ,Maharashtra,-,-,-
BRaghunath Arts Commerce and Science College, ,Maharashtra,-,-,-
Brahamaved gramin Shiksha prasar Samiti, ,Uttar Pradesh,-,-,-
BRAHAMRISHI TEACHER TRAINING COLLEGE, ,Haryana,-,-,-
BRAHASPATI MAHILA MAHAVIDYALAYA, ,Uttar Pradesh,-,-,-
BRAHM DUTT DWIVEDI SMARAK SEWA SAMITI, ,Uttar Pradesh,-,-,-
Brahma School of Business, ,Tamil Nadu,+914286265265/265465:9659609999,brahma@bsbnkl.in,www.bsbnkl.in
Brahma Valley Educational Campus, ,Maharashtra,0253-2311244/2312904,-,www.brahmavalley.com
Brahmaiah College Of Engineering, ,Andhra Pradesh,"08622-255090,215218,255061,255062",bcenrp@gmail.com,http://www.bcen.in/
Brahmanand College, ,Uttar Pradesh,0512-2330413,bndkanpur@gmail.com,http://brahmanandcollege.org.in/
Brahmanand Degree (Pg) College, ,Uttar Pradesh,-,-,-
Brahmanand Group of Institutions, ,Uttar Pradesh,9917463821,-,http://www.bect.edu.in/bgi/index.html
BRAHMANAND MAHAVIDYALAYA, ,Uttar Pradesh,-,-,-
Brahmananda Kesabhchandra College, ,West Bengal,-,-,-
Brahmani College, ,Orissa,-,-,-
Brahmanjharilo Mahavidyalaya, ,Orissa,-,-,-
Brahmapur Law College, ,Orissa,-,-,http://www.ganjamlawcollege.com/
Brahmaputra Degree College, ,Assam,-,-,-
Brahmarshi Sahajanand Saraswati College, ,Bihar,-,-,-
Brahmas Institute of Engineering and Technology, ,Andhra Pradesh,08622255005,info@brahmas.in,http://www.brahmas.in/
Brahmavard Degree Pg College, ,Uttar Pradesh,-,-,-
Brahmdevdada Mane Institute Of Technology, ,Maharashtra,(0217)2283842/43,tpo_bmit@bmssp.org,http://www.bmssp.org/
BRAHMDUTT DWIVEDI SAMARK SAMITI, ,Uttar Pradesh,-,-,-
Brahmo Primary Teacher's Training Institute, ,West Bengal,0332-2416896,info@brahmoptti.org,-
BRAHMRISHI YOGA TRAINING COLLEGE,CHANDIGARH ,Chandigarh,0172-2540128,msmilcetich@gmail.com,www.yogacollege.in
Brainwaves College, ,Rajasthan,02974210767,info@brainwavescollege.com,www.brainwavescollege.com
BRAJ RAJ SINGH COLLEGE, ,Uttar Pradesh,-,-,-
Braja Mohan Thakur Law College, ,Bihar,-,-,http://www.bmtlawcollege.org/
BRAJESH MAHILA SHIKSHAK PRASHIKSHAN MAHAVIDYALAYA, ,Rajasthan,-,-,-
Brajraj Singh College, ,Uttar Pradesh,-,-,-
Brajrajnagar College, ,Orissa,-,-,-
BRCM College of Engineering and Technology, ,Haryana,-,infocollege@brcmindia.org,http://www.brcm.edu.in/
BRD College of Management and Science, ,Uttaranchal,-,-,-
"BRD Medical College, Gorakhpur", ,Uttar Pradesh,0551-2501736,info@brdmc.org,www.brdmc.org
"Bright Career Institute Of Nursing, Bikaner",BIKANER ,Rajasthan,-,-,-
"Bright Career Polytechnic College, Nokha", ,Rajasthan,94133-88642,bcp.college1@gmail.com,-
BRIGHT FUTURE TEACHERS TRAINING COLLEGE, ,Rajasthan,-,-,-
BRIGHT INDIA MAHILA TEACHERS TRAINING COLLEGE, ,Rajasthan,-,-,-
BRIGHT INSTITUTE OF MGT,MANDAL ,Andhra Pradesh,-,-,-
BRIGHT LAND TEACHER TRAINING COLLEGE, ,Haryana,-,-,-
BRIGHT MOON PRATHMIK TEACHERS TRAINING SANSTHAN, ,Rajasthan,-,-,-
"Bright School Of Nursing , Gwalior",GWALIOR ,Madhya Pradesh,-,-,-
BRIGHT TEACHER TRAINING COLLEGE, ,Haryana,-,-,-
BRIGHT TEACHER TRAINING COLLEGE, ,Haryana,-,-,-
Brihaspat Mahila Degree College, ,Uttar Pradesh,-,-,-
"Brij Chikitsa Sansthan School Of Nursing,Mathura",MATHURA ,Uttar Pradesh,-,-,-
"Brij Chikitsa Santhan School Of Nursing , Mathura",MATHURA ,Uttar Pradesh,-,-,-
Brij Mohan Institute of Management & Technology, ,Haryana,0124-4057653,admissions@bimt.edu.in,http://www.bimt.edu.in
BRIJ RAJ SINGH COLLEGE, ,Uttar Pradesh,-,-,-
Brijlal Biyani Science College, ,Maharashtra,-,-,-
Brilliant Degree College,SIRCILLA ,Andhra Pradesh,08723–233055,-,-
Brilliant Institute of Engineering & Technology, ,Andhra Pradesh,040-23437788,principal@b-iet.ac.in,http://www.b-iet.ac.in/
Brilliant Pg College (Mca),HAYATHNAGAR ,Andhra Pradesh,-,-,-
"Brilliants Degree College, Tadepalligudem",TADEPALLIGUDEM ,Andhra Pradesh,08818–222013,-,-
Brindavan College, ,Karnataka,"080-28478388,080-23417832",info@brindavancollege.com,www.brindavancollege.com
Brindavan College of Engineering,BANGALORE ,Karnataka,080-23414557/56953450080-23417832/23615621,info@brindivancollege.com,-
"Brite College Of Nursing , Bangalore",BANGALORE ,Karnataka,08023281434‎,-,-
"Brite School Of Nursing , Bangalore",BANGALORE ,Karnataka,-,-,-
BRM INSTITUTE OF MANAGEMENT & TECHNOLOGY,BHUBANESWAR ,Orissa,06742534367/2465700,brmimit1@rediffmail.com,www.brmtrust.com
BROWN'S POST GRADUATE COLLEGE,KHAMMAM ,Andhra Pradesh,-,-,-
Brs College College Rural Studies, ,Gujarat,-,-,-
BS TEACHER TRAINING COLLEGE, ,Rajasthan,-,-,-
BSCollege Danapur, ,Bihar,0612-2561634(O)0612-2592254(R),"bscollege@yahoo.com,principalbscollege@yahoo.com",http://www.bscollegedanapur.com/
BSF Institute of Technology, ,Karnataka,"080-22795256,22795255",-,-
BSM COLLEGE OF POLYTECHNIC ROORKEE, ,Uttaranchal,9837463075,bsmcoproorkee@gmail.com,www.bsmcop.com
BTL Polytechnic, ,Karnataka,-,-,-
BUDDHA COLLEGE OF TEACHER EDUCATION, ,Kerala,04792473276/2475576,-,-
Buddha Educational Institute of Mahila Maha, ,Uttar Pradesh,-,-,-
