B & B Institute of Technology, ,Gujarat,02692-237240,principal@bbit.ac.in,www.bbit.ac.in
B A J S S Arts Commerce College For Women, ,Karnataka,-,-,-
"B A School Of Nursing , Mangalore",MANGALORE ,Karnataka,-,-,-
"B B A School Of Nursing , Gulbarga",GULBARGA ,Karnataka,-,-,-
"B B C Trusts School Of Nursing , Gulbarga",GULBARGA ,Karnataka,-,-,-
B B H College,PRAKASAM ,Andhra Pradesh,"08594–246284,246258",-,-
B B Kishan College,JALAHGHAT ,Assam,-,-,-
B B N College, ,Himachal Pradesh,-,-,-
"B B R School Of Nursing , Secunderabad",SECUNDERABAD ,Andhra Pradesh,040-23779999,-,-
B Baruah College, ,Assam,-,-,-
"B C F College Of Nursing , Kottayam",KOTTAYAM ,Kerala,-,-,-
"B C M School Of Nursing , Sitapur",SITAPUR ,Uttar Pradesh,-,-,-
B D Evening College, ,Bihar,-,-,-
"B D M Nursing College,Jhajjar",JHAJJAR ,Haryana,-,-,-
"B D Pandey Hospital School Of Nursing ,Nainital",NAINITAL ,Uttaranchal,-,-,-
"B D Petit Parsee General Hospital , Bombay",MUMBAI ,Maharashtra,-,-,-
B D R TEACHER TRAINING INSTITUTE, ,Tamil Nadu,-,-,-
B D Shah College Education, ,Gujarat,-,-,-
B D T College Engineering, ,Karnataka,-,-,-
B D T College Engineering, ,Karnataka,-,-,-
B E A College Education, ,Karnataka,-,-,-
B E S College Of Education, ,Karnataka,-,-,-
B E Ss Marchants Arts Commerce College, ,Karnataka,-,-,-
B E Trust Polytechnic, ,,"08232-245017,245016",-,-
B G B S Women'S College, ,Andhra Pradesh,08814273231,-,http://www.bgbswomenscollege.org/
"B G S Academy For Nursing Sciences , Mysore",MYSORE ,Karnataka,-,-,-
"B G S College Of Nursing , Mysore",MYSORE ,Karnataka,-,-,-
"B G S Polytechnic, Chikballapur", ,Karnataka,08156263181,-,-
B H B College,BARPETA ,Assam,03666-244513,-,-
B H H College For Women, ,Andhra Pradesh,"0863–2230785,2230324",-,http://www.bhhdcw.com/
"B H R C School Of Nursing,Indore",INDORE ,Madhya Pradesh,-,-,-
"B I M R Nursing College , Gwalior",GWALIOR ,Madhya Pradesh,-,-,-
"B I M R Nursing School , Birla Institute Of Medical Research,Gwalior",GWALIOR ,Madhya Pradesh,-,-,-
"B I M T S College Of Nursing , Burhanpur", ,Madhya Pradesh,-,-,-
"B I P S College Of Nursing , Gwalior",GWALIOR ,Madhya Pradesh,-,-,-
"B I P S Institute Of A N M Training Centre , Bhind",BHIND ,Madhya Pradesh,-,-,-
"B J R College Of Nursing,Bangalore",BANGALORE ,Karnataka,-,-,-
B J Vanijya Mahavidyalaya, ,Gujarat,-,-,-
"B K J M School Of Nursing , Kannur",KANNUR ,Kerala,-,-,-
B K M Science College, ,Gujarat,-,-,-
B K Majumdar Institute Business Administration, ,Gujarat,-,-,-
B K Majumdar Institute Business Administration, ,Gujarat,-,-,-
B K N Arts Science College,MADURAI ,Tamil Nadu,-,-,-
B K Patel Arts Smt L M Patel Commerce College, ,Gujarat,-,-,-
B K PATIL COLLEGE OF PHYSICAL EDUCATION, ,Maharashtra,-,-,-
"B K R College Of Nursing , Tiruvallur",TIRUVALLUR ,Tamil Nadu,-,-,-
B L D E A  SVachana Pitamaha Dr. P.G.Halakatti College of Engineering and Technology,BIJAPUR ,Karnataka,08352-261120/265384,bldea_engg@usa.net,www.bldea.org
B L D E A Sdjanayogi Shri Siddeswar Swami College Education, ,Karnataka,-,-,-
B L D E A Sdjanayogi Shri Siddeswar Swami College Education, ,Karnataka,-,-,-
"B L D E A Sri B M Patil College of Nursing, Bijapur",BIJAPUR ,Karnataka,-,enquiry@bldea.org,www.bldea.org
B L D E As Dr Bachana Pitambhar P G Halakatti College Engg Technology,BIJAPUR ,Karnataka,"Ph.No.:08352-261120/265384,08352-262945",bldea_engg@usa.net,www.bldeaengg.org
B L D E As Dr Bachana Pitambhar P G Halakatti College Engg Technology, ,Karnataka,-,-,-
"B L D E As Shri B M Patil Institute Of Nursing Sciences,Bijapur",BIJAPUR ,Karnataka,-,-,-
"B L D E As Shri B M Patil Institute Of Nursing Sciences,Bijapur",BIJAPUR ,Karnataka,-,-,-
"B L D E As Shri B M Patil Institute Of Nursing Sciences,Bijapur",BIJAPUR ,Karnataka,-,-,-
"B L D E As Shri B M Patil Institute Of Nursing Sciences,Bijapur", ,Karnataka,-,-,-
B L D E Associaton Basaveshwar Arts Commerce College, ,Karnataka,-,-,-
B L Jindal Sui Wala College, ,Haryana,-,-,-
"B L M College Of Nursing,Jaipur", ,Rajasthan,-,-,-
"B L M Institute Of Medical And Paramedical Sciences , Sitapura",SITAPURA ,Rajasthan,-,-,-
"B L S School Of Nursing , Mandya",MANDYA ,Karnataka,-,-,-
B M A College, ,Bihar,-,-,-
"B M Birla College Of Nursing , Kolkata",KOLKATA ,West Bengal,-,-,-
"B M Birla Heart Research Centre , Calcutta",KOLKATA ,West Bengal,-,-,-
"B M Birla Heart Research Centre , College Of Nursig , Kolkata",KOLKATA ,West Bengal,-,-,-
"B M C B College Of Nursing,Kutch", ,Gujarat,-,-,-
"B M C B School Of Nursing , Kutch",BHUJ ,Gujarat,-,-,-
"B M C H R C College Of Nursing,Jaipur",JAIPUR ,Rajasthan,-,-,-
B M College, ,Bihar,-,-,-
B M D College, ,Bihar,-,-,-
B M S College Engineering,BANGALORE ,Karnataka,"080-26622130-135,080-26614357",mkv2759@yahoo.co.in,www.bmsce.ac.in
B M S College of Law, ,Karnataka,-,-,http://www.bmslawcollege.org/
"B M S Hospital Nursing College, Bangalore",BANGALORE ,Karnataka,-,-,-
"B M S Hospital Nursing College, Bangalore",BANGALORE ,Karnataka,-,-,-
"B M S Hospital Nursing School , Bangalore",BANGALORE ,Karnataka,-,-,-
"B M School Of Nursing , Vidisha",VIDISHA ,Madhya Pradesh,-,-,-
B M Shetty First Grade College, ,Karnataka,-,-,-
B N College Dhubri,DHUBURI ,Assam,-,-,-
B N College Education, ,Jammu and Kashmir,-,-,-
B N College Patna, ,Bihar,-,-,-
B N Jalan College, ,Jharkhand,-,-,-
B N M College, ,Bihar,-,-,-
B N M V College, ,Bihar,-,-,-
B N Mandal University Madhepura,MADHIPURA ,Bihar,"06476-22060,22779","vcbnmu_2007@rediffmail.com,bihmae@nic.in",http://bnmu.bih.nic.in/
"B N V School Of Nursing , Trivandrum",TRIVANDRUM ,Kerala,-,-,-
B P A C S COLLEGE OF EDUCATION, ,Maharashtra,-,-,-
B P Baria Science Institute, ,Gujarat,-,-,-
B P Chaliha College,NAGARPERA ,Assam,03623-245001,-,-
B P College of Business Administration, ,Gujarat,07923245735,bba.bpcba@gmail.com,www.bpcba.org
B P ED COLLEGE SHIVAJI NAGAR B P ED COLLEGE, ,Maharashtra,-,-,-
"B P Poddar Institute Of Nursing , Kolkata",KOLKATA ,West Bengal,-,-,-
"B P R School Of Nursing , Vellore",VELLORE ,Tamil Nadu,-,-,-
B P S College, ,Bihar,-,-,-
B P S College Of Education, ,Haryana,-,-,-
B Parameshwarappa Arts And Commerce College, ,Karnataka,-,-,-
B R Ambedkar Bihar University,MUZAFFARPUR ,Bihar,0621-2248255,registrar@brabu.net,http://www.brabu.net
"B R College Of Nursing,Morena", ,Madhya Pradesh,-,-,-
B R Mahila College, ,Bihar,-,-,-
"B R School Of Nursing , Jammu",JAMMU ,Jammu and Kashmir,-,-,-
B R Tambakad Arts And Commerce First Grade College, ,Karnataka,-,-,-
B S A College of Engineering and Technology,MATHURA ,Uttar Pradesh,"0565-2460980,2460981",info@bsacet.org,www.bsacet.org
B S College Lohardaga, ,Jharkhand,-,-,-
B S College Patna, ,Bihar,-,-,-
B S College Physical Education, ,Karnataka,-,-,-
"B S Institute Of Nursing Training & Paramedical Sciences, Nawanshaher",NAWANSHAHR ,Punjab,-,-,-
B S K College, ,Jharkhand,-,-,-
B S S College, ,Bihar,-,-,-
"B S T College Of Nursing , Kapurthala",KAPURTHALA ,Punjab,-,-,-
"B T L School Of Nursing , Bangalore",BANGALORE ,Karnataka,-,-,-
B T Patil & Sons Polytechnic, ,Karnataka,-,-,-
B V B College Engineering Technology, ,Karnataka,-,-,-
B V B College Engineering Technology, ,Karnataka,-,-,-
B V Bhoomaraddi College Arts Commerce Science College, ,Karnataka,-,-,-
B V K Degree College,VISAKHAPATNAM ,Andhra Pradesh,0891–2552975,-,-
"B V M B. Sc Nursing College , Gwalior",GWALIOR ,Madhya Pradesh,"+91--2436150,3291848/93",bvmctm@gmail.com,www.bvmctm.com
B V Parikh Janta College, ,Jharkhand,-,-,-
B V V S S Basaveshwar College Physical Education, ,Karnataka,-,-,-
"B V V S Sajjalashree Institute Of Nsg Sciences,College Of Nursing,Bagalkot",BAGALKOT ,Karnataka,-,-,-
"B V V S Sajjalashree Institute Of Nursing Sciences , Bagalkot",BAGALKOT ,Karnataka,-,-,-
B V V Sanghas Basaveshwar Science College, ,Karnataka,-,-,-
"B Y L Nair Charitable Hospital,Bombay",MUMBAI ,Maharashtra,-,-,-
B.B.S.P. Mandals Sant Tukaram Law College,LATUR ,Maharashtra,-,-,-
B. D. S. School of Law, ,Uttar Pradesh,"121-2602652,121-2603009",info@bdssl.net,http://www.bdssl.net/
B. E. S. College of Law, ,Karnataka,080-26630499,-,-
"B. J. Medical College, Pune", ,Maharashtra,"030-6128000,6126010,6123872",deanbjmcpune@gmail.com,www.bjmcpune.org
B. J. S. Rampuria Jain College, ,Rajasthan,"0151-2543054,0151-2200487,9414264932",-,-
B. M. Law College,MUZAFFARNAGAR ,Uttar Pradesh,"098960-70507,094162-05555,098130-96130",mail@bmcolleges.com,-
B. M. S. College of Law, ,Karnataka,080-26679336,-,http://www.bmslawcollege.org/
B. Padmanabhan Jayanthimala Arts And Science College,CUDDALORE ,Tamil Nadu,-,-,-
B. R. HARNE COLLEGE OF ENGINEERING & TECHNOLOGY, ,Maharashtra,0251?2910190/91,-,brharnetc.edu.in
B. R. M. Law College, ,Orissa,0674-2465700,-,http://www.brmgovtlawcollege.org.in/
B. S. Abdur Rahman University, ,Tamil Nadu,"044-22751347,22751348,22751350",cec@giasmd01.vsnl.net.in;cec@crescentcollege.org,www.bsauniv.ac.in
B. S. Anangpuria Institute of Law, ,Haryana,0129-2206750-753,bsail@bsact.org,www.bsail.org
B. S. M. Law College, ,Uttaranchal,01332-272446,-,http://www.bsmpgcollege.org/
B. S. N. Government P.G. College,SHAJAPUR ,Madhya Pradesh,07364-227727,-,-
B. S. Negi Mahila Pravidhik Prashikshan Sansthan, ,Uttaranchal,2795693,bsnegimpps11@gmail.com,bsnegimahilapolytechnic.co.in
B. S. Patel Polytechnic, ,Gujarat,02762286742,principal.bspp@ganpatuniversit,www.bspp.ac.in
B. S. R. Government Arts College,ALWAR ,Rajasthan,0144–2342899,-,-
B. V. V. Sanghas S. C. Nandimath Law College, ,Karnataka,08354-220664,-,http://www.bvvsscnlawbgk.org/
B.A & K.R. College,ONGOLE ,Andhra Pradesh,"08592–221665,221653,232827",-,-
B.A College of Engineering and Technology, ,Jharkhand,2423206,info@bacet.ac.in,http://www.bacet.ac.in/
B.A. & K.R. MCA COLLEGE,ONGOLE ,Andhra Pradesh,-,-,-
B.A. ALIAS BHAISAHEB SAWANT ADHYAPAK MAHAVIDYALAYA, ,Maharashtra,-,-,-
"B.A. College Of Agriculture , Anand",ANAND ,Gujarat,-,-,www.aau.in/?q=college-menu/178
B.B. Arts & N.B.&. B.P.Sciencecommerce College, ,Maharashtra,-,-,-
B.B. College, ,Orissa,-,-,-
B.B. Mahavidyalaya,JAYPORE ,Orissa,-,-,-
B.B.D. Government College, ,Rajasthan,-,-,-
B.B.K.D.A.V. College For Women, ,Punjab,-,-,-
B.B.M. Vaari Gayathri Degree College,KHAMMAM ,Andhra Pradesh,-,-,-
B.B.S INSTITUTE OF MANAGEMENT STUDIES, ,Uttar Pradesh,"0120-2323652,6416889",bbsims@bbscet.net,-
B.B.S. Institute of Management & Technology, ,Uttar Pradesh,"0532-2447812,9235443865",info@bbs.ac.in,www.bbs.ac.in
B.B.S. Public Degree College, ,Uttar Pradesh,-,-,-
B.B.S.P. Mandals Sant Tukaram Law College,LATUR ,Maharashtra,-,-,-
B.C. GAUTAM EDUCATION SOCIETY, ,Madhya Pradesh,-,-,-
B.C.M. College,KOTTAYAM ,Kerala,"0481-2562171,2560307",bcmktm@satyam.net.in,www.bcmcollege.org
B.C.M. College of Education, ,Punjab,-,-,-
B.C.M. TEACHER TRAINING COLLEGE, ,Punjab,-,mizobaptist@yahoo.com,-
B.C.N. ROTARY VIDYA SAMSTHE, ,Karnataka,-,-,-
B.C.S. Govt. P.G. College, ,Chhattisgarh,07722-237933,-,-
B.C.T. Kumaon Engineering College, ,Uttaranchal,-,-,-
"B.C.Y.R.C Institute of Diploma in Pharmacy , Nandanvan",NAGPUR ,Maharashtra,"0712-5601947,2710030",info@bcyrpharnacy.com,www.bcyrcpharmacy.org
B.D. MEMORIAL KALYAN SANSTHAN, ,Rajasthan,-,-,-
B.D. SHAH COLLEGE OF EDUCATION, ,Gujarat,-,college@bdshaheducation.info,-
B.D.M. Municipal Girls Degree College, ,Uttar Pradesh,-,-,-
B.D.M. TEACHER TRAINING COLLEGE, ,Haryana,-,-,-
B.D.S INSTITUTE OF MANAGEMENT, ,Uttar Pradesh,"0121-2601937,26033009",info@pdsim.com,-
B.D.S. GURUKUL OF EDUCATION, ,Uttar Pradesh,-,-,-
B.D.S. Law School, ,Uttar Pradesh,-,info@bdssl.net,http://www.bdssl.net/contact_us.html
B.E.A. COLLEGE OF EDUCATION, ,Karnataka,-,beasec@sancharnet.in,-
"B.E.A. School of Pharmacy , DAVANGERE",DAVANAGERE ,Karnataka,"+91-8192251302,250659,253550,230236",beasec@sancharnet.in,www.beadvg.org
B.E.S. COLLEGE OF EDUCATION, ,Karnataka,-,-,-
"B.E.S. Institute of Pharmacy , Bangalore",BANGALORE ,Karnataka,-,-,-
B.Ed. College, ,Maharashtra,-,-,-
B.ED. COLLEGE VADUJUTH KELAVANI MANDAL, ,Gujarat,-,bedcollege_vadu@yahoo.com,-
B.Ed. Teacher Training College, ,Bihar,-,-,-
B.G. PATEL COLLEGE OF EDUCATION (B.ED.), ,Maharashtra,-,-,-
B.G.S D.ED COLLEGE, ,Karnataka,-,-,-
B.G.S. B.ED COLLEGE, ,Karnataka,-,-,-
B.G.S.COLLEGE OF EDUCATION, ,Karnataka,-,-,-
B.H. College,BARPETA ,Assam,03666-260371,bhcollege1966@gmail.com,www.bhcollege.in
B.H.S.R & V.L.M. Degree College,WEST GODAVARI ,Andhra Pradesh,"08813–273430,273900",-,-
B.I. TEACHER TRAINING INSTITUTE, ,Kerala,-,-,-
B.I.T Institute of Technology, ,Andhra Pradesh,08556-249677,principal.bitit@gmail.com,www.bitit.org
"B.J Medical College, Ahmedabad", ,Gujarat,"079-26580074,26581024",bjmclis@dataone.in,www.bjmc.org
B.J. Medical College, ,Maharashtra,+912026128000,bgmcmuh@vsnl.net,www.bjmcpune.org
B.J.B. Morning College,BHUBANESWAR ,Orissa,-,-,-
B.J.S. Rampuria Jain College, ,Rajasthan,-,-,-
B.K. COLLEGE OF SYSTEMS & MANAGEMENT, ,Uttar Pradesh,-,-,-
B.K. Modi Govt. Pharmacy College,RAJKOT ,Gujarat,02717-241900-904,director.ip@nir,www.bhmgpc.com
B.K. SCHOOL OF BUSINESS MANAGEMENT,AHMEDABAD ,Gujarat,917926304811,placement@bkschool.org,www.bkshcool.org
B.K. TEACHER TRAINING COLLEGE, ,Haryana,-,-,-
B.K.Birla Institute of Engineering & Technology, ,Rajasthan,"01596-246038,244262",bkbiet@gmail.com,http://www.bkbiet.ac.in
B.K.INSTITUTE OF EDUCATION & TECHNOLOGY, ,Delhi,-,-,-
B.K.M.TEACHER TRAINING COLLEGE, ,Punjab,-,-,-
"B.K.Mody Govt. Pharmacy , Rajkot",RAJKOT ,Gujarat,+9102812387156,principal@bkmgpc.com,www.bkmgpc.com
B.K.R COLLEGE OF EDUN, ,Tamil Nadu,-,-,-
B.K.R. Memorial College,CUDDAPAH ,Andhra Pradesh,"08568–233390,92477-92266",-,-
B.K.R. TEACHER TRAINING INSTITUTE, ,Tamil Nadu,-,-,-
B.K.S.N. Government College, ,Madhya Pradesh,-,-,-
B.K.School of Business Management, ,Gujarat,"+917926304811,+917932407363",info@bkschool.org.in,http://www.bkschool.org.in/
B.L. ACADEMY OF HIGHER EDUCATION, ,Uttar Pradesh,-,-,-
B.L. Patil Polytechnic, ,Maharashtra,266157,ktspkpk@rediffmail.com,www.blppolykhopoli.com
B.L. TEACHER TRAINING COLLEGE, ,Haryana,-,-,-
B.L.. COLLEGE OF EDUCATION, ,Uttar Pradesh,-,-,-
"B.L.D.E. Association School of Pharmacy , BIJAPUR",BIJAPUR ,Karnataka,-,contact@bldea.org,www.bldea.org
B.L.D.E. University, ,Karnataka,"+918352262770,+918352262507,",office@bldeuniversity.org,www.bldeuniversity.org
B.L.D.E.A COLLEGE EDUCATION, ,Karnataka,-,"enquiry@bldea.org,",-
B.L.D.E.A's V.P. Dr. P.G. Halakatti College of Engineering and Technology, ,Karnataka,"(08352)261120,265384",principal@bldeacet.ac.in,http://bldeacet.ac.in/
"B.L.D.E.As College of Pharmacy , Bijapur",BIJAPUR ,Karnataka,+918352264004,-,www.bldeapharmacy.org
B.L.D.E.Associations Law College, ,Karnataka,08353-321240,bldealawcollege@yahoo.in,www.bladeajkd.com
B.L.M. Girls College, ,Punjab,-,-,-
"B.L.S. INSTITUTE OF MANAGEMENT, GHAZIABAD",GHAZIABAD ,Uttar Pradesh,"0120-2658405,2657654,2657632","bls_im@vsnl.net,bls.admission@vsnl.net",www.blsim.org
B.L.S. INSTOTUTE OF TECHNOLOGY MANAGEMANT, ,Haryana,-,-,-
B.M. COLLEGE, ,Madhya Pradesh,-,-,-
B.M. College Of Commerce, ,Maharashtra,-,-,-
B.M. COLLEGE OF EDUCATION, ,Uttar Pradesh,-,-,-
B.M. COLLEGE OF MANAGEMENT AND RESEARCH,INDORE ,Madhya Pradesh,"0731-3200836,6994153",pcst_indore@rediffmail.com,www.pgoi.in
B.M. College of Technology & Management, ,Haryana,0124-2015524,info@bmctm.com,www.bmctm.com
B.M. Institute of Mental Health, ,Gujarat,079-26578256/57/58,-,www.bminstitute.co.in
B.M. TEACHER TRAINING COLLEGE, ,Haryana,-,-,-
B.M. TEACHER TRAINING COLLEGE GARDI, ,Haryana,-,-,-
B.M.M TEACHER TRAINING INSTITUTE, ,Kerala,-,-,-
B.M.P.TEACHER TRAINING COLLEGE, ,Haryana,-,-,-
B.M.R. Degree College,MEDAK ,Andhra Pradesh,08454–234135,-,-
"B.M.R. Degree College, Siddipet",SIDDIPET ,Andhra Pradesh,"31015785,94400–52208",-,-
B. M. S. College of Law,BANGALORE ,Karnataka,080-26679336,-,http://www.bmslawcollege.org/
B.M.S. Evening College of Engineering,BANGALORE ,Karnataka,080-26622130-135080-26614357,mkv2759@yahoo.co.in,-
B.N College of Education, ,Bihar,"6420-273062,9973795165",bnce08@gmail.com,www.bnce.org
B.N. Bandodkar College Of Science, ,Maharashtra,-,-,-
B.N. College of Education, ,Jammu and Kashmir,-,-,-
B.N. College Of Physical Education, ,Rajasthan,-,-,-
B.N. College of Physical Education, ,Rajasthan,-,-,-
B.N. Degree College, ,Uttar Pradesh,-,-,-
B.N. DEGREE COLLEGE, ,Uttar Pradesh,-,-,-
B.N. Girls College, ,Rajasthan,"0294-2410325,2413181",info@bninstitute.org,www.bninstitute.org
B.N.A.S Mahavidyalay, ,Uttar Pradesh,-,-,-
B.N.Bahadur Institute of Management Sciences, ,Karnataka,0821-2419785/2419755,bims@bims.uni-mysore.ac.in,www.uni-mysore.ac.in
B.N.K.B. COLLEGE, ,Uttar Pradesh,-,-,-
B.N.K.B. Postgraduate College, ,Uttar Pradesh,-,-,-
B.N.M.A. College,BHADARAK ,Orissa,-,-,-
B.N.Patel Institute of Paramedical and Science (Paramedical Division), ,Gujarat,09574734450,bnparamedical@yahoo.com,www.bnparamedical.org.in
B.N.R.K. COLLEGE OF EDUCATION (D.ED), ,Karnataka,-,-,-
B.N.Saha DAV Teacher's' Training College, ,Jharkhand,-,"bnsdav_grd@rediff.com,bnsdavgiridih@hotmail.com",-
B.N.V. College, ,Uttar Pradesh,-,-,-
B.N.V. COLLEGE OF TEACHER EDUCATION, ,Kerala,-,bnv.webmaster@gmail.com,-
B.P. DIXIT B.ED. COLLEGE, ,Madhya Pradesh,-,-,-
B.P. Poddar Institute of Management &. Technology,KOLKATA ,West Bengal,033-25739607/25739608/25739609,info@bppimt.ac.in,www.bppint.ac.in
B.P.C. Institute of Technology, ,West Bengal,(03472)272452,-,-
B.P.C.A.s College Of Physical Education, ,Maharashtra,-,-,-
B.P.H.E. Societys Centre for Studies in Rural Development Institute of Social Work and Research, ,Maharashtra,-,-,-
B.P.INFOTECH, ,Delhi,-,-,-
B.P.Marine Academy, ,Madhya Pradesh,00-91-22-27574082/27565179/27562179,bpmarine.academy@gmail.comadmin@bpmarine.in/rcsi,www.bpmarineacademy.in
B.P.S. College of Education, ,Haryana,-,-,-
B.P.S. Institute of Polytechnic, ,Haryana,01263-283626,-,http://www.bpswomenuniversity.ac.in/
"B.P.S. Mahila Polytechnic , KHANPUR KALAN",SONIPAT ,Haryana,01263283627,berwal_suhani@yahoo.com,www.bpswomenuniversity.ac.in
B.P.S. TEACHER TRAINING COLLEGE, ,Haryana,-,-,-
B.P.S. TEACHER TRAINING COLLEGE, ,Haryana,-,-,-
B.P.Sulakhe Commerce College, ,Maharashtra,-,-,-
B.R Ambedkar University, ,Uttar Pradesh,9756208964,aagni53@gmail.com,-
B.R. CHOUDHARY TEACHERS TRAINING COLLEGE, ,Rajasthan,-,-,-
B.R. KABRA INSTITUTE OF ADVANCED STUDIES IN EDUCATION, ,Rajasthan,-,sgktc@yahoo.com,-
B.R. KHOKHAR TEACHER TRAINING SCHOOL, ,Rajasthan,-,-,-
"B.R. Nahata College of Pharmacy , MANDSAUR",MANDSAUR ,Madhya Pradesh,"07422-255734,07422-285001","webmaster@brncop.com,director@brncop.com",www.brncop.org
B.R. Polytechnic College, ,Rajasthan,99289-54286,brpolytechnic@gmail.com,-
B.R. POST GRADUATE COLLEGE, ,Uttar Pradesh,-,-,-
B.R. TEACHER TRAINING COLLEGE, ,Haryana,-,-,-
B.R. TEACHER TRAINING COLLEGE, ,Haryana,-,-,-
B.R.B.S Degree College, ,Uttar Pradesh,-,-,-
B.R.D. Medical College, ,Uttar Pradesh,-,info@brdmc.org,-
B.R.M. Govt. Law College, ,Assam,0361-2541510,-,http://www.brmgovtlawcollege.org.in/
B.R.M. TEACHER TRAINING COLLEGE, ,Haryana,-,-,-
B.R.M.TEACHER TRAINING COLLEGE, ,Haryana,-,-,-
B.R.R & G.K.R. Chambers Degree College,PALAKOL ,Andhra Pradesh,08814–229521,-,-
"B.R.S. Institute of Medical Sciences Dental College & Hospital, Panchkula", ,Haryana,"01733-256033,698031","info@brsdental.org,principal@brsdental.org",www.brsdental.org
B.R.TEACHER TRAINING COLLEGE, ,Haryana,-,-,-
B.R.TEACHER TRAINING COLLEGE, ,Rajasthan,-,-,-
B.R.TEACHERS TRAINING COLLEGE, ,Rajasthan,-,-,-
B.R.V. TEACHER TRAINING INSTITUTION, ,Karnataka,-,-,-
"B.S & J.R. Degree College, Tekkali",TEKKALI ,Andhra Pradesh,"08945–244423,244823",-,-
B.S college, ,Orissa,8984113597,-,-
"B.S. Anangpuria Institute of Pharmacy , Faridabad",FARIDABAD ,Haryana,"+91-129-2206750/53,+91-129-2206952","info@anangpuria.com,admissions@anangpuria.com",www.anangpuria.com
B.S. Anangpuria Institute of Technology & Management, ,Haryana,0129-2206750-53,admission@anangpuria.com/info@anangpuria.com,www.anangpuria.com
B.S. Anangpuria Instt. of Pharmacy, ,Haryana,"0129-2206753,2206750",bsaip@bsact.org,www.bsaip.org
B.S. Negi Mahila Pravidhik Prashikshan Sansthan (ONGC), ,Uttaranchal,"(0135)2795693,2756112",bsnegi06@yahoo.co.in,http://ww2.bsnegimahilapolytechnic.com/
B.S. TEACHER TRAINING COLLEGE, ,Haryana,-,-,-
B.S.A. College, ,Uttar Pradesh,-,-,-
B.S.ANANGPURIA INSTITUTE OF TECHNOLOGY & MANAGEMENT, ,Haryana,-,-,-
B.S.M. (P.G.) College, ,Uttaranchal,-,-,-
B.S.M. B.ED COLLEGE, ,Uttaranchal,-,-,-
B.S.M. B.ED. COLLEGE, ,Uttaranchal,-,-,-
B.S.MEMORIAL TEACHER TRAINING COLLEGE, ,Rajasthan,-,-,-
B.S.N. Vocational College, ,Uttar Pradesh,-,-,-
B.S.Negi Mahila Pravidhik Prashikshan Sansthan, ,Uttaranchal,-,-,-
B.S.R. College of Science and Technology,GOKAVARAM ,Andhra Pradesh,-,-,-
B.S.R. College of Special Education for Mentally Retarded,ANANTAPUR ,Andhra Pradesh,08554-273074,-,-
"B.S.R. Degree College, Peddapuram",PEDDAPURAM ,Andhra Pradesh,-,-,-
B.S.S Mahavidyalaya Copaganj, ,Uttar Pradesh,-,-,-
B.S.S. EDUCATIONAL SOCIETY, ,Kerala,-,-,-
B.S.S.B. Degree College,GUNTUR ,Andhra Pradesh,08645–256124,-,-
B.S.S.G. Government College, ,Punjab,-,-,-
B.T. Evening College,MADANPALLE ,Andhra Pradesh,"08571-224855,222007",-,-
B.T.I.E. (BABULAL TARABAI INSTITUTE OF EXCELLENCE), ,Madhya Pradesh,-,-,-
B.T.K COLLEGE OF EDUNCATION, ,Tamil Nadu,-,-,-
B.T.K TEACHER TRAINING INSTITUTE, ,Tamil Nadu,-,-,-
B.T.L. COLLEGE OF EDUCATION, ,Karnataka,"080-7833055,7835250,7835251",principal.btlit@gmail.com,www.btlit.ac.in
"B.T.T.I. Pilani, Jhunjhunu", ,Rajasthan,01596-242362,principalbtti@gmail.com,-
B.V & S.P.M. Degree College,ONGOLE ,Andhra Pradesh,-,-,-
B.V. INSTITUTE OF MGT & RES,DELHI ,Delhi,-,bmir@del3net.in,-
"B.V. Instt.of Pharmacy , NAVI MUMBAI",MUMBAI ,Maharashtra,-,-,-
B.V.R & L.K College,PRAKASAM ,Andhra Pradesh,"08593–252367,252746",-,-
B.V.R. Degree College,KURNOOL ,Andhra Pradesh,"08514–233322,233221",-,-
B.V.V. Sanghas Basaveshwar Law College, ,Karnataka,-,-,-
B.V.V. Sanghas Basaveshwar Law College, ,Karnataka,-,-,-
"B.V.V. Sanghas Hanagal Shri Kumareshwar College of Pharmacy , Bagalkot",BAGALKOT ,Karnataka,"08354-220689,220702","info@bws-hskcop.ac.in,chairman@becbgk.edu",www.bvvs-hskcop.ac.in
B.V.V.S BASAVESHWAR COLLEGE OF PHYSICAL EDUCATION, ,Karnataka,-,-,-
B.V.V.S'S INSTT. OF MGT. STUDIES,BANGALORE ,Karnataka,08354-23389308354-433887,bimsmbabgk@rediffmail.com,-
B.V.V.S. COLLEGE OF EDUCATION, ,Karnataka,-,-,-
"B.V.V.S. Hangal Shri Kumareshwara, School of Pharmacy, BAGALKOT",BAGALKOT ,Karnataka,08354-220008,info@bvvs-hskcop.ac.in,www.bvvs-hskcop.ac.in
B.V.V.SANGHA S BASAVESHVAR TEACHER TRAINING INSTITUTE, ,Karnataka,-,-,-
B.V.V.SANGHAS BASAVESHWARA COLLEGE OF PHYSICAL EDUCATION, ,Karnataka,-,-,-
BAB MEHER SINGH MEMORIAL COLLEGE OF ELEMENTARY TEACHER TRAINING, ,Punjab,-,-,-
BAB-E-REHMAT EDUCATIONAL TRUST, ,Maharashtra,-,-,-
BABA BALAK NATH TEACHER TRAINING COLLEGE, ,Himachal Pradesh,-,-,-
"Baba Banda Bahadur School Of Nursing , Faridkot",FARIDKOT ,Punjab,-,-,-
Baba Banda Singh Bahadur Engineering College,PATIALA ,Punjab,01676-273162,info@bbsbec.ac.in,-
Baba Barua Das Degree College, ,Uttar Pradesh,-,-,-
BABA BHAGWAN DAS TEACHERS TRAINING COLLEGE, ,Rajasthan,-,-,-
Baba Bhuteshwar College of Polytechnic, ,Rajasthan,9887777898,bbcpbaseri@gmail.com,-
Baba Budha College, ,Punjab,-,-,-
BABA FARID COLLEGE OF MANAGEMENT & TECHNOLOGY, ,Punjab,0164-2786061,principalbfcmt@babafaridgroup.com,www.bfcmt.com
"Baba Farid College Of Nursing , Faridkot",FARIDKOT ,Punjab,-,-,-
"Baba Farid Medical Institute For Nursing , Kotkapura", ,Punjab,-,-,-
"Baba Farid Medical Institute For Nursing , Kotkapura", ,Punjab,-,-,-
BABA FARID TEACHER TRAINING COLLEGE, ,Punjab,-,-,-
Baba Farid University, ,Punjab,"91-01639-256232,256236",-,http://bfuhs.ac.in/
BABA GAJADHAR DAS BALIKA P.G. COLLEGE, ,Uttar Pradesh,-,-,-
Baba Gajadhar Das Balika P.G. College, ,Uttar Pradesh,-,-,-
Baba Ganesh Datt Degree College, ,Uttar Pradesh,-,-,-
BABA GANGANATH TEACHERS TRAINING COLLEGE, ,Rajasthan,-,-,-
Baba Gayadeen Baidya Baba Ram Mahavidyalaya, ,Uttar Pradesh,-,-,-
Baba Ghulam Shah Badshah University, ,Jammu and Kashmir,01962-241001,bgsbu@rediffmail.com,http://www.bgsbuniversity.org/
BABA GYADEEN BALDYA BABURAM MAHAVIDYALAYA, ,Uttar Pradesh,-,-,-
"Baba Hari Dass College ofPharmacy & Technology, Jharoda Kalan",DELHI ,Delhi,011-25315280,-,-
"Baba Hari Dass Institute Of Nursing Education , Delhi",DELHI ,Delhi,-,-,-
Baba Hira Singh Bhattal Institute of Engineering and Technology, ,Punjab,01676-273162,"director.bhsbiet@gmail.com,info@bhsbiet.ac.in,admissions@bhsbiet.ac.in",-
"Baba Isher Singh Polytechnic , Moga",MOGA ,Punjab,"0925-729-5601,0925-728-5404,0925-729-2604",info@bisinstitutes.com,www.bisinstitutes.com
BABA JAI RAM DAS TEACHER TRAINING COLLEGE, ,Haryana,-,-,-
"Baba Jaswant Singh Dental College Hospital & Research Institute, Ludhiana",LUDHIANA ,Punjab,"+91-161-2677367,2677702",info@bjsdentalcollege.com,www.bjsdentalcollege.com
BABA KE TEACHER TRAINING COLLEGE, ,Punjab,-,-,-
BABA KE TEACHER TRAINING COLLEGE, ,Punjab,-,-,-
BABA KHETANATH MAHILA SHIKSHAK PRASHIKSHAN MAHAVIDYALAYA, ,Rajasthan,-,-,-
BABA KHETANATH TEACHER TRAINING COLLEGE, ,Haryana,-,-,-
"BABA KHYALL NATH SHIKSHA SAMITI,", ,Haryana,-,-,-
BABA KIRPAL DAS TEACHER TRAINING COLLEGE FOR WOMAN, ,Himachal Pradesh,-,-,-
BABA KIRPAL DAS TEACHER TRAINING COLLEGE FOR WOMAN, ,Himachal Pradesh,-,-,-
