H A College Commerce, ,Gujarat,-,-,-
H C Boraiah Memorial Sc St First Grade College, ,Karnataka,-,-,-
H C D G College, ,Assam,-,-,-
"H C T School Of Nursing ,Baran", ,Rajasthan,-,-,-
H C Women'S College, ,Chhattisgarh,-,-,-
H D Jain College, ,Bihar,-,-,-
H H B Kotak Institute Science, ,Gujarat,-,-,-
"H H Bhadrabahu Swamiji Nursing School , Belgaum",BELGAUM ,Karnataka,-,-,-
"H I C T A N M School , Gwalior",GWALIOR ,Madhya Pradesh,-,-,-
"H I C T College , Gwalior",GWALIOR ,Madhya Pradesh,-,-,-
"H I C T G N M College,Gwalior",GWALIOR ,Madhya Pradesh,-,-,-
"H K E S College Of Nursing , Gulbarga",GULBARGA ,Karnataka,-,-,-
"H K E S Womens Polytechnic, Gulbarga", ,Karnataka,-,-,-
H K E S' Smt Chinamma Bisappapatil Arts Commerce College Karnataka, ,Karnataka,-,-,-
H K E Society M S I Arts Science Degree College, ,Karnataka,-,-,-
H K E Society Polytechnic, ,Karnataka,08472232465,-,-
"H K E Societys College Of Nursing,Gulbarga", ,Karnataka,220337/221532,contact@hkesociety.org,http://www.hkesociety.org
"H K E Societys School Of Nursing , Gulbarga",GULBARGA ,Karnataka,-,-,-
H K E Socity Polytechnic, ,Karnataka,08532251110,-,-
H K E Socity'S A V Patil Degree College Of Arts Science Commerce, ,Karnataka,-,-,-
H K E Socity'S A V Patil Degree College Of Arts Science Commerce, ,Karnataka,-,-,-
H K E Socitys Basaveshwar College Education, ,Karnataka,-,-,-
H K E'S Smt V G College For Women'S, ,Karnataka,-,-,-
H K Es S S Margol College Arts Science Commerce Shasabad, ,Karnataka,-,-,-
H K Es Sri Prabhu Arts Science And J M Bohra Commerce College Sholapur, ,Karnataka,-,-,-
H K H College,THENI ,Tamil Nadu,-,-,-
H K Institute of Management Studies and Research, ,Maharashtra,+91?22?26774639/26774588,mba.admissions@hkcollege.ac.in,http://www.hkimsr.edu.in
"H K L College Of Nursing , Firozpur",FIROZPUR ,Punjab,-,-,-
H K Veerana Gowdh First Grade College, ,Karnataka,-,-,-
H L G Government College Tauru, ,Haryana,-,-,-
H L Institute Commerce, ,Gujarat,-,-,-
H L Institute Commerce C O H L Commerce College Comp Gujarat, ,Gujarat,-,-,-
H L Institute Computer Applications, ,Gujarat,-,-,-
H L Patel Arts And Commerce College, ,Gujarat,-,-,-
H L. M GIRLS COLLEGE, ,Uttar Pradesh,-,-,-
"H M R School Of Nursing , Bangalore",BANGALORE ,Karnataka,-,-,-
"H M S Polytechnic, Tumkur", ,Karnataka,"9449305305,988612182",-,-
H M S Rural Polytechnic, ,Karnataka,"9449305305,9886121682",-,-
H M V Arts And Commerce College, ,Gujarat,-,-,-
H Madhya Pradeshatel Institute English Training And Research, ,Gujarat,-,-,-
H N Doshi Arts R N Doshi College Commerce, ,Gujarat,-,-,-
"H N S School Of Nursing , Gulbarga",GULBARGA ,Karnataka,-,-,-
H P P C Government First Grade College, ,Karnataka,-,-,-
H P S College, ,Bihar,-,-,-
H R College Amanour, ,Bihar,-,-,-
H R College Bihar, ,Bihar,-,-,-
H R Sri Ramalu Memorial Arts Science College, ,Karnataka,-,-,-
H S College Bihar, ,Bihar,-,-,-
H S College Haveli Hkharagpur, ,Bihar,-,-,-
H. B. Patel Institute Of Diploma Engg. & Technology, ,Gujarat,-,hbpateldiploma@gmail.com,www.hbpateldiplomacollege.com
H. K. E. Societys Seth Shankarlal Lahoti Law College,GULBARGA ,Karnataka,"08472-233056,08472-246135,9141714810",snypy@yahoo.comksbsharan@gmail.com,www.geocities.com/ssl.lawcollege
H. N. B Garhwal University,PAURI ,Uttaranchal,01368-222275,-,-
H. S. Law College, ,Uttar Pradesh,"05742-234408,9412281522",-,-
H.B. B.ED. COLLEGE, ,Maharashtra,-,-,-
H.B.T. Institute, ,Uttar Pradesh,-,-,-
H.C. P.G.College, ,Uttar Pradesh,-,-,-
H.D. TEACHER TRAINING INSTITUTE, ,Rajasthan,-,-,-
H.D.TEACHER TRAINING COLLEGE, ,Haryana,-,-,-
H.Govindrao Pansare Mahavidyalaya, ,Maharashtra,-,-,-
H.H. MARTHOMA MATHEWS TEACHER TRAINING COLLEGE, ,Kerala,-,-,-
H.H. Memorial Law College, ,Karnataka,-,-,-
H.H. Memorial Law College, ,Karnataka,-,-,-
H.H. The Rajas College,PUDUKOTAI ,Tamil Nadu,04322:221558,info@hhrajahs.com,:www.hhrajahs.com
H.I.M. GIRLS COLLEGE, ,Uttar Pradesh,-,-,-
H.I.S. Degree College,EAST GODAVARI ,Andhra Pradesh,08865–272423,hiscollegeadd@yahoo.co.in,-
H.J. INSTITUTE OF EDUCATION & TECHNOLOGY, ,Haryana,-,-,-
H.J. Thim College of Arts & Science, ,Maharashtra,-,-,-
H.K.C.C..M. INSTITUTE OF MANAGEMENT RESEARCH & DEVELOPMENT,AHMEDNAGAR ,Maharashtra,0241-2324898,imrrd@india.com,-
H.K.D.E. TRUSTS COLLEGE OF EDUCATION, ,Karnataka,-,-,-
"H.K.D.E.Ts Dental College, Hospital & Research Intitute, Bidar",BIDAR ,Karnataka,"08483-270381,271963",-,www.hkdetdentalcollege.com
"H.K.E. Soceitys Narayan Shree Homoeopathic Medical College,",BHOPAL ,Madhya Pradesh,-,-,-
H.K.E. Societys P.D.A. Engineering College, ,Karnataka,-,-,-
"H.K.E. Societys, S. Nijalingappa Institute of Dental Sciences & Research , Gulbarga",GULBARGA ,Karnataka,08472-247745,dental@hkesociety.org,www.dental.hkesociety.org
"H.K.E.S.s College of Pharmacy , Gulbarga",GULBARGA ,Karnataka,"(08472)(O)221392,(R)235186,(M)9844439453",hkescop1111@rediffmail.com,www.pharmacy.hkesociety.org
H.K.E.SOCIETY S BASAVESHWAR COLLEGE OF EDUCATION, ,Karnataka,-,-,-
H.K.INSTITUTE OF MANAGEMENT STUDIES & RESEARCH,MUMBAI ,Maharashtra,-,admissions@hkcollege.ac.in,-
H.K.R.H. College,THENI ,Tamil Nadu,-,howdia@sancharnet.in,-
H.K.T. TEACHER TRAINING COLLEGE, ,Punjab,-,-,-
H.L. AGRAWAL COLLEGE OF EDUCATION, ,Madhya Pradesh,-,-,-
H.L.M. COLLEGE, ,Uttar Pradesh,-,-,-
H.L.M. College, ,Uttar Pradesh,-,-,-
H.L.M. Law College,GHAZIABAD ,Uttar Pradesh,"0120-283343,9811017387(M),9999310385",-,-
H.L.Y. DEGREE COLLEGE, ,Uttar Pradesh,-,-,-
"H.M. Degree College, Punganur",PUNGANUR ,Andhra Pradesh,08581–250414,-,-
"H.M. Degree College, Rayachoti",RAYACHOTI ,Andhra Pradesh,"08561–254188,257847",-,-
H.M. TRAINING COLLEGE, ,Kerala,-,-,-
H.M.H.Degree College, ,Uttar Pradesh,-,-,-
"H.M.S. Education Society,H.M.S. College of Pharmacy , Tumkur",TUMKUR ,Karnataka,+919448083157/+919880483157,vp@hmsit.ac.in,www.hmsit.ac.in
H.N TEACHER TRAINING COLLEGE, ,Haryana,-,-,-
H.N. Bahuguna Degree College, ,Uttar Pradesh,-,-,-
H.N. SHUKLA COLLEGE OF MANAGEMENT STUDIES, ,Gujarat,0281-3298393,-,www.hnsmba.org
H.N.S.GARHWAL UNIVERSITY, ,Uttaranchal,-,-,-
H.O.INSTITUTE OF EDUCATION AND TECHNOLOGY, ,Haryana,-,-,-
"H.P. Govt. Dental College & Hospital , Shimla",SHIMLA ,Himachal Pradesh,0177-2658838,dirdhs-@nic.in,www.hp.gov.in
H.P. INSTITUTE OF MGT. STUDIES,SHIMLA ,Himachal Pradesh,-,krishnaeducationalsociety@yahoo.co.in,-
H.P.T. Arts & R.Y.K.Science College, ,Maharashtra,-,-,-
H.R. College Of Commerce & Economics, ,Maharashtra,-,-,-
H.R.D. Degree College,NARAYANGUDA ,Andhra Pradesh,23222973,-,-
"H.R.D. Degree College, Nalgonda",DEVERAKONDA ,Andhra Pradesh,-,-,-
H.R.Institute of Technology,GHAZIABAD ,Uttar Pradesh,"0120-2679179,2679173,2679175",hritgzb@gmail.com,www.hrit.ac.in
"H.R.Patel Institute of Pharmacy , Dhule",DHULE ,Maharashtra,"(02563)257599,9850223277","principal@hrpatelpharmacy.co.in,registrar@hrpatelpharmacy.co.in",www.hrpatelpharmacy.co.in
H. S. Law College,AGRA ,Uttar Pradesh,"05742-234408,9412281522",-,-
H.S.A. Degree College, ,Uttar Pradesh,-,-,-
H.V. Desai College Of Artsscience & Commcollege, ,Maharashtra,-,-,-
H.V.P. Mandal's College Of Gineering & Technology, ,Maharashtra,0721-2566566,principal@hvpmcoet.edu.in,http://www.hvpmcoet.edu.in/
H.V.TEACHER TRAINING INSTITUTE, ,Karnataka,-,-,-
HAARDIK TEACHER TRAINING COLLEGE, ,Punjab,-,-,-
HADI RANI TEACHER TRAINING COLLEGE, ,Rajasthan,-,-,-
HAESs Smt KA Jigalur Arts & Commerce College, ,Karnataka,-,-,-
HaesS Smt K A Jigalur Arts Commerce College, ,Karnataka,-,-,-
Hafiz Rehmat Khan Law College,CHANDAULI ,Uttar Pradesh,05882-258588,info@hrklawcollege.com,www.hrklawcollege.com/
Hahnemann Homoeopathic Medical College,BHOPAL ,Madhya Pradesh,-,-,-
Haindavi College,HYDERABAD ,Andhra Pradesh,55783920,-,-
HAIS PRE PRIMARY TEACHER TRAINING INSTITUTE, ,Kerala,-,-,-
"Haji Abdul Majid Memorial Nursing School , Nagaon",NAGAON ,Assam,-,-,-
Haji C.H. Mohammed Koya Memorial College for Advanced Studies, ,Kerala,"0470-2667302,2667617",enquiry@chmm.edu.in,www.chmm.edu.in
HAJI ISMAIL DEGREE COLLEGE, ,Uttar Pradesh,-,-,-
HAJI S.M.S. SHAIK JALALUDEEN TEACHER TRAINING INSTITUTE, ,Tamil Nadu,-,-,-
"Haji Sheik Ismail Polytechnic College, Nagapattinam", ,Tamil Nadu,04365293800,principal_hsipc@yahoo.com,www.hsicolleges.com
HAKEEM HARBANS SINGH NEW ERA TEACHER TRAINING COLLEGE, ,Haryana,-,-,-
Hakeem Mehtabuddin Hashmi College of Law, ,Uttar Pradesh,"9319462386,9358311284",-,-
"Hakim Kishori Lal School Of Nursing , Ferozepur",FIROZPUR ,Punjab,-,-,-
Halakura College,DHUBURI ,Assam,238098,-,-
"Halamma School Of Nursing , Bagalkot",BAGALKOT ,Karnataka,-,-,-
"Halamma School Of Nursing , Bagalkot",BAGALKOT ,Karnataka,-,-,-
HALAPPA KOTE B.ED COLLLEGE, ,Karnataka,-,-,-
Haldia Government College, ,West Bengal,-,-,-
"Haldia Institute of Dental Sciences and Research, Midnapore",MEDINIPUR ,West Bengal,+91-3222-269057/269058,hidsar_haldia@yahoo.com,www.hidsar.org
"Haldia Institute Of Nursing Science , Medinipur",MEDINIPUR ,West Bengal,-,-,-
"Haldia Institute Of Nursing Science , Purba Medinipur", ,West Bengal,-,-,-
Haldia Institute Of Technology.,EAST MEDINIPUR ,West Bengal,03224-252800/255010,hithaldia@yahoo.com,www.hit-haldia.net
Haldia Law College,MEDINIPUR ,West Bengal,03224-255355/255356,admission@hlc.in,www.hlc.in/
Halflong Government College, ,Assam,-,-,-
HALIM MUSLIM COLLEGE, ,Uttar Pradesh,-,-,-
Halim Muslim Degree (PG) College, ,Uttar Pradesh,-,-,-
HALIM MUSLIM P.G. COLLEGE, ,Uttar Pradesh,-,-,-
HALLMARK BUSINESS SCHOOL,TRICHY ,Tamil Nadu,-,info@hbs.ac.in,-
"Halo Nursing School,Osmanabad",OSMANABAD ,Maharashtra,-,-,-
HAMANTH MEMORIAL EDUCATION SOCIETY, ,Karnataka,-,-,-
"Hamdard Institute of Medical Sciences & Research, New Delhi", ,Delhi,26059688,shridhar.dwivedi@gmail.com,http://himsr.org/
HAMDARD WELFARE TRUSTS ASHRAFEE TEACHER TRAINING INSTITUTE, ,Karnataka,-,-,-
HAMEED PIYARE COLLEGE EDUCATION, ,Karnataka,-,-,-
Hamidabad College,NAGAON ,Assam,-,-,-
Hamidia Girls Degree College, ,Uttar Pradesh,-,-,-
"Hamidia Hospital , School Of Nursing,Bhopal",BHOPAL ,Madhya Pradesh,-,-,-
HAMIRPUR COLLEGE OF ELEMENTARY TEACHER EDUCATION, ,Himachal Pradesh,-,-,-
HANAMGOWDA PATIL SMARA TEACHER TRAINING INSTITUTE, ,Karnataka,-,-,-
Handa College Education, ,Jammu and Kashmir,-,-,-
HANDIA (PG) COLLEGE, ,Uttar Pradesh,-,-,-
Handia Degree College, ,Uttar Pradesh,-,-,-
HANDIA P.G. COLLEGE, ,Uttar Pradesh,-,-,-
"Handia Polytechnic, Handia", ,Uttar Pradesh,05332-284024,-,-
HANDIA POST GRADUATE COLLEGE, ,Uttar Pradesh,-,-,-
HANDIA POST GRADUATE COLLEGE, ,Uttar Pradesh,-,-,-
Handique Girls' College,KAMRUP ,Assam,0361-2543793,info@hgcollege.org,-
HANEEFA KUNJU MEMORIAL COLLEGE OF EDUCATION, ,Kerala,-,-,-
Hans Raj College, ,Delhi,"+91-11-27667747,+91-11-27667458",contact@hansrajcollege.co.in,www.hansrajcollege.com
HANS RAJ DAV TEACHER TRAINING COLLEGE, ,Punjab,-,-,-
Hans Raj Mahila College, ,Punjab,-,-,-
HANS RAJ MEMORIAL TEACHER TRAINING COLLEGE, ,Punjab,-,-,-
HANS TEACHERS TRAINIG COLLEGE, ,Rajasthan,-,-,-
HANSARAJ JEEVANDAS COLLEGE OF EDUCATION, ,Maharashtra,-,-,-
Hansraj Jiwandas College Of Education, ,Maharashtra,-,-,-
HANTRAN TEACHERS TRAINING COLLEGE, ,Rajasthan,-,-,-
Hanuman Vyamshala Krida Mandals Physical Education College, ,Maharashtra,-,-,-
"Hanumant School Of Nursing , Bhavnagar",BHAVNAGAR ,Gujarat,-,-,-
HANUMAT VIDYAPEETH WOMEN TEAVHERS TRAINING COLLEGE, ,Rajasthan,-,-,-
HAPPY CHILD SHIKSHA SAMITI, ,Haryana,-,-,-
HAPPY INSTITUTE OF EDUCATION, ,Haryana,-,-,-
HAPPY TEACHER TRAINING COLLEGE, ,Haryana,-,-,-
HAPPY VALLEY BUSINESS SCHOOL,COIMBATORE ,Tamil Nadu,0422-2656523/2656623/2656923,bschool@happyvalley.in,www.happyvalley.in
HAR SAHAI P.G. COLLEGE, ,Uttar Pradesh,-,-,-
Harakejamd Chouradia College, ,Madhya Pradesh,-,-,-
"Haralaiah Polytechnic, Bhalki", ,Karnataka,08484262356,-,-
HARANAHALLI RAMASWAMY INSTITUTE OF HIGHER EDU,HASSAN ,Karnataka,08172â€“245551,hriheh@gmail.com,http://www.hriheh.org
Harasankar Bhattacharya Institute of Tech. & Mining, ,,(0341)2444196,-,-
"Harbilas Bal & Mahila Chikitsalay , Lucknow",LUCKNOW ,Uttar Pradesh,-,-,-
Harcourt Butler Technological Institute,KANPUR ,Uttar Pradesh,0512-2534001-05,hbti@hbti.edu,-
HARDEKR MANJAPPA D ED COLLEGE, ,Karnataka,-,-,-
Harhi College, ,Assam,-,-,-
HARI ADARSH INSTITUTE OF EDUCATION, ,Uttar Pradesh,-,-,-
Hari College of Law,SAHARANPUR ,Uttar Pradesh,-,info@harieducation.org,-
"Hari College of Law,",SAHARANPUR ,Uttar Pradesh,01331-243737,hit_nakursancharnet.in,-
Hari Das Institute of Legal Studies And Research,MATHURA ,Uttar Pradesh,-,-,-
HARI INSTITUTE OF TECHNOLOGY, ,Uttar Pradesh,-,-,-
HARI OM SHIV OM TEACHER TRAINING COLLEGE, ,Haryana,-,-,-
HARI SEWA SANSKRIT SHIKSHAK PRASHIKSHAN VIDYALAYA, ,Rajasthan,-,-,-
Hari Shankar Prasad Law College,BALLIA ,Uttar Pradesh,05498-236342,admin@jamunaramdegreecollege.com,www.jamunaramdegreecollege.com
"Hari Uday Institute Of Nursing Science,Morena", ,Madhya Pradesh,-,-,-
Haribai Warpudkar Polytechnic, ,Maharashtra,0245224979,warpudkar.poly@gmail.com,www.lhwpoly.org
Harichandra Mahavidhyalaya,VARANASI ,Uttar Pradesh,-,-,-
Harideojoshi Rajkiya Kanya Mahavidyalaya, ,Rajasthan,-,-,-
Harihar Prasad Mahavidyalaya, ,Uttar Pradesh,-,-,-
HARIHARESHWARA VIDYA SAMSTHE VIVEKANANDA T.T.I, ,Karnataka,-,-,-
Harinarain Singh Institute of Teacher's Education, ,Bihar,-,-,-
Haringata Mahavidyalya, ,West Bengal,-,-,-
HARISH CHANDRA (PG) COLLEGE, ,Uttar Pradesh,"0542-2440042,09919986360",-,-
Harish Chandra Degree College, ,Uttar Pradesh,-,-,-
HARISH CHANDRA POST GRADUATE COLLEGE, ,Uttar Pradesh,"0542-2503693,2502918",fmthcpg@sify.com,-
HARISH MORE SHARIRIK SHIKSHAN MAHAVIDYALAYA, ,Maharashtra,-,-,-
HARISHCHANDRA DEGREE COLLEGE, ,Uttar Pradesh,-,-,-
Harishchandra Mahavidyalaya, ,Uttar Pradesh,-,-,-
"Haritha College Of Nursing , East Godavari",EAST GODAVARI ,Andhra Pradesh,-,-,-
"Haritha School Of Nursing , Kakinada",KAKINADA ,Andhra Pradesh,-,-,-
Harivallabhdas Kalidas Arts College, ,Gujarat,-,-,-
Harkamaya College of Education, ,Sikkim,03592232384,hce_gtk@yahoo.in,www.hcesikkim.org
HARLAL INSTITUTE OF MANAGEMENT & TECHNOLOGY,NOIDA ,Uttar Pradesh,0120-2326510,himtnoida@yahoo.co.in,-
HARLAL INSTITUTE OF MANAGEMENT & TECHNOLOGY, ,Uttar Pradesh,-,-,-
Harlal School of Law, ,Uttar Pradesh,(91)-(120)-2326880/2326510/2326817,"info@hsl.ac.in,principal@hsl.ac.in",www.himt.ac.in
HARMAN DAS LEKHRAJ INSTITUTE OF EDUCATION, ,Rajasthan,-,-,-
Harmukh College Education, ,Jammu and Kashmir,-,-,-
Harsahay Degree College, ,Uttar Pradesh,-,-,-
"Harsarn Dass Dental College,",GHAZIABAD ,Uttar Pradesh,"011-2768449,3200049,0120-2768449,,2768797,",-,-
"Harsarn Dass Dental College, Ghaziabad",GHAZIABAD ,Uttar Pradesh,"011-2768449,3200049,0120-2768449,,2768797,",-,-
HARSH MAHAVIDYALAYA, ,Uttar Pradesh,-,-,-
Harsh Mahila Mahavidyalaya, ,Uttar Pradesh,-,-,-
"Harsh School Of Nursing,Buldhana",BULDANA ,Maharashtra,-,-,-
HARSH TEACHER TRAINING COLLEGE, ,Haryana,-,-,-
HARSH TEACHER TRAINING COLLEGE, ,Rajasthan,-,-,-
"Harsha College Of Nursing , Bangalore",BANGALORE ,Karnataka,-,-,-
"Harsha School Of Nursing,Bangalore",BANGALORE ,Karnataka,-,-,-
"Harshit School Of Nursing,Lucknow",LUCKNOW ,Uttar Pradesh,-,-,-
HARSHIT TEACHERS TRAINING INSTITUTE, ,Karnataka,-,-,-
Harshith Group of Institutions, ,Andhra Pradesh,"08414?237009,9912934642,9848088760",info@hgih.ac.in,www.hgih.ac.in
HARUDHARA SHIKSHAK PRASHIKSHAN MAHAVIDYALAYA, ,Rajasthan,-,-,-
Harur Muthu Arts And Science College For Women,DHARMAPURI ,Tamil Nadu,-,-,-
Harvansh Daya Parkash Shyamo Devi Degree College, ,Uttar Pradesh,-,-,-
"Harvard Degree College, Thondangi",EAST GODAVARI ,Andhra Pradesh,"08854–276320,276420",-,-
"Haryana College Of Nursing , Sirsa",SIRSA ,Haryana,-,-,-
Haryana College of Special Education & Rehabilitation,FARIDABAD ,Haryana,"09818374065,9310030031",hesesr@yahoo.com,-
HARYANA COLLEGE OF TEACHER TRAINING, ,Haryana,-,-,-
Haryana College of Technology & Management., ,Haryana,"01746-280100-03,9810005965","hctm98@rediffmail.com,hctm98@yahoo.com",http://www.hctmkaithal-edu.org/
HARYANA INSTITUTE OF BUSINESS MANAGEMENT,BAHADURGARH ,Haryana,-,-,-
HARYANA INSTITUTE OF EDUCATION, ,Haryana,-,-,-
Haryana Institute of Technology, ,Haryana,01276-645158,ceohitgroup@gmail.com,www.hit.net.in
Haryana Polytechnic Institute, ,Haryana,"094663-65368,09416372029,",-,-
HARYANA SCHOOL OF BUSINESS,HISSAR ,Haryana,-,-,-
"Haryana School Of Nursing , Sirsa",SIRSA ,Haryana,-,-,-
HARYANA SHEKWATI DRAHMCHARYA ASHRAM, ,Haryana,-,info@haryanashekhawatiashram.org,-
HARYANA TEACHER TRAINING COLLEGE, ,Haryana,-,-,-
HARYANA TEACHER TRAINING COLLEGE, ,Haryana,-,-,-
HARYANA TEACHER TRAINING COLLEGE, ,Haryana,-,-,-
HASANAMBA COLLEGE OF EDUCATION, ,Karnataka,-,-,-
HASANAMBA COLLEGE OF EDUCATION, ,Karnataka,-,-,-
Hasananmba College Education, ,Karnataka,-,-,-
HASHMATRAI AND GANGARAM HIMATHMAL MANSUKHANI INSTITUTE OF MANAGEMENT,THANE ,Maharashtra,0251-3951485,hsnc-mms2005@yahoogroups.com,www.hsncb-mgmt.org.in
Hashmi Girls Degree College, ,Uttar Pradesh,-,-,-
Hashu Advani College of Special Education,CHEMBUR ,Maharashtra,022-25531041/25530451/25561040,-,-
Hasmukh Goswami College of Engineering, ,Gujarat,(02718)247138,hgceahmedabad@gmail.com,www.hgce.org
Hasnath College For Women, ,Karnataka,-,-,-
"Hassan Institute of Medical Sciences, Hasssan", ,Karnataka,08172-250330,info@hims-hassan.org/directorhims@yahoo.com,www.hims-hassan.org
Hassan Shah Kohie Hami Memorial Government Degree College, ,Jammu and Kashmir,-,-,-
Hasvita Institute of Engineering & Technology HIET,KEESARA ,Andhra Pradesh,08418–284883/28482/284880,aohiet@gmail.com,www.hasvita.com
Hatidhura College, ,Assam,-,-,-
Havanur College of Law,BANGALORE ,Karnataka,080-64536800/64536798/99,admin@havnurcollege.org,www.havnurcollege.org/
HAVERD INSTITUTE OF MANGEMENT & TECHNOLOGY, ,Uttar Pradesh,-,-,-
HAWABAG WOMANS COLLEGE, ,Madhya Pradesh,-,-,-
Hawabagh Womens College, ,Madhya Pradesh,-,-,-
Hayagriva Polytechnic College, ,Tamil Nadu,"04132697279,04132697278,9443409393",hpcpdy@gmail.com,-
"Hayat Institute Of Nursing ,Lucknow",LUCKNOW ,Uttar Pradesh,-,-,-
HAYATHUL ISLAM ORPHANGE TEACHER TRAINING INSTITUTE, ,Kerala,-,-,-
"Hayward Institute Of Nursing & Science , Gwalior",GWALIOR ,Madhya Pradesh,-,-,-
"Hayward Institute Of Nursing & Sciences,Gwalior", ,Madhya Pradesh,-,-,-
HAZARI LAL DEGREE COLLEGE, ,Uttar Pradesh,-,-,-
HAZARI LAL DEGREE COLLEGE, ,Uttar Pradesh,-,-,-
"Hazaribag College of Dental Sciences and Hospital , Hazaribag",HAZARIBAG ,Jharkhand,"+919431141455,9431140322,ForMoreDetailsConta",info@hcdsh.com,www.hcdsh.com
HAZRAT SAYED FATEH SH VALI TEACHERS TRAINING INSTITUTE, ,Karnataka,-,-,-
Hbservicess, ,Tamil Nadu,9884987719,education@hbservices.in,http://www.hbservices.in/
HDPY B.ED COLLEGE, ,Kerala,-,-,-
"Healing Touch School Of Nursing , Hyderabad",HYDERABAD ,Andhra Pradesh,-,-,-
"Health & Family Welfare Training Centre , Amritsar",AMRITSAR ,Punjab,-,-,-
"Health & Hygiene Nursing Education Institute ,Alwar",ALWAR ,Rajasthan,-,-,-
"Health Taining And Research Centre , Arunachal Pradesh",EAST SIANG ,Arunachal Pradesh,-,-,-
"Health Worker Female Training Centre,Sikar", ,Rajasthan,-,-,-
"Health Worker mahila Trg Centre,Gorakhpur",GORAKHPUR ,Uttar Pradesh,-,-,-
"Health Worker mahila Trg. Centre , Almora",ALMORA ,Uttaranchal,-,-,-
"Health Worker mahila Trg. Centre , Dehradun",DEHRADUN ,Uttaranchal,-,-,-
"Health Worker mahila Trg. Centre , Haldwani",HALDWANI ,Uttaranchal,-,-,-
"Health Worker mahila Trg. Centre , Paurigarhwal", ,Uttaranchal,-,-,-
"Health Worker mahila Trg. Centre , Rampur", ,Uttar Pradesh,-,-,-
"Health Worker mahila Trg. Centre ,Gonda", ,Uttar Pradesh,-,-,-
"Health Worker mahila Trg. Centre ,Saharanpur",SAHARANPUR ,Uttar Pradesh,-,-,-
"Health Worker mahila Trg. Centre,Bahraich", ,Uttar Pradesh,-,-,-
"Health Worker mahila Trg. Centre,Basti",BASTI ,Uttar Pradesh,-,-,-
"Health Worker mahila Trg. Centre,Bijnore",BIJNOR ,Uttar Pradesh,-,-,-
"Health Worker mahila Trg. Centre,Deoria",DEORIA ,Uttar Pradesh,-,-,-
"Health Worker mahila Trg. Centre,Faizabad",FAIZABAD ,Uttar Pradesh,-,-,-
"Health Worker mahila Trg. Centre,Jhansi",JHANSI ,Uttar Pradesh,-,-,-
"Health Worker mahila Trg. Centre,Kheeri", ,Uttar Pradesh,-,-,-
"Health Worker mahila Trg. Centre,Lucknow",LUCKNOW ,Uttar Pradesh,-,-,-
"Health Worker mahila Trg. Centre,Mainpuri", ,Uttar Pradesh,-,-,-
"Health Worker mahila Trg. Centre,Mirzapur", ,Uttar Pradesh,-,-,-
"Health Worker mahila Trg. Centre,Moradabad",MORADABAD ,Uttar Pradesh,-,-,-
"Health Worker mahila Trg. Centre,Muzaffarnagar",MUZAFFARNAGAR ,Uttar Pradesh,-,-,-
"Health Worker mahila Trg. Centre,Pilibhit", ,Uttar Pradesh,-,-,-
"Health Worker mahila Trg. Centre,Pratapgarh", ,Uttar Pradesh,-,-,-
"Health Worker mahila Trg. Centre,Raibareli",BAREILLY ,Uttar Pradesh,-,-,-
"Health Worker mahila Trg. Centre,Shahjahanpur", ,Uttar Pradesh,-,-,-
"Health Worker mahila Trg. Centre,Sultanpur", ,Uttar Pradesh,-,-,-
"Health Worker mahila Trg. Centre,Varanasi",VARANASI ,Uttar Pradesh,-,-,-
"Health Workers Training School , Aizawal",AIZAWL ,Mizoram,-,-,-
"Heartland College Of Nursing , Bangalore",BANGALORE ,Karnataka,-,-,-
"Heavy Engg. Corp Ltd , School Of Nursing , Ranchi",RANCHI ,Jharkhand,-,-,-
HEERA LAL YADAV BALIKA DEGREE COLLEGE, ,Uttar Pradesh,"91-9415468242,+91-9452241953,+91-9415797940",-,http://hlygdc.com
Heeralal Yadav Balika Degree College, ,Uttar Pradesh,-,-,-
Heeralal Yadav Law College,LUCKNOW ,Uttar Pradesh,-,info@hlygdc.com,-
Helen Kellar's Institute of Research and Rehabilitation  for the Disabled Children,HYDERABAD ,Andhra Pradesh,040-27115266/08562-241593,helenkellers1@rediffmail.com,www.helenkellersinstitute.org
Helen Keller College of Special Education (HI),CUDDAPAH ,Andhra Pradesh,08562-241593,pdkhan62@redifmail.com,-
"Helen Keller Govt. Teacher Training Centre for the Visually Handicapped Children, Govt. of Karnataka",MYSORE ,Karnataka,-,-,-
Helen Kellers Institute of Deaf and Blind,MUMBAI ,Maharashtra,022-23087052/23018211,hkidbind@bom5.vsnl.net.in,-
Helen Kellers School for the Deaf,CUDDAPAH ,Andhra Pradesh,9849311680.,"ukpatanbaba@yahoo.com,hkaslp@gmail.com",-
"Helen Rose School Of Nursing,Yavatmal",YAVATMAL ,Maharashtra,-,-,-
"Help School Of Nursing , Vijayawada",VIJAYAWADA ,Andhra Pradesh,"0866-2440554,0866-2585204",-,-
HEMADRI B.ED COLLEGE, ,Karnataka,-,-,-
Hemchandracharya North Gujarat University,PATAN ,Gujarat,"91-2766-230456,230427,230133,230428",reg@ugu.ac.in,www.ngu.ac.in
HEMCHANDRACHARYA NORTH GUJARAT UNIVERSITY, ,Gujarat,"02766-220116,09925213800",hodmhm@ngu.ac.in,www.ngu.ac.in
Hemoprova Barbera Girls College, ,Assam,-,-,-
Hemwati Nandan Bahuguna Garhwal University, ,Uttaranchal,01346-252143(o),registrar.hnbgu@gmail.com,www.hnbgu.ac.in
Henry Baker College,KOTTAYAM ,Kerala,"0482-2291014,290096",-,-
Heramba Chandra College, ,West Bengal,-,-,-
Herambhu Business School, ,Andhra Pradesh,9396765179,-,http://www.herambhu.com/
"HerbalCross Institute of Pharmacy HIP , Cuttack",CUTTACK ,Orissa,-,-,-
HERITAGE COLLEGE OF PHYSICAL EDUCATION, ,Haryana,-,-,-
"Heritage Institute of Hotel and Tourism, Agra", ,Uttar Pradesh,"0562-2330935,2232833",info@hihtworld.com,http://www.hihtworld.com/agra/
"Heritage Institute Of Nursing & Paramedical Institute , Varanasi",VARANASI ,Uttar Pradesh,-,-,-
Heritage Institute of Technology.,KOLKATA ,West Bengal,0332243-0454/56/57/1255/56/57/58,admin@heritageeit.edu,www.heritageit.edu
HERITAGE INTERNATIONAL BUSINESS SCHOOL, ,Uttar Pradesh,-,-,-
"Heritage School Of Nursing & Paramedical Institute,Varanasi",VARANASI ,Uttar Pradesh,-,-,-
"Heritage School Of Nursing , Fatehabad", ,Haryana,-,-,-
Hetampur Rajbati Primary Teacher's Training Institute, ,West Bengal,-,-,-
"Hewett Polytechnic, Lucknow", ,Uttar Pradesh,0522-2325097,principalhpl14@gmail.com,hewettpolytechnic.org
"Hi Tech College of Pharmacy , Bhubaneswar",BHUBANESWAR ,Orissa,(808)933-7664,-,http://pharmacy.uhh.hawaii.edu/
"Hi Tech School Of Nursing , Khurda",KHURTA ,Orissa,-,-,-
Hi-Point College of Engineering & Technology, ,Andhra Pradesh,08417-253044to08417-253046,info@hipointcollege.com,http://www.hipointcollege.com/
Hi-Tech College of Engineering & Technology, ,Andhra Pradesh,"08413-235170,71",hitech_enggcollege@yahoo.co.in,http://www.htec.ac.in/
Hi-Tech Institute of Engineering,GHAZIABAD ,Uttar Pradesh,"0120-2765031,3226871",director@hiet.org,www.hiet.org
Hi-Tech Institute of Engineering & Management, ,Orissa,-,-,-
Hi-Tech Institute of Information & Technology, ,Orissa,"06755-223412,223413",info@hit.ac.in,www.hit.ac.in
HI-TECH INSTITUTE OF INFORMATION TECHNOLOGY (HIIT),JAYPORE ,Orissa,-,-,-
Hi-Tech Institute Of Technology,AURANGABAD ,Maharashtra,(0240)2553495/96,info@hightechengg.org,www.hitechengg.org
HI-TECH INSTITUTE OF TECHNOLOGY, ,Uttar Pradesh,-,-,-
"Hi-Tech Medical College & Hospital, Rourkela", ,Orissa,+91-661-2400751,vbctmchrourkela@yahoo.com,www.hi-techmedicalrkl.org
Hidayatullah National Law University,RAIPUR ,Chhattisgarh,771-4080114,registrar@hnlu.ac.in,www.hnlu.ac.in
Hidayatullah National Law University Hnlu,RAIPUR ,Chhattisgarh,"0771-4080117,4080114",registrar@hnlu.ac.in,http://hnlu.ac.in
Hierank Business School, ,Uttar Pradesh,95-1202400514,placement@hierank.org/info@hierank.org,http://www.hierank.org/
HIGHER EDUCATION OF TECHINCAL INSTITUTE, ,Uttar Pradesh,-,-,-
HIGHER SEC SCHOOL KALLUPPALA TEACHER TRAINING INSTITUTE, ,Tamil Nadu,-,-,-
"Hightech Polytechnic, Gowribidanur", ,Karnataka,-,-,-
