J B College, ,Assam,-,-,-
"J B Institute Of Nursing & Research , Gwalior",GWALIOR ,Madhya Pradesh,-,-,-
J B S Dhanour College, ,Bihar,-,-,-
J C E Trust Sanchalit Commerce College, ,Gujarat,-,-,-
J C T College of Engineering and Technology, ,Tamil Nadu,+914222636900+914222636902+914222636035,"admissions@sjct.co.in,admissions@jct.ac.in",http://www.sjct.co.in/
J C T TEACHER TRAINING INSTITUTE, ,Tamil Nadu,-,-,-
J D College of Engineering, ,Maharashtra,"(0712)2023001,2023002",info@jdcoe.in,http://www.jdcoe.in
"J D College Of Nursing, kadapa",HYDERABAD ,Andhra Pradesh,-,-,jdcollegeofnursing.com
J D S G College, ,Assam,-,-,-
"J D T Islam College Of Nursing , Calicut",CALICUT ,Kerala,-,-,-
"J D T Islam Orphanage Committee, School Of Nursing,Calicut",CALICUT ,Kerala,-,-,-
J D Womens' College, ,Bihar,0612-2283355,principal@jdwcpatna.com,-
"J E E School Of Nursing,jaipur",JAIPUR ,Rajasthan,-,-,-
"J E S Mother Teresa College Of Nursing , Bangalore North",BANGALORE ,Karnataka,-,-,-
"J E S Mother Teresa College Of Nursing,Bangalore",BANGALORE ,Karnataka,-,-,-
"J Eashwari Bai Memorial School Of Nursing , Secunderabad",SECUNDERABAD ,Andhra Pradesh,-,-,-
J G College Commerce, ,Karnataka,-,-,-
"J G College Of Nursing ,Ahmedabad",AHMEDABAD ,Gujarat,-,-,-
"J G College Of Nusing , Ahmedabad",AHMEDABAD ,Gujarat,-,-,-
"J G School Of Nursing , Ahmedabad",AHMEDABAD ,Gujarat,-,-,-
J J College Arrah, ,Bihar,-,-,-
J J College Bihar, ,Bihar,-,-,-
J J College Jharkhand, ,Jharkhand,-,-,-
"J J Institute Of Nursing, ,Pudukkottai",PUDUKOTAI ,Tamil Nadu,-,-,-
"J J School Of Nursing , Secunderabad",SECUNDERABAD ,Andhra Pradesh,-,-,-
J K College Education, ,Jammu and Kashmir,-,-,-
"J K College Of General Nursing , Etawah", ,Uttar Pradesh,-,-,-
"J K College Of Nursing & Para Medical , Coimbatore",COIMBATORE ,Tamil Nadu,-,-,-
J K Institute Of Applied Physics Technology, ,Uttar Pradesh,-,akgjkapt2000yahoo.Com,-
J K K Nataraja College Arts Science,SALEM ,Tamil Nadu,04288–261726,jkkncp@yahoo.com,www.jkknataraja.org
J K S College Mango, ,Jharkhand,-,-,-
J L N College, ,Bihar,-,-,-
J L N College Jharkhand, ,Jharkhand,-,-,-
J L N Degree College, ,Chhattisgarh,-,-,-
"J L N Institute Of Nursing Education,Jaipur",JAIPUR ,Rajasthan,-,-,-
J L N M College, ,Bihar,-,-,-
J M College, ,Jharkhand,-,-,-
J M D P L Mahila College, ,Bihar,-,-,-
J M J College For Women, ,Andhra Pradesh,"08644–225994,227056,222458",jmjtenali@rediffmail.com,http://jmjcollege.ac.in/
"J M J College Of Nursing,Hyderabad",HYDERABAD ,Andhra Pradesh,040-23814631,-,-
"J M J College Of Nursing,Hyderabad",HYDERABAD ,Andhra Pradesh,040-23814631,-,-
J M M Institute of Technology, ,Karnataka,-,-,-
J M S College, ,Bihar,-,-,-
J M Shah Arts And Commerce College, ,Gujarat,-,-,-
J N College Arunachal Pradesh,EAST SIANG ,Arunachal Pradesh,0368-2222496/2222049,-,-
J N College Bihar, ,Bihar,-,-,-
J N College Jharkhand, ,Jharkhand,-,-,-
J N L College, ,Bihar,-,-,-
"J N Medical College Hospital , School Of Nursing, Aligarh",ALIGARH ,Uttar Pradesh,-,-,-
J N Polytechnic, ,Karnataka,08485288827,-,-
J P College, ,Bihar,-,-,-
"J P K M College Of Medical Sciences , Vellore",VELLORE ,Tamil Nadu,-,-,-
J P Mahila College, ,Bihar,-,-,-
J P Pardiwala Arts And Commerce College, ,Gujarat,-,-,-
"J P School Of Nursing , Bangalore Rural",BANGALORE ,Karnataka,-,-,-
"J R Institute Of Nursing,Dungarpur,",DURGAPURA ,Rajasthan,-,-,-
J R Polytechnic College, ,Tamil Nadu,"04312906272,9659606355,9843326797",	jrpolytechniccollege@gmail.com,www.jrpc.ac.in
J S College, ,Bihar,-,-,-
"J S College Of Nursing,prakasam",PRAKASAM ,Andhra Pradesh,-,-,-
"J S M School Of Nursing , Hyderabad",HYDERABAD ,Andhra Pradesh,040-23702032,info@jsmschoolofnursing.in,www.jsmschoolofnursing.in
J S S College, ,Karnataka,-,-,-
J S S College Arts Commerce Science Chamrajanagar, ,Karnataka,-,-,-
J S S College Arts Commerce Science Karnataka, ,Karnataka,-,-,-
J S S College Arts Science Commerce Mysore, ,Karnataka,-,-,-
J S S College for Women, ,Karnataka,-,-,-
J S S College Karnataka, ,Karnataka,-,-,-
J S S College Nanjanguda, ,Karnataka,-,-,-
"J S S College Of Nursing , Mysore",MYSORE ,Karnataka,-,-,-
"J S S College Of Nursing , Mysore",MYSORE ,Karnataka,-,-,-
"J S S College Of Nursing , Mysore",MYSORE ,Karnataka,-,-,-
J S S College Pharmacy, ,Karnataka,-,-,-
J S S College Pharmacy, ,Karnataka,-,-,-
J S S Law College, ,Karnataka,-,-,-
"J S S Polytechnic For Physically Handicapped, Mysore", ,Karnataka,"0821-2548315,9686677236",-,-
"J S S Polytechnic For Women, Mysore", ,Karnataka,08212548311,-,-
"J S S Polytechnic, Njangud", ,Karnataka,08221226491,-,-
"J S S School Of Nursing , Chamarajanagar", ,Karnataka,-,-,-
"J S S School Of Nursing , Chamarajnagara", ,Karnataka,-,-,-
"J S S School Of Nursing , Hassan",HASSAN ,Karnataka,-,-,-
"J S S School Of Nursing , Mysore",MYSORE ,Karnataka,-,-,-
J S S Sh Tammannappa Chikkodi Arts Commerce College, ,Karnataka,-,-,-
"J S School Of Nursing , Ongole",ONGOLE ,Andhra Pradesh,-,-,-
"J U S S College Of Nursing & Medical Sciences , Gurdaspur",GURDASPUR ,Punjab,-,-,-
"J U S S Institute Of Nursing & Medical Sciences , Gurdaspur",GURDASPUR ,Punjab,-,-,-
"J V College Of Nursing , Thiruvallur",TIRUVALLUR ,Tamil Nadu,-,-,-
"J V Institute Of Nursing, , Chennai",CHENNAI ,Tamil Nadu,-,-,-
J Z Shah Arts H P Shah Commerce College, ,Gujarat,-,-,-
J. Baruah Law College,GUWAHATI ,Assam,-,-,-
J. Buana College, ,Mizoram,-,-,-
J. H. Govt. P. G. College Jaywanti Haksar Govt. P.G. College,BETUL ,Madhya Pradesh,"07141-234244,07141-290244,09425068608",-,-
J. L. Verma Law College,DAMOH ,Madhya Pradesh,07812-223147,-,-
J. N. Konar Primary Teacher's Training Institute, ,West Bengal,-,-,-
J. S. Institute of Management & Technology,SHIKOHABAD ,Uttar Pradesh,"05676-235572,9472266932",jsimtshikohabad@gmail.com,-
J. S. S. Law College,MYSORE ,Karnataka,0821-2548244,principal@jsslawcollege.com,jsslawcollege.com
J. S. S. Sakri Law College,HUBLI ,Karnataka,"0836-2208884,0836-2353019",-,-
J. S. T. Govt. P.G. College, ,Madhya Pradesh,07632-241588,-,-
"J. Sikkle Degree College, Narsapur",NARASAPUR ,Andhra Pradesh,"08814–273287,273227",edu@jsikle.com,-
J. V. Jain College,SAHARANPUR ,Uttar Pradesh,"0132-2760139,0132-2763344",principal@jvjaincollege.net,www.jvjaincollege.net
J.A. Arts And Science College,CHENNAI ,Tamil Nadu,"044-26564887,26564889",-,-
J.A.S. COLLEGE OF EDUCATION, ,Tamil Nadu,-,-,-
J.B. INSTITUTE OF PG STUDIES, ,Andhra Pradesh,"+9108772271806,6562800",-,www.jbgroup.org.in
J.B. Law College, ,Assam,2452257,-,-
J.B. Shah Girls College, ,Rajasthan,-,-,-
J.B. TEACHERS TRAINING INSTITUTE, ,Rajasthan,-,-,-
J.B.M.TEACHER TRAINING COLLEGE, ,Haryana,-,-,-
"J.B.S.P. Mandal Instt. of Pharmacy , GEORAI",BEED ,Maharashtra,-,-,-
J.B.S.P. Mandal's arts College, ,Maharashtra,-,-,-
J.B.S.P. Mandal's Mahila Mahavidyalaya, ,Maharashtra,-,-,-
J.B.TEACHER TRAINING INSTITUTE, ,Rajasthan,-,-,-
J.C. D.A.V. College, ,Punjab,-,-,-
J.C. Education Trust Law College,JUNAGADH ,Gujarat,"1-0281-2620133,02823-2630132",-,-
J.C. Mills Girls College, ,Madhya Pradesh,-,-,-
J.D. Patil Sangludkar Arts & Commerce College, ,Maharashtra,-,-,-
J.D.B. Girls College, ,Rajasthan,-,-,-
J.D.C. Bytco Institute of Mangement Studies & Research, ,Maharashtra,-,-,-
J.D.C. BYTECO INSTITUTE OF MANAGEMENT STUDIES,NASHIK ,Maharashtra,0253-2571643,nsk@sancharnet.in,www.jckbytcoimsr.org
J.D.J.B. ANAND DEGREE COLLEGE, ,Uttar Pradesh,-,-,-
J.D.M.V.P. Coop. Samajs Arts Science & Commerce College, ,Maharashtra,-,-,-
J.D.M.V.P. Coop. Samajs Arts Science & Commerce College', ,Maharashtra,-,-,-
J.D.T. Islam  College Of Arts & Science,KOZHIKODE ,Kerala,"0495-5535700,0495-2770029",jdticas@rediffmail.com,-
J.D.TEACHER TRAINING COLLEGE, ,Punjab,-,-,-
"J.D.Women''s College, Patna", ,Bihar,0612-2283355,-,http://www.jdwcpatna.com/
J.E. COOP.SYS D.ED COLLEGE, ,Karnataka,-,-,-
J.E.C.R.C. University, ,Rajasthan,"+911416565605,6565606",-,www.jecrcuniversity.edu.in
"J.E.S. College of Pharmacy , NANDURBAR",DHULE ,Maharashtra,02564232669,-,www.jijamataeducation.org
J.E.S. Degree College For Women,VISAKHAPATNAM ,Andhra Pradesh,"0891–5566551,2577145",-,-
J.E.S.S.R.J.B. Artss.B.L. Commerce And R.Bezoji Science College, ,Maharashtra,-,-,-
J.G.K.P. TEACHER TRAINING INSTITUTE, ,Karnataka,-,-,-
J.G.TEACHER TRAINING COLLEGE, ,Haryana,-,-,-
J.H. Patel College of Management and Technology, ,Gujarat,-,-,-
J.J COLLEGE OF EDUCATION, ,Tamil Nadu,-,-,-
J.J. Polytechnic College, ,Tamil Nadu,"0431-2914309,9750965175",jjpolycollege@yahoo.co.in,-
J.J. College Of Arts And Science, ,Tamil Nadu,04322-260103/261801/261802,	jjcollege.pdkt@gmail.com,www.jjcol.ac.in
J.J. COLLEGE OF EDUCATION, ,Tamil Nadu,-,-,-
J.J. College of Engg & Technology,TIRUVARUR ,Tamil Nadu,"0431-2695607,2695608",jjprincipal@rediffmail.com,www.jjcet.ac.in
"J.J. College of Pharmacy Sciences, Maheshwaram", ,Andhra Pradesh,+91--232672,jjcps@yahoo.co.in,-
J.J. Polytechnic College, ,Tamil Nadu,"0431-2914309,9750965175",jjpolycollege@yahoo.co.in,-
J.J. ROJAA TEACHER TRAINING INSTITUTE, ,Tamil Nadu,-,-,-
J.j.c.e.trust Sanchalit N.r.vrkaria Institute Of Technology, ,Gujarat,02852651358,nrvtechnology@yahoo.in,www.jjcet.edu.in
J.J.M. Medical College,DAVANAGERE ,Karnataka,"08192-270522,231388",jjmc.davangere@rediffmail.com,www.jjmc.org
J.J.M. Medical College, ,Karnataka,-,-,-
J.J.R. EDUCATION SOCIETY(R), ,Karnataka,-,-,-
J.K COLELGE OF EDCATION, ,Tamil Nadu,-,-,-
J.K. Institute of Engineering, ,Chhattisgarh,"+917752-407035,327711,327722,327733",info@jkie.org,www.jkie.org
J.K. Lakshmipat University, ,Rajasthan,+91-141-2168225/393,admissions.im@jklu.edu.in,www.jklu.edu.in
J.K. PADAMPAT SINGHANIA INSTITUTE OF MGT. & TECH,GURGAON ,Haryana,0124-4268041/4268040,-,-
J.K.C. College,GUNTUR ,Andhra Pradesh,"0863–2351062,2351028",jkccoff@sancharnet.in,-
J.K.COLLEGE OF EDUCATION, ,Tamil Nadu,-,-,-
J.K.K. Munirajah College of Technology, ,Tamil Nadu,+95-4285-260755,"jkkmct@yahoo.in,principal309@gmail.com",http://www.jkkmct.org
J.K.K. Nataraja College of Engineering and Technology, ,Tamil Nadu,"+9199653-63999,+9198659-33332,+9194878-",info@jkkn.org,www.jkkn.org
"J.K.K. Nataraja College of Pharmacy , Komarapalayam",NAMAKKAL ,Tamil Nadu,"04288-260651,04288-265793",jkknas@yahoo.com,www.jkknataraja.org
"J.K.K.NATTRAJA COLLEGE OF PHARMACY,ERODE",ERODE ,Tamil Nadu,09865419666,-,-
J.K.MEMORIAL TEACHER TRAINING COLLEGE, ,Haryana,-,-,-
"J.L. MEMORIAL TEACHER TRAINING COLLEGE,", ,Rajasthan,-,-,-
J.L. Nehru Degree College, ,Uttar Pradesh,-,-,-
J.L. Nehru Law College, ,Madhya Pradesh,-,-,-
J.L. Nehru Law College, ,Madhya Pradesh,-,-,-
J.L. Nehru Memorial Mahavidyalaya, ,Madhya Pradesh,-,-,-
J.L. Nehru Smarak PG College, ,Uttar Pradesh,-,-,-
J. L. Verma Law College,DAMOH ,Madhya Pradesh,07812-223147,-,-
J.L.N. Government College For Women, ,Punjab,-,-,-
J.M. Institute of Speech & Hearing,PATNA ,Bihar,0612-2264805,jmishpat@cal2.vsnl.net.in,-
"J.M. Pandya Diploma Pharmacy College , Vadodara",VADODARA ,Gujarat,+(91)-(2668)-6564491,noemail@barodadirect.com,-
J.M. Patel Arts Commerce & Science College, ,Maharashtra,-,-,-
J.M. PATEL COLLEGE,BULDANA ,Maharashtra,07184-252003,jmpatel_bhv@sancharnet.in,www.mbajmpc.org
J.M.J D.ED COLLGE, ,Karnataka,-,-,-
J.M.J. Degree College For Women,WARANGAL ,Andhra Pradesh,08711–243143,-,-
J.M.J. Degree College For Women, ,Andhra Pradesh,-,-,-
J.M.S. COLLEGE OF EDUCATION, ,Tamil Nadu,-,-,-
J.N. College, ,Orissa,-,-,-
J.N. College, ,Arunachal Pradesh,-,-,-
J.N. College Of Technology,BHOPAL ,Madhya Pradesh,"0755-2854639,2854641,2660930",cecbsp@rediffmail.com,www.jnctbpl.com
J.N. PAUL INSTITUTE OF EDUCATION, ,Uttaranchal,-,-,-
J.N.M.P MAHAVIDAYALYA, ,Uttar Pradesh,-,-,-
J.N.N TEACHER TRAINING INSTITUTE, ,Tamil Nadu,-,-,-
J.P. COLLEGE OF EDUCATION, ,Karnataka,-,-,-
J.P. Gupta Institute of Law,GWALIOR ,Madhya Pradesh,-,"director@nsit.ac.in,headoffice@nsit.ac.in",-
J.P. Institute of Education, ,Uttar Pradesh,-,-,-
J.P. Verma Science Mahavidyalaya, ,Uttar Pradesh,-,-,-
J.P.C.L.DEGREE COLLEGE, ,Uttar Pradesh,-,-,-
J.P.E TEACHER TRAINING INSTITUTE, ,Kerala,-,-,-
J.P.INSTITUTE OF EDUCATION AND TECHNOLOGY, ,Uttar Pradesh,-,-,-
J.P.Institute of Hotel Management & Catering Technology, ,Uttar Pradesh,"0121-2623005,2620505,9837013785",info@jpihm.com,http://www.jpihm.com/jpihm%20website%2004122010/co
J.R. INSTITUTE OF EDUCATION, ,Haryana,-,-,-
J.R. Kissan Homoeopathic Medical College and Hospital,ROHTAK ,Haryana,-,-,-
J.R. MEMORIAL TEACHER TRAINING COLLEGE, ,Haryana,-,-,-
"J.R.D. Polytechnic, Vallakandini", ,Karnataka,-,-,-
J.R.KISSAN TEACHER TRAINING COLLEGE, ,Haryana,-,-,-
"J.R.M. Adarsh Bhartiya Collegeof Pharmacy , Pathankot",PATHANKOT ,Punjab,-,-,-
J.R.R. Navodaya Degree College,GUNTUR ,Andhra Pradesh,"08649–248685,248677",-,-
J.R.S.E.T College of Education, ,West Bengal,-,-,-
J.S INSTITUTE OF EDUCATION, ,Uttar Pradesh,-,-,-
J.S. ACADEMY, ,Uttar Pradesh,0121-2578786,info@jsacademy.org.in,jsacademy.org.in
J.S. Hindu Post-graduate College, ,Uttar Pradesh,-,-,-
J.S. Hindu Postgraduate College, ,Uttar Pradesh,-,-,-
J.S.COLLEGE OF EDUCATION, ,Uttar Pradesh,-,-,-
J.S.College of Education, ,Uttar Pradesh,-,-,-
J.S.HINDU DEGREE COLLEGE, ,Uttar Pradesh,-,jscollege_amroha@yahoo.in,-
J.S.J.V. B.ED COLLEGE, ,Tamil Nadu,-,-,-
"J.S.M. ACODEMY ,", ,Uttar Pradesh,-,-,-
"J.S.P.M. Sudhakar Rao Naik Institute of Pharmacy , Pusad",PUSAD ,Maharashtra,07233-247025,jspmpoly@rediffmail.com,www.jspmpoly.ac.in
J.S.P.Ss College Of Education, ,Maharashtra,-,-,-
"J.S.S Medical College, Mysore",MYSORE ,Karnataka,"0821-2490732,2493667,2492957",jssmc@sancharnet.in,www.jssmc.hypermart.net
"J.S.S. College of Pharmacy , Mysore",MYSORE ,Karnataka,0821-2497583,jsspharma@lycos.com,www.jsspharma.org
"J.S.S.College of Pharmacy , Ooty",OOTY ,Tamil Nadu,+91-423-2443393/2443647/2443847,"admissions@jsscpooty.org,jaspharm@hotmail.com",www.jsscpooty.org
J.S.S. Dental College & Hospital,MYSORE ,Karnataka,"91-0821-2548349,2548350",jss_dch@yahoo.co.in,www.jssdental.org
J.S.S. INSTITUTE OF EDUCATION, ,Karnataka,-,-,-
J.S.S. INSTITUTE OF EDUCATION, ,Karnataka,-,-,-
J.S.S. Kisan Veer Mahavidyalaya, ,Maharashtra,-,-,-
J. S. S. Law College,MYSORE ,Karnataka,0821-2548244,principal@jsslawcollege.com,jsslawcollege.com
J.S.S. TEACHER TRAINING INSTITUTE FOR WOMEN, ,Karnataka,-,jss@jssonline.org,-
"J.S.S.College of Pharmacy , Ooty",OOTY ,Tamil Nadu,+91-423-2443393/2443647/2443847,"admissions@jsscpooty.org,jaspharm@hotmail.com",www.jsscpooty.org
"J.S.S.S.S.S. DiplomaPharmacy College , Anand",ANAND ,Gujarat,-,ddpc@rediffmail.com,-
J.T. COLLEGE, ,Uttar Pradesh,-,-,-
J.T.E.Ss Arts Commerce & Science College, ,Maharashtra,-,-,-
J.Thankima College, ,Mizoram,-,-,-
J. V. Jain College,SAHARANPUR ,Uttar Pradesh,"0132-2760139,0132-2763344",principal@jvjaincollege.net,www.jvjaincollege.net
J.V. JAIN COLLEGE, ,Uttar Pradesh,-,-,-
J.V. Jain College, ,Uttar Pradesh,-,-,-
J.V. JAIN PG COLLEGE, ,Uttar Pradesh,-,-,-
Jaagruthi Degree College,MAGALAGIRI ,Andhra Pradesh,-,-,-
JAANAGI INSTITUTE OF TEACHER EDUCATION, ,Tamil Nadu,-,-,-
JAAT TEACHER TRAINING COLLEGE, ,Haryana,-,-,-
"Jabalpur Institute Of Health Sciences, Jabalpur",JABALPUR ,Madhya Pradesh,-,-,-
"Jabalpur Institute Of Nursing Science & Research , Jabalpur",JABALPUR ,Madhya Pradesh,-,-,-
"Jabalpur Institute Of Nursing Sciences & Research , Jabalpur",JABALPUR ,Madhya Pradesh,-,-,-
"Jackman School Of Nursing , Bilaspur",BILASPUR ,Chhattisgarh,-,-,-
Jadavpur Vidyapith College of Education, ,West Bengal,-,-,-
JADCHERLA POST GRADUATE COLLEGE,JADCHERLA ,Andhra Pradesh,+9108542645162,info@jadcherlapgcollege.com,-
JADEED ANJUMAN-E-TALEEM J.A.T. JUNIOR COLLEGE OF EDUCATION, ,Maharashtra,-,-,-
Jadid Anjuman E Talem Arts Science & Commerce Girl, ,Maharashtra,-,-,-
Jadid Anjuman E Talem Arts Science & Commerce Girls  College, ,Maharashtra,-,-,-
Jadupati +3 College, ,Orissa,-,-,-
JAG NARAYAN SHUKLA GRAMODAYA MAHAVIDYALAYA, ,Uttar Pradesh,-,-,-
JAGADAMBA BAHUUDESHIYA GRAMIN VIKAS SANSTHA, ,Maharashtra,-,-,-
JAGADGURU ANNADANESHWAR T.T.I, ,Karnataka,-,-,-
Jagadguru Dattatray College Of Technology,INDORE ,Madhya Pradesh,"0731-3202993,4066143,2660930",lnctchirman@gmail.com,www.jdctindore.in
JAGADGURU RAMANANDACHARYA RAJASTHAN, ,Rajasthan,-,-,-
Jagadguru Ramanandacharya Sanskrit University, ,Rajasthan,01415132001,jrrsu@yahoo.com,www.jrrsanskrituniversity.ac.in
JAGADGURU RAMBHADRACHARYA HANDICAPPED UNIVERSITY, ,Uttar Pradesh,-,-,-
Jagadguru Rambhadracharya Handicapped University, ,Uttar Pradesh,+91-5198-224481,jrhuniversity@yahoo.com,www.jrhu.com
"Jagadguru Shankarachariya College Of Nursing , Raipur",RAIPUR ,Chhattisgarh,"+91-96170-20000,96170-60000,96173-90000",info@ssipmt.com,www.ssipmt.com
"Jagadguru Shankaracharya College Of Nursing,Raipur",RAIPUR ,Chhattisgarh,-,-,-
"Jagadguru Sri Shivarathreeshwara College of Pharmacy , Mysore",MYSORE ,Karnataka,"0821-2493667,2490732,2493134",jssmc@blr.vsnl.net.in,www.jssmedicalcollege.org
Jagadguru Sri Shivarathreeswara University, ,Karnataka,-,-,www.jssuni.edu.in
Jagadish Chandra Basu Sikshak Sikshan Mahavidyalaya, ,West Bengal,"(033)24185325,24185326",-,http://www.jcbssmindia.org
JAGADURU SRI RENUKACHARYA D. ED COLLEGE, ,Karnataka,-,-,-
JAGAN INSTITUTE OF MANAGEMENT STUDIES,DELHI ,Delhi,"45184000,45184001,45184002",Jims@vsnl.com,www.jimsindia.org
JAGAN INSTITUTE OF MANAGEMENT STUDIES, ,Rajasthan,"0141-5122270,5122129",	admissions@jimsjaipur.org,www.jimsjaipur.org
Jagan Nath University, ,Rajasthan,91-141-3020500,admission@jagannathuniversity.org,www.jagannathuniversity.org
JAGAN SHIKSHAK PRASHIKSHAN SANSTHAN, ,Rajasthan,-,-,-
JAGAN'S INSTITUTE OF MANAGEMENT STDS,NELLORE ,Andhra Pradesh,-,-,-
Jaganath Mishra Law College,SASARAM ,Bihar,-,-,-
Jagannath Gupta Institute Of Engineering And Technology, ,Rajasthan,"0141-2771516,2771615,9829065770",jp@jimsindia.org,http://www.jnit.org/
Jagannath Institute For Technology And Management., ,Orissa,06815-223088/223099/222150/222100,-,www.jitm.org
Jagannath Institute of Engineering & Technology,CUTTACK ,Orissa,0671-2491935/2490935/2490185,"principal@jiet.org.in,info@jiet.org.in,jietctc@rediffmail.com",www.jiet.org.in
JAGANNATH INTERNATIONAL MANAGEMENT SCHOOL, ,Delhi,-,imims@vsnl.com,www.jagannath.org
Jagannath Jain College, ,Jharkhand,-,-,-
Jagannath Kishore College, ,West Bengal,-,-,-
Jagannath Mahavidyalaya (Degree College), ,Orissa,-,-,-
Jagannath Mishra Institute of Technology,DARBHANGA ,Bihar,-,ranjitkeshari@gmail.com,-
Jagannath Munna Lal Choudhry Mahila Mahavidyalaya, ,Madhya Pradesh,-,-,-
JAGANNATH PRASAD SMARAK COLLEGE OF EDUCATION, ,Uttar Pradesh,"5333-283019,9452317543,9415217200",jpsmgald@gmail.com,-
Jagans Degree College,NELLORE ,Andhra Pradesh,"0861–2322105,2343416",-,-
Jagans Institute Of Science & Tech,NELLORE ,Andhra Pradesh,-,-,-
Jagarlamudi Kuppuswamy Choudhry College, ,Andhra Pradesh,-,-,http://jkcc.ac.in/
Jagat Bandhu Biswa Bharati Sikshya Niketan,BALANGIR ,Orissa,-,-,-
JAGAT JAGRUTI SHIKSHAN PRASARAK MANDAL, ,Maharashtra,-,-,-
Jagat Taran Girls Degree College, ,Uttar Pradesh,-,-,-
JAGATGURU RAMBHADRACHARYA HANDICAPPED UNIVERSITY, ,Uttar Pradesh,-,-,-
Jagatpur Degree College, ,Uttar Pradesh,-,-,-
Jagdam College, ,Bihar,-,-,-
"Jagdamba Education Society S.N.D. Diploma College of Pharmacy , Nashik",NASHIK ,Maharashtra,02559-267213,snd_pharmacy@sancharnet.com,-
JAGDAMBA EDUCATION SOCIETYS, ,Maharashtra,-,-,-
Jagdamba Mahavidyalaya, ,Maharashtra,-,-,-
Jagdamba Mahavidyalaya Commerce, ,Maharashtra,-,-,-
Jagdamba Sanskrit Mahavidyalaya, ,Bihar,-,-,-
JAGDAMBA SARAN SINGH EDUCATIONAL INSTITUTE, ,Uttar Pradesh,-,-,-
Jagdish Prasad Pandey Smarak Mahavidyalaya, ,Uttar Pradesh,-,-,-
JAGDISH PRASAD PANDEY SMARK MAHAVIDYALAYA, ,Uttar Pradesh,-,-,-
Jagiroad College,MARIGAON ,Assam,"03678-242308,244453",-,-
Jagjit Singh Sachdeva Asha kiran Special School,HOSIARPUR ,Punjab,01882-272460,jssashakiranschool@gmail.com,-
Jagjivan Ram Law College,BHUBANESWAR ,Orissa,-,-,-
Jagjiwan Mahavidyalaya, ,Bihar,-,-,-
Jagjiwan Ram Sharmik College, ,Bihar,-,-,-
Jaglal Chaudhary College, ,Bihar,-,-,-
"Jagmohan Institute Of Nursing , Bhind",BHIND ,Madhya Pradesh,-,-,-
JAGPAT SINGH SINGRAUR DEGREE COLLEGE, ,Uttar Pradesh,-,-,-
Jagran Institute of Communication and Management, ,Madhya Pradesh,+917553040721/26,admission@jicm.edu.in,http://jicm.edu.in
Jagran Lakecity University, ,Madhya Pradesh,"0755-3917370,3917371",mohit.kamble@jsws.org.in,www.jlu.edu.in
JAGRATI DEGREE COLLEGE, ,Uttar Pradesh,-,-,-
JAGRATI TEACHERS TRAINING COLLEGE, ,Himachal Pradesh,-,-,-
JAGRITI INSTITUTE OF HIGHER EDUCATION, ,Haryana,-,-,-
JAGRITI SHIKSHAK PRASHIKSHAN MAHAVIDYALAYA, ,Rajasthan,-,-,-
"Jagruthi Degree & Pg College, Narayanaguda",NARAYANGUDA ,Andhra Pradesh,"24751451,24751670",office@jagruthi.net,www.jagruthi.net
Jagruthi Degree College,KARIMNAGAR ,Andhra Pradesh,0878–2259336,-,-
"Jagruthi Degree College, Huzurabad",HUZURABAD ,Andhra Pradesh,-,-,-
"Jagruthi Degree College, Mahabubnagar",MAHABUBNAGAR ,Andhra Pradesh,-,-,-
"Jagruthi Degree College, Medak",ZAHEERABAD ,Andhra Pradesh,-,-,-
"Jagruthi Degree College, Nalgonda",BHONGIR ,Andhra Pradesh,08685–244745,-,-
Jagruti Institute of Engineering and Technologys, ,Andhra Pradesh,040-27672474,chairman@jagruti.ac.in,http://www.jagruti.ac.in/
Jagta Arts college, ,Maharashtra,-,-,-
JAGWANT SINGH BHADORIA DEGREE COLLEGE, ,Uttar Pradesh,-,-,-
Jahnavi Degree College,NARAYANGUDA ,Andhra Pradesh,040–27562282,-,-
"Jahnavi Degree College, Secunderabad",SECUNDERABAD ,Andhra Pradesh,-,-,-
"Jahnavi School Of Nursing , Bangalore",BANGALORE ,Karnataka,-,-,-
Jahnavi Womens Degree College,NARAYANGUDA ,Andhra Pradesh,-,-,-
"Jai Ambey Education Society, School Of Nursing , Hoshiarpur",HOSIARPUR ,Punjab,-,-,-
JAI ARIHANT ACADEMIC INSTITUTE, ,Uttaranchal,-,-,-
JAI BAJRANG COLLEGE OF PHYSICAL EDUCATION, ,Maharashtra,-,-,-
Jai Bajrang Shiv Gulam Mahavidyalaya, ,Uttar Pradesh,-,-,-
JAI BHAGWAN COLLEGE OF EDUCATION, ,Maharashtra,-,-,-
JAI BHARAT TEACHER TRAINING COLLEGE, ,Haryana,-,-,-
JAI BHARATH TRAINING COLLEGE, ,Kerala,-,-,-
Jai Bharati College, ,Madhya Pradesh,-,-,-
JAI DURGA BHAWANI KRIDA MANDAL, ,Maharashtra,-,-,-
"Jai Durga College Of Nursing,Jaipur",JAIPUR ,Rajasthan,-,-,-
"Jai Durga College Of Nursing,Jaipur",JAIPUR ,Rajasthan,-,-,-
JAI GANESH EDUCATIONAL FOUNDATION, ,Maharashtra,-,-,-
JAI GEETAANJALI TEACHER TRAINING COLLEGE, ,Haryana,-,-,-
JAI HIND COLLEGE, ,Karnataka,-,-,-
Jai Hind Defence College of Law,BHOPAL ,Madhya Pradesh,-,"director@jhdcollege.org,neerajvedi@gmail.com",-
Jai Hind Education Trusts Arts Science And Commerce College, ,Maharashtra,-,-,-
Jai Hind Educational Trusts Zulal Bhilajirao Patil College, ,Maharashtra,-,-,-
JAI HIND VISMIL EDUCATION COLLEGE, ,Madhya Pradesh,-,-,-
"Jai Institute Of Nursing & Research , Gwalior",GWALIOR ,Madhya Pradesh,-,-,-
"Jai Institute Of Nursing And Research Centre , Gwalior",GWALIOR ,Madhya Pradesh,-,-,-
JAI JAWAN JAI KISAN SHIKSHAN PRASARAK MANDAL, ,Maharashtra,-,-,-
JAI JYOTHI EDUCATION SOCIETY, ,Karnataka,-,-,-
JAI KARNATAKA D.ED COLLEGE, ,Karnataka,-,-,-
JAI KISAN SHIKSHAN SANSTHAS COLLEGE OF PHYSICAL EDUCATION, ,Maharashtra,-,-,-
Jai Mahakali Shikshan Sanstha Agnihotri Polytechnic, ,Maharashtra,240440,apnag_1190@rediffmail.com,www.agnihotrigroup.org
Jai Mahakali Shikshan Sanstha Law College,WARDHA ,Maharashtra,"07152-254785,95",jmssgeneralinfo@yahoo.com,www.jmsswardha.org/index.htm
JAI MAHAKALI SHIKSHAN SANSTHA RANIBAI AGNIHOTRI INSTITUTE OF COMPUTER  IN FORMATION TECHNOLOGY,WARDHA ,Maharashtra,(0)(07152)-241075/309219/254795,-,-
JAI MAHAKALI SHIKSHAN SANSTHAS, ,Maharashtra,-,-,-
Jai Mahakali Shikshan Sansthas Agnihotri College of Law,WARDHA ,Maharashtra,"07152-241075,07152-243575",-,-
JAI MARUDHAR KESARI TEACHER TRAINING COLLEGE, ,Rajasthan,-,-,-
"Jai Mata School Of Nursing & Medical Sciences,Hisar",HISSAR ,Haryana,-,-,-
JAI MATA TEACHER TRAINING COLLEGE, ,Haryana,-,-,-
Jai Narain Samarak Degree College, ,Uttar Pradesh,-,-,-
JAI NARAIN SMARAK DEGREE COLLEGE, ,Uttar Pradesh,-,-,-
Jai Narain Vyas University,JODHPUR ,Rajasthan,91029133733,regjnvu@sancharnet.in,www.jnvu.edu.in/
Jai Narain Vyas University,JODHPUR ,Rajasthan,-,-,-
"Jai Narayan College of Tech. & Sc., JNCTS",BHOPAL ,Madhya Pradesh,0755-2854639,inctjobs@rediffmail.com,-
"Jai Narayan Vyas School of Pharmacy , Barmer", ,Rajasthan,+91-2982-225405,-,-
JAI NARAYAN VYAS UNIVERSITY, ,Rajasthan,0291-2724019,-,http://www.jnvu.edu.in
"Jai Polytechnic, Shahabad", ,Haryana,09466070479,-,-
JAI PRAKASH DEGREE COLLEGE, ,Uttar Pradesh,-,-,-
Jai Prakash Mahavidyalaya Umarhan, ,Uttar Pradesh,-,-,-
Jai Prakash Vishwavidyalaya,CHAPRA ,Bihar,[06152]-243898,dpramendra_jc@rediffmail.com,www.jpv.bih.nic.in
JAI RUPA COLLEGE OF EDUCATION, ,Tamil Nadu,"04257-245577,245597",info@jairupa.com,-
JAI SAI TRAINIG COLLEGE, ,Tamil Nadu,-,-,-
JAI SAKTHI COLLEGE OF EDUCATION, ,Tamil Nadu,-,-,-
JAI SHANTHI COLLEGE OF EDUCATION, ,Tamil Nadu,-,-,-
"JAI SHREE DAYAL TEACHERS TRAINING COLLEGEKAIRWALI, POST - PUPNBAS TEHSIL - NEEMKA THANA", ,Rajasthan,-,-,-
JAI SHRI TEACHER S TRAINING INSTITUTE, ,Tamil Nadu,-,-,-
JAI SHRIRAM B.ED. COLLEGE, ,Madhya Pradesh,-,-,-
JAI SRI VENKATESHWARA COLLEG OF EDUCATION, ,Tamil Nadu,-,-,-
Jaideo Education Society, ,Maharashtra,2023002,-,www.jdpoly.in
Jain Asthanak Vasi Girls Degree College, ,Uttar Pradesh,-,-,-
JAIN BALIKA VIDVAPEETH, ,Uttar Pradesh,-,-,-
JAIN BHARTI INSTITUTE OF HIGHER EDUCATION, ,Delhi,-,-,-
