Sri Jaydev College of Education & Technology, ,Orissa,-,-,-
Sri Jayendra Saraswathy Maha Vidayalaya College Of Arts And Science,COIMBATORE ,Tamil Nadu,-,-,-
Sri Jayendra Saraswati Degree College For Womens,KURNOOL ,Andhra Pradesh,"08518–232252,222267,93938-27033",-,-
Sri Jeevana Jyothi Degree College,PRAKASAM ,Andhra Pradesh,-,-,-
"Sri Jeya School Of Nursing, , Sri Jeya Hospital, Vellore",VELLORE ,Tamil Nadu,-,-,-
"Sri Jgadeguru Murugarajendra Vidyapeeta ,School Of Nursing , Chitradurga",CHITRADURGA ,Karnataka,-,-,-
SRI JOTHI TEACHER TRAINING INSTITUTE, ,Tamil Nadu,-,-,-
SRI JYOTHI TEACHER TRAINING INSTITUTE, ,Tamil Nadu,-,-,-
"Sri K L Shastri Smarak Nursing College , Lucknow",LUCKNOW ,Uttar Pradesh,-,-,www.klsinstitute.com
"Sri K Ramachandra Naidu College Of Nursing , Tirunelveli",TIRUNELVELI ,Tamil Nadu,-,-,-
"Sri K Ramachandran Naidu College Of Nursing , Tirunelveli",TIRUNELVELI ,Tamil Nadu,04636-260950/260966,Srikrncon@Yahoo.Com,-
SRI K VENKATAPATHAPPA COLLEGE OF PHYSICAL EDUCATION, ,Karnataka,08156-263087/9972152991,-,www.kvtp.org
SRI K. RAMACHANDRA NAIDU COLLEGE OF EDUCATION, ,Tamil Nadu,-,-,-
"Sri K. Venkatapatheppa Collegeof Pharmacy , CHICKBALLAPUR",KOLAR ,Karnataka,-,kvcpharmacy@gmail.com,-
SRI K.G. NADGIR COLLEGE OF PHYSICAL EDUCATION, ,Karnataka,-,-,-
"Sri K.G.S. Arts College, Srivaikuntam",TUTICORIN ,Tamil Nadu,-,-,-
Sri K.S. Raju Institute of Tech. & Science, ,Andhra Pradesh,9490526666,principal@ksrit.ac.in,www.ksrit.ac.in
Sri K.V. Durga Reddy Memorial Degree College,MAHABUBNAGAR ,Andhra Pradesh,270341,-,-
SRI KAAGINELE MAHASAMSTANA KANAKA GURUPEETA T.T.I, ,Karnataka,-,-,-
SRI KAALIKAMBAL TEACHER TRAINING INSTITUTE, ,Tamil Nadu,-,-,-
Sri Kadali Narayana Murthy Degree College,MALKAPURAM ,Andhra Pradesh,-,-,-
SRI KAGINELE MAHASAMSTHANA KANAKA GURUPEETA T.T.I, ,Karnataka,-,-,-
Sri Kakatiya Degree College,GUNTUR ,Andhra Pradesh,-,-,-
"Sri Kakatiya Degree College, Westgodavari",WEST GODAVARI ,Andhra Pradesh,"08829–222280,222856",-,-
"Sri Kalabyraveshwara Swamy College Of Nursing,Bangalore",BANGALORE ,Karnataka,-,-,-
sri kalahasteeswara institute of technology, ,Andhra Pradesh,-,-,-
Sri Kalahasteswara Institute of Technology,CHITOOR ,Andhra Pradesh,-,-,-
Sri Kalahastiswara Institute Of Information & Management Science(Skiims),CHITOOR ,Andhra Pradesh,-,-,-
SRI KALAIMAGAL COLLEGE OF EDUCATION, ,Tamil Nadu,-,-,-
Sri Kalaimagal College Of Engineering, ,Tamil Nadu,04427655531,agn_ec@yahoo.co.in,www.skce.edu.in
SRI KALAIVANI TEACHER TRAINING INSTITUTE, ,Tamil Nadu,-,-,-
Sri Kalayan Government Shastri Sanskrit College, ,Rajasthan,-,-,-
SRI KALIDASA TEACHERS TRAINING INSTITUTION, ,Karnataka,-,-,-
Sri Kaliswari College,VIRUDUNAGAR ,Tamil Nadu,"91-4562-232648,232264",skccs06@dataone.in,www.kaliswari-college.com
SRI KALYAN TEACHER TRAINING COLLEGE, ,Rajasthan,-,-,-
"Sri Kamadhenu School Of Nursing , Chickmagalur",CHIKMAGALUR ,Karnataka,-,-,-
SRI KANAKADAS TEACHER TRAINING INSTITUTE, ,Karnataka,-,-,-
SRI KANCHANESHWARI D.E COLLEGE, ,Karnataka,-,-,-
Sri Kandhan College Of Arts And Science,NAMAKKAL ,Tamil Nadu,-,-,-
Sri Kandula Obul Reddy College,PRAKASAM ,Andhra Pradesh,"08406–232668,237700,237668",-,-
Sri Kanniga Parameswari Arts And Science College For Women,CHENNAI ,Tamil Nadu,-,-,-
SRI KANNIKA PARAMESHWA EDUCATION, ,Karnataka,-,-,-
"Sri Kannika Parameshwari Diamond Jubilee, School Of Nursing , Davangere",DAVANAGERE ,Karnataka,-,-,-
Sri Karpaga Polytechnic College, ,Tamil Nadu,044-27277272,srikarpagapolytechnic@yahoo.com,www.srikarpagapolytechniccollege.co.in
Sri Karunamai Inst. For Higher Learning,GUDUR ,Andhra Pradesh,08624–252661,-,-
SRI KASI VISVANATH TEACHER TRAINING COURSE, ,Pondicherry,-,-,-
Sri Kasu Brahmananda Reddy Government Degree College,GUNTUR ,Andhra Pradesh,-,-,-
Sri Kengal Hanumanthaiah Law College,KOLAR ,Karnataka,08153-274706,skhlawcollegekgf@mail.com,-
SRI KMKG COLLEGE OF EDUCATION, ,Karnataka,-,-,-
Sri Kolla Veera Swamy Degree College,GOKAVARAM ,Andhra Pradesh,-,-,-
Sri Kolli Nageshwara Rao Gangaiah Govt First Grade College, ,Karnataka,-,-,-
Sri Kota Raghavaiah Degree College,KRISHNA ,Andhra Pradesh,-,-,-
SRI KOTE SANNA BORAPP BORAMMA D.ED COLLEGE, ,Karnataka,-,-,-
Sri Koto Durga Mahila Degree College,PALAKONDA ,Andhra Pradesh,"08941–220993,220549",-,-
Sri Kottam Tulasi Reddy Memorial College of Engineering, ,Andhra Pradesh,08502-249517,ktmc2000@gmail.com,www.ktmc.in
SRI KOTTURASWAMY KALYA KENDRA, ,Karnataka,-,-,-
SRI KOTTURESWARA D.ED COLLEGE, ,Karnataka,-,-,-
SRI KOTTURSWAMY VIVIDODHESH SAMSTHE KALMATH D.ED COLLEGE, ,Karnataka,-,-,-
Sri Krishna Arts and Science College,COIMBATORE ,Tamil Nadu,-,"principal@skasc.ac.in,info@skasc.ac.in",-
Sri Krishna Chaitanya College,NELLORE ,Andhra Pradesh,"0861–2312382,2312383",info@chaitanyacollege.in,-
Sri Krishna Chaitanya College Of Nursing,CHITOOR ,Andhra Pradesh,-,-,-
"Sri Krishna Chaithanya College Of Nursing , Chittoor",CHITOOR ,Andhra Pradesh,-,-,-
Sri Krishna College, ,West Bengal,-,-,-
SRI KRISHNA COLLEGE OF EDUCATION, ,Karnataka,+(91)-(80)-23350036,-,-
SRI KRISHNA COLLEGE OF EDUCATION, ,Tamil Nadu,-,-,-
Sri Krishna College of Engineering and Technology,COIMBATORE ,Tamil Nadu,0422-2678001(7Lines),info@skcet.ac.in,www.skcet.ac.in
Sri Krishna College of Engineering, ,Tamil Nadu,+91-4177-238700,principal@skce.in,www.skce.in
"Sri Krishna College Of Nursing,Bangalore",BANGALORE ,Karnataka,-,-,-
Sri Krishna College of Technology, ,Tamil Nadu,0422-2604545/46/47/48/49,vibjengg@vlbjcet.ac.in,www.vlbjcet.ac.in
Sri Krishna Degree College,KRISHNA ,Andhra Pradesh,08671–223245,-,-
"Sri Krishna Degree College, Chittivalasa",CHITTIVALASA ,Andhra Pradesh,-,-,-
Sri Krishna Engineering College,KANCHIPURAM ,Tamil Nadu,"044–65392338,27190026",srikrishnaengg@sify.com,http://www.srikrishnacollege.com
Sri Krishna Institute of Management, ,Tamil Nadu,"+9104222678027(D),+9104222678025(O)",-,www.skim.ac.inwww.vlbkrishna.edu.in
"Sri Krishna Institute Of Medical Health Sciences & Res Nursing,Jaipur",JAIPUR ,Rajasthan,-,-,-
Sri Krishna Institute of Technology, ,Tamil Nadu,"044-27145526,9244900840",info@srikrishnait.com,www.srikrishnait.com
Sri Krishna Institute of Technology.,BANGALORE ,Karnataka,080-23721315/1477,damu-pm@yahoo.com,www.skit.org
Sri Krishna Janka Devi Mahavidyalaya, ,Uttar Pradesh,-,-,-
Sri Krishna Jubilee Law College,MUZAFFARPUR ,Bihar,-,-,-
Sri Krishna Polytechnic, ,,08065717393,-,-
Sri Krishna Polytechnic College,DINDIGUL ,Tamil Nadu,-,-,-
"Sri Krishna Rukmini College Of Nursing,Bangalore",BANGALORE ,Karnataka,-,-,-
Sri Krishna Sai Degree College,PALAKONDA ,Andhra Pradesh,"08941–250581,94400–92686",-,-
Sri Krishna Sai Womens College,KRISHNA ,Andhra Pradesh,08676–2512143,-,-
Sri Krishna Santsang Girls College, ,Rajasthan,-,-,-
SRI KRISHNA SCHOOL OF EDUCATION, ,Tamil Nadu,-,-,-
"Sri Krishna School Of Nursing , Bangalore",BANGALORE ,Karnataka,-,-,-
"Sri Krishna School Of Nursing , Tirupati",TIRUPATI ,Andhra Pradesh,040-2260374,-,-
"Sri Krishna School Of Nursing,Lucknow",LUCKNOW ,Uttar Pradesh,-,-,-
SRI KRISHNA TEACHER TRAINING INSTITUTE, ,Tamil Nadu,-,-,-
Sri Krishna Veni College,VIJAYAWADA ,Andhra Pradesh,"0866–2581772,2476232",info@tatinenigopaiah.education,-
"Sri Krishna Veni College, Tanuku",TANUKU ,Andhra Pradesh,08819–225269,-,-
SRI KRISHNA YOGIRAJ DEGREE COLLEGE, ,Uttar Pradesh,-,-,-
Sri Krishna'S Polytechnic College,RAMANATHAPURAM ,Tamil Nadu,-,-,-
Sri Krishnadevaraya Engineering College, ,Andhra Pradesh,-,-,www.skdengg.com
Sri Krishnadevaraya University,ANANTAPUR ,Andhra Pradesh,"91-8554-255700,255703",pricipal@skuniversity.org,http://www.skuniversity.org/
SRI KUBERA VINAYAGAR COLLEGE EDUCATION, ,Tamil Nadu,-,-,-
Sri Kumara Gurupara Swamigal Arts College,TUTICORIN ,Tamil Nadu,-,-,-
SRI KUMARAN TEACHER TRAINING INSTITUTE, ,Tamil Nadu,-,-,-
SRI KUMARESHWAR COLLEGE OF EDUCATION, ,Karnataka,-,-,-
SRI KUMARESHWAR EDUCATION TRUST, ,Karnataka,-,-,-
SRI KUVEMPU D.ED COLLEGE, ,Karnataka,-,-,-
Sri Kuvempu Mahavidyalaya, ,Karnataka,-,-,-
Sri L N Hindu College, ,Haryana,-,-,-
Sri Lakkineni Ramayya Pratibha Model Degree College,KRISHNA ,Andhra Pradesh,"08673–253060,287179",-,-
Sri Lakshmi Ammal Engineering College, ,Tamil Nadu,"044-22290357,22290443",info@slaecollege.edu.in,www.slaecollege.edu.in
SRI LAKSHMI COLLEGE OF EDUCATION, ,Tamil Nadu,-,-,-
"Sri Lakshmi College Of Nursing , Bangalore",BANGALORE ,Karnataka,-,-,-
SRI LAKSHMI MEENAMBIKAI TEACHER TRAININNING INSTITUTE, ,Tamil Nadu,-,-,-
SRI LAKSHMI NARASIMHA COLLEGE OF SCIENCE,PALLURU ,Andhra Pradesh,-,-,-
SRI LAKSHMI NARASIMHA SWAMY D ED COLLEGE, ,Karnataka,-,-,-
SRI LAKSHMI NARASIMHA SWAMY VIDYA SAMSTHE(R), ,Karnataka,-,-,-
"Sri Lakshmi Narayana Institute of Medical Sciences, Pondicherry", ,Pondicherry,"28341865,28341621",srilins@yahoo.com,-
Sri Lakshmi Narsimha Swamy College,NALGONDA ,Andhra Pradesh,08685–242118,-,-
"Sri Lakshmi School Of Nursing , Guntur",GUNTUR ,Andhra Pradesh,-,-,-
"Sri Lakshmi School Of Nursing , Kothapet",KOTHAPETA ,Andhra Pradesh,+91-863-2224271,-,-
Sri Lakshmi Srinivasa Degree College,CUDDAPAH ,Andhra Pradesh,-,-,-
SRI LAKSHMI VENKATESHWARA COLLEGE, ,Karnataka,-,-,-
"Sri Lakshmi Venkateswara School Of Nursing , Chitradurga",CHITRADURGA ,Karnataka,-,-,-
"Sri Lakshmi Venkateswara School Of Nursing , Hindupur",HINDUPUR ,Andhra Pradesh,08554-249690,-,-
SRI LAKSHMI VIDYALAYA TEACHER TRAINING INSTITUTE, ,Karnataka,-,-,-
"Sri Lal Bahadur Shastri College Of Nursing, , Jodhpur",JODHPUR ,Rajasthan,-,-,-
"Sri Lal Bahadur Shastri Research & Training Institute,Jodhpur",JODHPUR ,Rajasthan,-,-,-
"Sri Laxmanrao Mankar Instt.of Pharmacy , Gondia", ,Maharashtra,"07189-225355,225145",-,-
Sri Laxmi Ganapathi Degree College,VIZIANAGARAM ,Andhra Pradesh,08922–223824,slgdc@yahoo.co.in,-
SRI LAXMI KISHORI MAHAVIDYALA, ,Bihar,-,-,-
Sri Laxmi Narasimha College Of Science,PALLURU ,Andhra Pradesh,"08572–258022,258439,0416–242439",nsimhd1@sancharnet.in,-
SRI LAXMI VIDYA VARDH SANGHA (R), ,Karnataka,-,-,-
Sri Lazminaresmta Sanskrit Andhra Kalasala,KARIMNAGAR ,Andhra Pradesh,-,-,-
"Sri Lepaksha Swamy School Of Nursing , Chitradurga",CHITRADURGA ,Karnataka,-,-,-
SRI LEUVA PATEL TRUST MBA MAHILA COLLEGE,AMRELI ,Gujarat,02792-232321/22/23,amrelisankul.org,www.amrelisankul.org
SRI M.C. SHIVANANDA SHARMA MEMORIAL VIDYODAYA D.ED, ,Karnataka,-,-,-
Sri Maa Mahila Mahavidyalaya, ,Orissa,-,-,-
Sri Maddaneswara Government First Grade College, ,Karnataka,-,-,-
SRI MAHALAKSHMI PEETA MAHASAMSTHAN TRUST, ,Karnataka,-,-,-
SRI MAHALAKSHMI TEACHER S TRAINING INSTITUTE FOR WOMENMANGALAM, ,Tamil Nadu,-,-,-
SRI MAHALINGESHWARA SWAMY TEACHER TRAINING INSTITUTE, ,Karnataka,-,-,-
SRI MAHANTESHWARA VIDY SAMSTHE(R), ,Karnataka,-,-,-
SRI MAHARUDRA SWAMY D.ED COLLEGE, ,Karnataka,-,-,-
SRI MAHAVEER PRASAD MAHILA MAHAVIDYALAYA, ,Uttar Pradesh,-,-,-
Sri Mahaveera College, ,Karnataka,-,-,-
SRI MAHESHWARA COLLEGE OF PHYSICASL EDUCATION, ,Karnataka,-,-,-
SRI MAILARLINGESHWARA D.ED COLLEGE, ,Karnataka,-,-,-
Sri Majeti (Sm) Guravaiah Degree College,BRODIPET ,Andhra Pradesh,"0863–2231622,2222757",smgdc@yahoo.com,-
SRI MALLIKARJUN VIDYA VARDHAK SANGHS, ,Karnataka,-,-,-
Sri Mallikarjuna Degree College,NALGONDA ,Andhra Pradesh,"08682–252429,253047",-,-
SRI MALLIKARJUNA SWAMY TEACHERS TRAINING INSTITUTE, ,Karnataka,-,-,-
SRI MANAKULA VINAYAGAR COLLEGE, ,Pondicherry,-,-,-
Sri Manakula Vinayagar Engineering College, ,Pondicherry,"0413-2641151,2641136,2640040","smvec_engg@sify.com,info@smvec.ac.in",http://www.smvec.ac.in
"Sri Manakula Vinayagar Medical College & Hospital Campus , Pondicherry",PONDICHERRY ,Pondicherry,-,-,-
"Sri Manakula Vinayagar Medical College & Hospital, Pondicherry",PONDICHERRY ,Pondicherry,0413-2643000,smvmch@sify.com,www.smvmch.ac.in
Sri Manakula Vinayagar Medical College and Hospital, ,Pondicherry,-,-,-
"Sri Manakula Vinayagar Nursing College , Madagadipet",PONDICHERRY ,Pondicherry,-,-,-
Sri Manakula Vinayagar Polytechnic College, ,Tamil Nadu,"04132643080,04132643081,9442865625",smvptc2011@gmail.com,www.smvptc.edu.in
SRI MANICKAM COLLEGE OF EDUCATION, ,Tamil Nadu,-,-,-
Sri Manikanta Kannababu & Konathala Degree College,YELLAMANCHILI ,Andhra Pradesh,-,-,-
SRI MANJARI HANUMANTHAPPA COLLEGE EDUCATION, ,Karnataka,-,-,-
SRI MANJUNATHESHWARA D.ED COLLEGE, ,Karnataka,-,-,-
SRI MARIYAMMAN TEACHER TRAINING INSTITUTE, ,Tamil Nadu,-,-,-
SRI MARKANDESHWAR INSTITUTE OF MGT,KURUKSHETRA ,Haryana,9416180203,-,-
SRI MARUTHAMALAIYAN TEACHER TRAINING INSTITUTE, ,Tamil Nadu,-,-,-
"Sri Maruthi Degree College, Medak",NARASAPUR ,Andhra Pradesh,9247291663,-,-
Sri Maruthi First Grade College, ,Karnataka,-,-,-
SRI MARUTHI TEACHEER TRAINING INSTITUTE D.ED, ,Karnataka,-,-,-
SRI MARUTHI TEACHERS TRAINING CENTER, ,Karnataka,-,-,-
SRI MARUTI D.ED COLLEGE, ,Karnataka,-,-,-
Sri Meenakshi Government Arts College For Women,MADURAI ,Tamil Nadu,-,smgc@rediffmail.com,-
Sri Mittapalli college of Engineering, ,Andhra Pradesh,0863-2344402,smcengg@yahoo.com,www.srimittapallieducation.com
Sri Mittapalli Institute of Technology for Women, ,Andhra Pradesh,0863-2288691-694,smitw08@gmail.com,-
Sri Modamamba Degree College,PADERU ,Andhra Pradesh,-,-,-
"Sri Mohanlal NarandasCollege of Pharmacy , KHAMBHAT", ,Gujarat,0-2654-224854,-,-
Sri Mookambika College of Physiotherapy,KANYAKUMARI ,Tamil Nadu,-,-,-
SRI MOOKAMBIKA D.ED COLLEGE, ,Karnataka,-,-,-
"Sri Mookambika Institute of Dental Sciences , Kanyakumari",KANYAKUMARI ,Tamil Nadu,04651-280866,smims-rv@sancharnet.in,www.smims.org
"Sri Mruthyunjaya School Of Nursing , Davangere",DAVANAGERE ,Karnataka,-,-,-
"Sri Mruthyunjaya School Of Nursing,Davanagere",DAVANAGERE ,Karnataka,-,-,-
"Sri Mukund Degree College, Tirupati",TIRUPATI ,Andhra Pradesh,"0877–2246656,5572713",-,-
SRI MUPPUDATHI AMMAN COLLEGE EDUCATION, ,Tamil Nadu,-,-,-
SRI MUPPUDATHIAMMAN TEACHERS TRAINING INSTITUTE, ,Tamil Nadu,-,-,-
Sri Murali Krishna Degree College,GOPALAPATNAM ,Andhra Pradesh,0891–2501289,-,-
Sri Muralidhar Bhagwat Lal Mahavidyalaya, ,Uttar Pradesh,-,-,-
SRI MURUGHA RAJENDRA SWAMIJI M.ED, ,Karnataka,-,-,-
SRI MURUGHARAJENDRA VIDYALAYA T.T.I, ,Karnataka,-,-,-
Sri Muthalamman Polytechnic College,CHENNAI ,Tamil Nadu,"04564226487,04564228487,9842426487",smp520pmk@yahoo.co.in,www.smpcpmk.org
Sri Muthalamman Polytechnic College, ,Tamil Nadu,"04564226487,04564228487,9842426487",smp520pmk@yahoo.co.in,www.smpcpmk.org
Sri Muthukumaran Arts & Science College,CHENNAI ,Tamil Nadu,-,-,-
SRI MUTHUKUMARAN COLLEGE OF EDUCATION, ,Tamil Nadu,"044-64044-599477,9282199114,9789991114",smce@smce-education.com,http://www.smce.edu.in/
Sri Muthukumaran Institute Of Technology, ,Tamil Nadu,"044-24783277,24780002to04",info@smitcollege.org,http://www.smitcollege.org
"Sri Muthukumaran Medical College,Chennai", ,Tamil Nadu,"+914464997670,+914424784000",smmchri@yahoo.com,www.smmchri.res.in
Sri Muthukumarasamy College,CHENNAI ,Tamil Nadu,-,-,-
"Sri Mylaralingeshwara Swamy School Of Nursing , Chitradurga",CHITRADURGA ,Karnataka,-,-,-
"Sri N Jayanna School Of Nursing , Chitradurga",CHITRADURGA ,Karnataka,-,-,-
Sri Nadimpalli Suryanarayana Raju Degree College,REVULAPALEM ,Andhra Pradesh,"08855-257175,255575",-,-
Sri Nagalakshmi Ammal Arts And Science College,MADURAI ,Tamil Nadu,-,-,-
Sri Nagarjuna Degree College,NALGONDA ,Andhra Pradesh,"08689–246891,245241",sndamlg@yahoo.com,-
Sri Nallalaghu Polytechnic College,NAMAKKAL ,Tamil Nadu,-,-,-
Sri Nallulaghu Polytechnic College, ,Tamil Nadu,"04426418265,04426320065,9840481117",srinal303@sify.com,http://snptcollege.org/
Sri Nandhanam College of Engineering & Technology, ,Tamil Nadu,"04179-228146,228892",info@nandhanam.in,http://www.nandhanam.in
Sri Nandhanam Polytechnic College, ,Tamil Nadu,"04179-290272,9095599678",srinandhanam.poly@gmail.com,www.nandhanaam.in
SRI NANDHINI HARI PRI DED COLLEGE, ,Karnataka,-,-,-
SRI NANDI RURAL D ED COLLEGE, ,Karnataka,-,-,-
SRI NANDISWARA VIDYA SAMSTE (R), ,Karnataka,-,-,-
Sri Narahheji Mahavidyalaya Narahi Rasara,BALLIA ,Uttar Pradesh,-,-,-
"Sri Narayani College Of Nursing , Vellore",VELLORE ,Tamil Nadu,-,-,-
"Sri Narayani School Of Nursing , Vellore",VELLORE ,Tamil Nadu,-,-,-
SRI NATARAJA TEACHER TRAINING INSTITUTE, ,Tamil Nadu,-,-,-
Sri Natarja Residential F.G. College For Women, ,Karnataka,-,-,-
SRI NATESANAR TEACHER TRAININGINSTITUTE, ,Tamil Nadu,-,-,-
Sri Navabharathi Degree College,NALGONDA ,Andhra Pradesh,08685–242117,-,-
Sri Neelam Sanjeeva Reddy Arts Science Commerce,KURNOOL ,Andhra Pradesh,"08517–235455,98492-27876",-,-
Sri Nehru Mahavidyalaya College Of Arts & Science,COIMBATORE ,Tamil Nadu,-,-,-
Sri Nehru Memorial College, ,Karnataka,-,-,-
SRI NIDHI COLLEGE OF EDUCATION FOR WOMEN, ,Karnataka,-,-,-
SRI NIRAVANASWAMY COLLEGE OF EDUCATION, ,Karnataka,-,-,-
"Sri Nirvanaswamy College Of Nursing,Kanakapura",BANGALORE ,Karnataka,-,-,-
"Sri Nirvanaswamy School Of Nursing , Bangalore Rural",BANGALORE ,Karnataka,-,-,-
SRI NIRVANASWAMY TEACHER TRAINING INSTITUTE, ,Karnataka,-,-,-
Sri Nivasa Polytechnic College,THANJAVUR ,Tamil Nadu,-,-,-
Sri P. Basi Reddy College of Law,CUDDAPAH ,Andhra Pradesh,0862-65311,-,-
Sri Padmam Polytechnic College, ,Tamil Nadu,"04179-224438,04179-220438",Padmampolytechnic@gmail.com,-
SRI PADMAM TEACHER TRAINING INSTITUTE, ,Tamil Nadu,-,-,-
"Sri Padmanabha Degree College, Medak",SADASIVPET ,Andhra Pradesh,08455-554442,-,-
SRI PADMARAJA COLLEGE PHYSICAL EDUCATION, ,Karnataka,-,-,-
"Sri Padmavathamma College Of Nursing,Tirupati",CHITOOR ,Andhra Pradesh,-,-,-
Sri Padmavathi College,KAVALI ,Andhra Pradesh,"08626–240915,93473-11989",-,-
Sri Padmavathi College of Computer Sciences and Technology, ,Andhra Pradesh,"+91-877-2237670,2289271","sptcpadmavathi@gmail.com,administrator@sripadmava",http://www.sripadmavathicolleges.com/mca
Sri Padmavathi College of Engineering,KANCHIPURAM ,Tamil Nadu,"044-24352883to87,9940062881",padmavathicollege@hotmail.com,http://www.sapthagirigroup.com
"Sri Padmavathi College Of Nursing , Anantapur",ANANTAPUR ,Andhra Pradesh,-,-,-
"Sri Padmavathi M P H W f Training School,Anantapur",ANANTAPUR ,Andhra Pradesh,-,-,-
Sri Padmavathi Mahila Kalasala,HYDERABAD ,Andhra Pradesh,24072750,spmkalasala81@yahoo.co.in,-
"Sri Padmavathi Mahila Visvavidyalayam, Tirupati",TIRUPATI ,Andhra Pradesh,0877-2249594/2248481,-,-
"Sri Padmavathi Mphw f Trg Institute,Tirupati",TIRUPATI ,Andhra Pradesh,-,-,-
"sri padmavathi school of nursing , kadapa",CUDDAPAH ,Andhra Pradesh,-,-,www.padmavathiinstitutions.com
"Sri Padmavathi School Of Nursing , Nellore",NELLORE ,Andhra Pradesh,0861-2322040,-,-
"Sri Padmavathi School Of Nursing , Tirupati",TIRUPATI ,Andhra Pradesh,0877-2280511,-,www.sripadmavathicolleges.com
Sri Padmavathi school of pharmacy, ,Andhra Pradesh,0877-2237670,spspprinci@yahoo.com,http://www.sripadmavathicolleges.com/
"Sri Padmavathi School of Pharmacy , Tiruchanoor",TIRUPATI ,Andhra Pradesh,+91-877-2237670,administrator@sripadmavathicolleges.com,www.sripadmavathicolleges.com
"Sri Padmavathi School of Pharmacy , Tirupati",TIRUPATI ,Andhra Pradesh,0877-2237670,"spspprinci@yahoo.com,administrator@sripadmavathicolleges.com",www.sripadmavathicolleges.com
"Sri Padmavathi Women Polytechnic , Tirupati",TIRUPATI ,Andhra Pradesh,91-44-28552042,-,-
Sri Padmavathi Womens College,TIRUPATI ,Andhra Pradesh,0877–2248401,ttdspwdc@yahoo.co.in,-
Sri Padmavati Mahila Vishwavidyalayam,TIRUPATI ,Andhra Pradesh,910857424111,spmvv@yahoo.com,www.padmavatiwomen-univ.org/
Sri Padmavati Mahila Viswavidhyalayam,CHITOOR ,Andhra Pradesh,9440275549,profrao@yahoo.com,-
"Sri Padmawathi College Of Nursing,Guntakal",GUNTAKAL ,Andhra Pradesh,-,-,-
"Sri Padmawati School Of Nursing , Guntakal",GUNTAKAL ,Andhra Pradesh,"08552223999,+91-9447866183",info@padmavathiinstitutions.com,www.padmavathiinstitutions.com
Sri Pannalal Pithi Smaraka Kelva Vanjya Mahavidyalayam,HYDERABAD ,Andhra Pradesh,24605648,-,-
Sri Paramakalyani College,TIRUNELVELI ,Tamil Nadu,4634283784,spkcollege@rediffmail.com,-
Sri Parasakthi College for Women,TIRUNELVELI ,Tamil Nadu,-,-,-
SRI PARASAKTHI COLLEGE OF EDUCATION FOR WOMEN, ,Tamil Nadu,-,-,-
"Sri Parshwanatha Anm Centre,Mandya",MANDYA ,Karnataka,-,-,-
"Sri Paspo College Of Nursing , Dharmapuri",DHARMAPURI ,Tamil Nadu,-,-,-
SRI PASPO TEACHER TRAINING INSTITUTE, ,Tamil Nadu,-,-,-
Sri Pavani Degree College,GODAVARIKHANI ,Andhra Pradesh,-,-,-
Sri Peddarasu Veeraiah Memorial (Spvm) Degree College,ANANTAPUR ,Andhra Pradesh,08556–235747,-,-
Sri Polytechnic, ,Orissa,-,-,http://sripolytechnic.hpage.co.in/
Sri Poojitha Degree College,SURYAPET ,Andhra Pradesh,08684-253797,-,-
Sri Poornaparajana College, ,Karnataka,-,-,-
Sri Poornaparajna Evening College, ,Karnataka,-,-,-
Sri Pothula Veera Swamy Degree College,PITHAPURAM ,Andhra Pradesh,-,-,-
Sri Potti Sriramulu Degree College,PRAKASAM ,Andhra Pradesh,08402–272118,-,-
Sri Prabhakar Degree College For Women,CUDDAPAH ,Andhra Pradesh,"08568–227252,227252",-,-
SRI PRABHURAJENDRA COLLEGE OF PHYSICAL EDUCATION, ,Karnataka,-,-,-
"Sri Pragathi College of Pharmacy , Bangalore",BANGALORE ,Karnataka,-,-,-
Sri Pragathi Degree College,NELLORE ,Andhra Pradesh,-,-,-
SRI PRAGATHIPARA VIDYAVARDHAKA D.ED COLLEGE, ,Karnataka,-,-,-
Sri Prakash College of Engineering, ,Andhra Pradesh,-,-,www.spcetuni.ac.in
Sri Prakash College Of Engineering, ,Andhra Pradesh,919494628403,sriprakash_spce@rediffmail.com,www.spcetuni.ac.in
Sri Prasannajenya Degree College,PRAKASAM ,Andhra Pradesh,"08593–223885,98484–96516",-,-
Sri Prasunna College of Law,KURNOOL ,Andhra Pradesh,94405-49379,-,-
Sri Pratap College, ,Jammu and Kashmir,-,-,-
Sri Prathiba Degree College,SULLURPET ,Andhra Pradesh,08623–309665,-,-
Sri Prathibha Degree College,SRIKAKULAM ,Andhra Pradesh,08942–228209,-,-
Sri Pratibha Degree College,ONGOLE ,Andhra Pradesh,"08592–233928,220701,220702",-,-
"Sri Pratibha Degree College, Kandukur",KANDUKUR ,Andhra Pradesh,"08592–233928,220701",-,-
Sri R P S College, ,Bihar,-,-,-
SRI R. PONNUSAMY NAIDU COLLEGE OF EDUCATION, ,Tamil Nadu,-,-,-
SRI R.S.MALWAD COLLEGE OF PHYSICAL EDUCATION, ,Karnataka,-,-,-
Sri Raaja Raajan College of Engineering & Technology, ,Tamil Nadu,04565234230,srrcet2010@gmail.com,www.raajaraajan.org
SRI RAAMACHANDIRA COLLEGE OF EDCATION, ,Tamil Nadu,-,-,-
SRI RAGAVENDHRA INSTITUTE OF TEACHER TRAINING, ,Tamil Nadu,-,-,-
SRI RAGAVENDRA COLLEGE OF EDUCATION, ,Tamil Nadu,-,-,-
SRI RAGAVENDRA COLLEGE OF EDUCTAION, ,Tamil Nadu,-,-,-
Sri Ragavendra Polytechnic College,COIMBATORE ,Tamil Nadu,04288263185,principal@sriragavendra.org,www.sriragavendra.org
Sri Ragavendra Polytechnic College, ,Tamil Nadu,04288263185,principal@sriragavendra.org,www.sriragavendra.org
"Sri Ragavendra School Of Nursing ,Nagapattinam",NAGAPATTINAM ,Tamil Nadu,-,-,-
SRI RAGAVENDRA VIDYA SAMASTHE, ,Karnataka,-,-,-
SRI RAGHAVENDRA COLLEG OF EDUCATION, ,Karnataka,-,-,-
SRI RAGHAVENDRA COLLEGE OF EDUCATION, ,Karnataka,-,-,-
"Sri Raghavendra College Of Nursing,Bangalore",BANGALORE ,Karnataka,-,-,-
"Sri Raghavendra College Of Nursing,Tumkur",TUMKUR ,Karnataka,-,-,-
"Sri Raghavendra College Of Nursing,Bangalore",BANGALORE ,Karnataka,-,-,-
"Sri Raghavendra College Of Nursing,Tumkur",TUMKUR ,Karnataka,-,-,-
Sri Raghavendra Degree College,NALGONDA ,Andhra Pradesh,08682–232250,-,-
"Sri Raghavendra Degree College, Alamuru",ALAMURU ,Andhra Pradesh,-,-,-
"Sri Raghavendra Degree College, Narasimhapuram",NARASIMHAPURAM ,Andhra Pradesh,08816–223990,-,-
SRI RAGHAVENDRA INSTITUTE OF DED, ,Karnataka,-,-,-
"Sri Raghavendra Institute Of Nursing , Tumkur",TUMKUR ,Karnataka,-,-,-
SRI RAGHAVENDRA INSTITUTE OF SCIENCES,BHIMAVARAM ,Andhra Pradesh,-,-,-
SRI RAGHAVENDRA INSTITUTE OF TEACHER EDUCATION, ,Tamil Nadu,-,-,-
"Sri Raghavendra School Of Nursing , Chitradurga",CHITRADURGA ,Karnataka,-,-,-
SRI RAGHVENDRA COLLEGE OF EDUCATION, ,Tamil Nadu,-,-,-
SRI RAJ PATI SINGH SHIKSHAN PARASIKSHAN MAHAVIDYALYA, ,Uttar Pradesh,-,-,-
SRI RAJA RAJAN COLLEGE OF EDUCATION, ,Tamil Nadu,-,-,-
SRI RAJA RAJESWARI COLLEGE EDUCATION, ,Tamil Nadu,-,-,-
Sri Raja S.V.R.G.N.R. College Of Arts & Science,KRISHNA ,Andhra Pradesh,"08659–222261,222262",nivruth_suranene@yahoo.co.in,-
SRI RAJALAKSHMI MAHILA SAMAJA SANGHA (S.R.S. D.ED), ,Karnataka,-,-,-
SRI RAJARAJESHWARI COLLEGE OF EDUCATION, ,Tamil Nadu,-,-,-
Sri Rajarajeswari College,PEDDAPURAM ,Andhra Pradesh,08852–241892,-,-
"Sri Rajiv Gandhi College of Dental Sciences & Hospital , Bangalore",BANGALORE ,Karnataka,"91-80-23339377,23631145,23335985,23435559",info@srgcds.ac.in,www.srgcds.ac.in
SRI RAM CHANDRA SINGH MAHAVIDYALAYA, ,Uttar Pradesh,"+91-9415049136,9415795800",-,http://srcsm.org
"Sri Ram College Of Nursing,Kakinada,",KAKINADA ,Andhra Pradesh,-,-,-
SRI RAM INSTITUTE OF BUSINESS & MGT,YAMUNANAGAR ,Haryana,01732-247032/313999,-,-
Sri Ram Institute Of Hotel Management & Cateering, ,Tamil Nadu,"914425350580,25331118",admission@raminstitute.com,http://www.sriramtrust.org
SRI RAM INSTITUTE OF MANAGEMENT & TECHNOLOGY,NOIDA ,Uttar Pradesh,0120-3244053,sriraminstitute@hotmail.com,-
SRI RAM INSTITUTE OF TEACHER EDUCATION, ,Delhi,-,-,-
Sri Ram Janki Mahavidyalaya, ,Uttar Pradesh,-,-,-
SRI RAM KARAN MAHAVIDYALAYA, ,Uttar Pradesh,-,-,-
SRI RAM MULKH INSTITUTE OF MANAGEMENT & TECH,AMBALA ,Haryana,09216666003,-,-
SRI RAM NALLAMANI YADAVA COLLEGE OF EDUCATION, ,Tamil Nadu,-,-,-
SRI RAM NALLAMANI YADAVA TEACHER TRAINING INSTITUTE, ,Tamil Nadu,-,-,-
Sri Ram Polytechnic College,COIMBATORE ,Tamil Nadu,044-27689180,srptpoly@yahoo.co.in,www.sriramtrust.org
