SHRI SHIV PRASAD MEMORIAL GIRLS DEGREE COLLEGE, ,Uttar Pradesh,-,-,-
SHRI SHIVA STC COLLEGE, ,Rajasthan,-,-,-
Shri Shivabasara Swamiji Naggnnur Arts And Commerce College, ,Karnataka,-,-,-
Shri Shivaji Agricultural College, ,Maharashtra,-,-,-
Shri Shivaji Arts & Commerce College, ,Maharashtra,-,-,-
Shri Shivaji College, ,Maharashtra,-,-,-
Shri Shivaji College, ,Maharashtra,-,-,-
Shri Shivaji College Of Arts & Science, ,Maharashtra,-,-,-
Shri Shivaji College Of Arts Science& Commerce, ,Maharashtra,-,-,-
Shri Shivaji College Of Artsscience & Commerce College, ,Maharashtra,-,-,-
Shri Shivaji College Of Education, ,Maharashtra,-,-,-
SHRI SHIVAJI COLLEGE OF EDUCATION, ,Maharashtra,-,-,-
Shri Shivaji College Of Science,NAGPUR ,Maharashtra,(0)(0712)-2423432,shivnet@dataone.in/shivajiscience_ngp@yahoo.com,www.shivajisciencecollegenapur.org
Shri Shivaji Edu. Soc's Amarvathy's Coll. of Engg. & Tech, ,Maharashtra,-,-,-
Shri Shivaji Law College,NANDED ,Maharashtra,02466-223484,sslck145@gmail.com,-
Shri Shivaji Law College and Research Centre, ,Maharashtra,"02452-220109,232595,221353",-,-
Shri Shivaji Mafat Education Societys, ,Maharashtra,-,-,-
Shri Shivaji Mafat Education Societys Shri Sant, ,Maharashtra,-,-,-
Shri Shivaji Mahavidyalaya, ,Maharashtra,-,-,-
Shri Shivaji Maratha Society Punes Law College,PUNE ,Maharashtra,24434024,ssmslawpune@yahoo.com,-
Shri Shivaji Maratha Societys Law College,PUNE ,Maharashtra,"91-20-24434024,24431144,24473946",ssmslawpune@yahoo.com,www.ssmslawpune.com
SHRI SHIVAJI MARTHI TEACHER TRAINING INSTITUTION, ,Karnataka,-,-,-
Shri Shivaji Science College, ,Maharashtra,-,-,-
SHRI SHIVAJI SHIKSHAN PRASARAK MANDAL, ,Maharashtra,-,-,-
Shri Shivaji V.P.Santha's College of Engineering,DHULE ,Maharashtra,(02562)-272713/272229,ssvpsengg@sancharnet.in,www.ssvps.org
"Shri Shivaji Viddhya Prasarak Sanstha's Bapusaheb Shivajirao Deore Polytechnic, Dhule", ,Maharashtra,"+91-2562-272713,272229,272976",kachave@gmail.com,http://www.ssvps.org
Shri Shivaji Vidya Prasarak Sansthas Late S.D. Patil Alias Baburao Dada Arts M.D. Shidsode Science Colleg, ,Maharashtra,-,-,-
Shri Shivaji Vidya Prasarak Sansthas Late S.D. Patil Alias Baburao Dada Arts M.D. Shidsode Science College, ,Maharashtra,-,-,-
"Shri Shivaramakrishna S R K School Of Nursing , Bangalore",BANGALORE ,Karnataka,-,-,-
SHRI SHIVAYOGEESHWARA RURAL D.ED COLLEGE, ,Karnataka,-,-,-
Shri Shivayogi Murughendra Swamiji Arts Science And Commerce College, ,Karnataka,-,-,-
SHRI SHIVAYOGI SANGAMARYA VIDYA SAMST SHRI SHIVAYOGI SANGAMARYA VIDY, ,Karnataka,-,-,-
SHRI SHIVDAN SINGH SMRITI COLLEGE, ,Uttar Pradesh,-,-,-
SHRI SHIVDAN SINGH SMRITI COLLEGE, ,Uttar Pradesh,-,-,-
SHRI SHIVMANDIR SANATAN DHARAM SR. SEC. SCHOOL & D.ED CENTRE, ,Haryana,-,-,-
Shri Shivsankat Haran Adarsh Sanskrit College, ,Uttar Pradesh,-,-,-
SHRI SHRADDHA NATH TEACHER EDUCATION COLLEGE, ,Rajasthan,-,-,-
SHRI SHRI SIDDESHWAR TEACHERS TRAINING COLLEGE, ,Karnataka,-,-,-
"Shri Shrishti College Of Nursin,Durg",DURG ,Chhattisgarh,-,-,-
SHRI SHYAM SHIKSHAK PRASHIKSHAN VIDYALAYA, ,Rajasthan,-,-,-
Shri Shyam Sundar Degree College, ,Uttar Pradesh,-,-,-
SHRI SIDDARAMESHVAR D.ED. COLLEGE, ,Karnataka,-,-,-
Shri Siddarameshwar Degree College, ,Karnataka,-,-,-
SHRI SIDDARAMESHWAR VIDYA VARDHAK SANGH GADDANAKERI, ,Karnataka,-,-,-
Shri Siddeshwar Law College,BIJAPUR ,Karnataka,08352-257260,-,-
"Shri Siddha Balaji School Of Nursing , Rajnandgaon",RAJNANDGAON ,Chhattisgarh,-,-,-
Shri Siddheshwar Mahavidyalaya, ,Maharashtra,-,-,-
"Shri Siddheshwar Samsthes College Of Nursing,Bijapur",BIJAPUR ,Karnataka,-,-,-
"Shri Siddheswar College Of Nursing ,Bijapur",BIJAPUR ,Karnataka,-,-,-
"Shri Siddhi Balaji School Of Nursing,Rajnandgaon",RAJNANDGAON ,Chhattisgarh,-,-,-
SHRI SIDDHI VINAYAK DEGREE COLLEGE, ,Uttar Pradesh,-,-,-
Shri Siddhi Vinayak Institute of Management, ,Uttar Pradesh,"0581-2582222,2582211,2582160",ssvitbly@gmail.com,www.ssvit.org
SHRI SIDDHIVINAYAKA RURAL COLLEGE OF EDUCATION, ,Karnataka,-,-,-
SHRI SIRDLI SAL BABA GIRLS B.ED. COLLEGE, ,Rajasthan,-,-,-
Shri Sitheshwarar Polytechnic College,CHENNAI ,Tamil Nadu,-,-,-
Shri Smt P K Kotawala Arts College, ,Gujarat,-,-,-
SHRI SOBAI BALIKA SHIKSHAK PRASHIKSHAN VIDYALAYA, ,Rajasthan,-,-,-
Shri Somalal Kasturdas Shah And Shri Krishna O M Arts College, ,Gujarat,-,-,-
SHRI SOMANATH TEACHER TRAINING INSTITUTE, ,Karnataka,-,-,-
SHRI SURAJ SINGH MEMORIAL COLLEGE, ,Uttar Pradesh,-,-,-
Shri Surat Jilla Sahkari Bank Commerce College, ,Gujarat,-,-,-
Shri Suryanarayan Smarak Sanskrit Mahavidyalaya, ,Uttar Pradesh,-,-,-
SHRI SUVIDHA VYAYAM MAHAVIDHYALAYA, ,Gujarat,-,-,-
Shri Swami Bhumanand College-School of Nursing, ,Uttaranchal,"01334-326440,252068",info@shribhumahospital.org,www.shribhumahospital.org
"Shri Swami Narayan Nursing Institute,Nashik",NASHIK ,Maharashtra,-,-,-
SHRI SWAMI SAMARTH COLLEGE OF EDUCATION, ,Maharashtra,-,-,-
SHRI SWAMI SAMARTH COLLEGE OF PHYSICAL EDUCATION, ,Maharashtra,-,-,-
"Shri Swami Samarth Nursing School,Yavatmal",YAVATMAL ,Maharashtra,-,-,-
Shri Swami Vivekanand Education Societys College Of Education, ,Maharashtra,-,-,-
Shri Swami Vivekanand Law College,GHAZIABAD ,Uttar Pradesh,01235698,-,-
"Shri Swami Vivekanand Shikshan Shanshta Kolhapur, Institute of Pharmacy , Sangli",SANGLI ,Maharashtra,-,-,-
SHRI SWAMIJI MAHARAJ COLLEGE OF EDUCATION & SCIENCE, ,Madhya Pradesh,-,-,-
"Shri Swamiji Maharaj College Of Nursing ,Datia",DATIA ,Madhya Pradesh,-,-,-
"Shri Swamiji Mahraj College Of Nursing , Datia",DATIA ,Madhya Pradesh,-,-,-
"Shri Swaminarayan School Of Nursing , Surat",SURAT ,Gujarat,-,-,-
SHRI SWAMINARAYAN VIJAY B.P.ED. COLLEGE, ,Gujarat,-,-,-
Shri Swaminarayanan Arts College, ,Gujarat,-,-,-
Shri SY Jagtap Guruji Shikshan Prasarak Mandal,SHOLAPUR ,Maharashtra,-,-,-
SHRI TAIJAL TEACHER TRAINING COLLEGE, ,Rajasthan,-,-,-
"Shri Takhatmal, Shrivallabh Homoeopathic Medical College",AMRAVATI ,Maharashtra,-,-,-
Shri Teekamani Sanskrit College, ,Uttar Pradesh,-,-,-
SHRI TEJENDRA PRASAD SECONDARY TEACHERS TRAINING COLLEGE, ,Rajasthan,-,-,-
Shri Thakur Ji Maharaj Mahavidyalaya, ,Uttar Pradesh,-,-,-
SHRI THAKURJI MAHARAJ MAHAVIDHAYLAYA, ,Uttar Pradesh,-,-,-
Shri Thakurji Maharaj Mahavidyalaya, ,Uttar Pradesh,-,-,-
SHRI TIKA RAM KANYA MAHAVIDYALAYA, ,Uttar Pradesh,-,-,-
Shri Tridandidev Sanskrit College, ,Uttar Pradesh,-,-,-
"Shri Tripura Sundri Nursing School , Banswara", ,Rajasthan,-,-,-
Shri Tulja Bhavani College of Engineering,OSMANABAD ,Maharashtra,(02471)-242016,osd_stbcomp@sancharnet.in,www.stbcet.org
SHRI TULJABHAVANI BAHUUDDESHIY SAMAJSEVA SANSTHA, ,Maharashtra,-,-,-
Shri U K Vachhani Mahila Arts College, ,Gujarat,-,-,-
"Shri U S B College Of Nursing,Sirohi", ,Rajasthan,-,-,-
"Shri U.S.B. College of Pharmacy , Sirohi", ,Rajasthan,02974-226686,-,-
SHRI U.S.B. COLLEGE OF TEACHER EDUACTION, ,Rajasthan,-,-,-
Shri Umedram Panchal Arts Smt Maniben G P Science V L Shah Commerce College, ,Gujarat,-,-,-
SHRI UMRAO B.ED CPLLEGE, ,Rajasthan,-,-,-
"Shri USB Polytechnic College,  Sirohi", ,Rajasthan,99822-61953,bhatib4u@yahoo.com,-
SHRI UTAGANOOR BASAVALINGA TATA EDUCATION, ,Karnataka,-,-,-
Shri V D Deshmukh Polytechnic, ,Maharashtra,263550,gurukul.svdd.edu@gmail.com,-
Shri V M Mehta Municipal Arts Commerce College, ,Gujarat,-,-,-
SHRI V P R B ED COLLEGE, ,Tamil Nadu,-,-,-
SHRI V.J. PATEL COLLEGE OF PHYSICAL EDUCATION, ,Gujarat,-,-,www.cesociety.in
SHRI VAIDEHI DEVI MAHILA SHIKSHAK PRASHIKSHAN MAHAVIDYALAYA, ,Rajasthan,-,-,-
Shri Vaishnav College of Commerce, ,Madhya Pradesh,-,-,-
SHRI VAISHNAV COLLEGE OF EDUCATION, ,Madhya Pradesh,-,-,-
SHRI VAISHNAV COLLEGE OF TEACHERS TRAINING, ,Madhya Pradesh,-,-,-
Shri Vaishnav Institute of Management, ,Madhya Pradesh,"+91-731-2780011,2382962",director@svimi.org,http://www.svimi.org
Shri Vaishnav Institute of Technology,INDORE ,Madhya Pradesh,07321-224371-75,principal_svits@yahoo.com,www.svits.co.in
Shri Vaishno Devi College Education, ,Jammu and Kashmir,-,-,-
SHRI VAISHNO DEVI TEACHER TRAINING COLLEGE, ,Haryana,-,-,-
SHRI VALMIKI EDUCATION SOCIETY, ,Karnataka,-,-,-
Shri Vankatesh Kala Vanijya Mahavidyalaya, ,Maharashtra,-,-,-
Shri Vanraj Arts and Commerce College, ,Gujarat,-,-,-
SHRI VARNA TEACHER TRAINING COLLEGE, ,Uttar Pradesh,-,-,-
SHRI VARSHNEYA COLLEGE, ,Uttar Pradesh,-,-,-
SHRI VARUDHI TEACHER TRAINING INSTITUTE, ,Tamil Nadu,-,-,-
"Shri Vasant Rao Naik Government Medical College, Yavatmal",YAVATMAL ,Maharashtra,"0723-242456,240856",deanvngmc@sancharnet.in,-
"Shri Vasant Rao Naik Govt. Medical College, Yavatmal",YAVATMAL ,Maharashtra,"0723-242456,240856",deanvngmc@sancharnet.in,-
Shri Vasantrao Naik Arts & Commerce College, ,Maharashtra,-,-,-
Shri Vasantrao Potadar Polytechnic, ,Karnataka,0831-2405505,-,-
Shri Vasavi College,ERODE ,Tamil Nadu,-,-,-
"Shri Vatavriksha Swami Maharaj Devashtan's Polytechnic, Akkalkot", ,Maharashtra,02181221321,swamipolytechnic@gmail.com,http://www.swamipolytechnic.com
Shri Vedamu Vedic Vidyapith, ,Uttar Pradesh,-,-,-
SHRI VEERABHADRESHWARA EDUCATION TRUST, ,Karnataka,-,-,-
SHRI VEERABHADRESHWARA RURAL TEACHERS TRAINING D.ED INSTITUTE, ,Karnataka,-,-,-
SHRI VEERESHWAR COLLEG OF D ED, ,Karnataka,-,-,-
SHRI VEERTAPASVI CHANNAVEER SHIVACHARYA B.ED. COLLEGE, ,Maharashtra,-,-,-
Shri Venkatesh Mahavidyalaya, ,Maharashtra,-,-,-
Shri Venkateshwar Institute of Technology,INDORE ,Madhya Pradesh,"0731-6455260-62,2450505,2459090",chairman@vitenggcollege.com,-
Shri Venkateshwara University, ,Uttar Pradesh,"+91-8859500757,8859500741",info@svu.edu.in,www.svu.edu.in
SHRI VIDHAYADHARM PRACHARK SANSKRIT HINDI MAHAVIDYALAYA, ,Haryana,-,-,-
SHRI VIDHYA MANDHIR COLLEGE EDUCATION, ,Tamil Nadu,-,-,-
Shri Vidya Vikas Mandals Shri Sant Damaji Mahavidy, ,Maharashtra,-,-,-
SHRI VIJAY CHANDRASHEKHARA COLLEGE OF EDUCATION, ,Karnataka,-,-,-
Shri Vijay Mahantesh Vidyavardhak Sanghas College, ,Karnataka,-,-,-
SHRI VIJAY SWAROOP MAHILA COLLEGE OF EDUCATION, ,Uttar Pradesh,-,-,-
SHRI VIJAYA MAHANTESH VIDYAVARDHAK SANGHA ILKAL, ,Karnataka,-,-,-
Shri Vijayanagar Law College,ANANTAPUR ,Andhra Pradesh,-,-,-
"Shri Vijaysinh Mohite Patil College Of Nursing , Sholapur",SHOLAPUR ,Maharashtra,-,-,-
Shri Vijaysinha Yadav Arts & Science College, ,Maharashtra,-,-,-
Shri Vileshwar Sanskrit College, ,Uttar Pradesh,-,-,-
"Shri Vinayak Institute Of Nursing,Jaipur",JAIPUR ,Rajasthan,-,-,-
SHRI VINAYAK MAHAVIDYALAYA, ,Uttar Pradesh,-,-,-
SHRI VINAYAK VIDYAVARDHAK. SANGHAS SHRI SHEGUNSHI D.ED COLLEGE, ,Karnataka,-,-,-
"Shri Vishnu College Of Pharmacy , Bhimavaram",BHIMAVARAM ,Andhra Pradesh,08816-250863,"info@svcp.edu.in,contact@svcp.edu.in,svcp97@gmail.com",www.svcp.edu.in
Shri Vishnu Engineering College For Women, ,Andhra Pradesh,-,"bvrmsvecw@rediffmail.com,examcellsvecw@gmail.com",www.svecw.edu.in
SHRI VISHNU S.D COLLEGE, ,Himachal Pradesh,-,-,-
SHRI VISHNU S.D.P.G. COLLEGE, ,Himachal Pradesh,-,-,-
SHRI VISHWA MITEACHERS TRAININGER SEKHRI TEACHER TRAINING COLLEGE, ,Punjab,-,-,-
"Shri Vishwa Mitter Sekhri School Of Nursing , Batala", ,Punjab,-,-,-
SHRI VISHWA NATH MAHAVIDYALAYA, ,Uttar Pradesh,-,-,-
SHRI VISHWARADHYA D.ED COLLEGE, ,Karnataka,-,-,-
SHRI VISVESHWARA TEACHER TRAINING INSTITUTE, ,Karnataka,-,-,-
Shri Vithal Education & Research Inst. College of Engg,GOPALPUR ,Maharashtra,(02186)O-225083,coe_pan@rediffmail.com,www.coepr.org
Shri Vithal Education & Research Institute, ,Maharashtra,"+91-2186-225083,220289",principal@coe.sveri.ac.incontact@coe.sveri.ac.in,http://coe.sveri.ac.in
"Shri Vithal Education &Research Institute College of Pharmacy , Solapur", ,Maharashtra,+91-02186-225893,-,-
"Shri Vivekanand Institute Of Nursing,Ahmednagar",AHMEDNAGAR ,Maharashtra,-,-,-
SHRI VIVEKANANDA EDUCATION SOCIETY, ,Karnataka,-,-,-
Shri Warna Vibhag SM's Tatya Saheb Kore Inst. of Engg. & Tech,KOLHAPUR ,Maharashtra,(02328)-224030/223561,tkietwarana@yahoo.com,www.kietwarana.org
SHRI YASHWANT SINGH B.ED. COLLEGE, ,Madhya Pradesh,-,-,-
SHRI YEDATORE VIDYA SAMSTHE B.ED COLLEGE, ,Karnataka,-,-,-
Shri Yogeshwari Polytechnic College, ,Maharashtra,244770,principalyp@yogeshwariscience.org,www.ypca.org
Shri Yut Vidhi Mahavidyalaya,REWA ,Madhya Pradesh,-,-,-
"Shri. Gulabrao Deokar College of Engineering, Jalgaon", ,Maharashtra,"+912572261136,2263036,2260527",principal@sgdcoejalgaon.org,http://www.sgdcoejalgaon.org
SHRI. JAYSUKLAI VADHAR INSTITUTE OF MANAGEMENT STUDIES,JAMNAGAR ,Gujarat,-,-,www.jvims.org
Shri. M.H.Kadakia Institute of Management & Computer Studies, ,Gujarat,02646-243422,mhkct@kadakiaeducation.com,-
Shri. Ramdeo Baba Kamla Nehru Engineering College, ,Maharashtra,"(91)-(712)-2582844,2580011",info@rknec.edu,www.rknec.edu
Shri. Sharanabasaveshwar Science College, ,Karnataka,-,-,-
Shri. Sharda College, ,Karnataka,-,-,-
Shri. Shivaji Polytechnic Institute, ,Maharashtra,234047,principal.sspi@gmail.com,www.sspi.net.in
SHRI.SAHEBGOUDA KALLAPP BIRADAR D.ED COLLEGE, ,Karnataka,-,-,-
SHRI.SIDDHIVINAYAKA RURAL PG M.ED COLLEGE, ,Karnataka,-,-,-
SHRI.YEDEYUR SIDDALINGESHWAR COLLEGE OF EDUCATION, ,Karnataka,-,-,-
SHRIAGRASEN MAHILA P.G. COLLEGE, ,Uttar Pradesh,-,-,-
SHRIAGRASEN MAHILA SHIKSHAK PRASHIKSAHAN MAHAVIDYALAYA, ,Rajasthan,-,-,-
SHRIAGRASEN MAHILA TEACHER TRAINING COLLEGE, ,Rajasthan,(02953)270093,-,-
SHRIAGRASEN SNATKOTEACHERS TRAININGAR MAHAVIDYALAYA, ,Rajasthan,-,-,-
SHRIAGRASEN SNATKOTEACHERS TRAININGAR MAHAVIDYALAYA, ,Rajasthan,-,-,-
SHRIAGRASEN TEACHER TREINING SCHOOL(SHRIAGRASEN S T C SCHOOL), ,Rajasthan,-,-,-
SHRIAGRASON MAHILA SHIKSHAK PRASHIKSHAN MAHAVIDYALAYA, ,Rajasthan,-,-,-
"Shridevi  Polytechnic, Tumkur", ,Karnataka,0816-9343995632,-,-
SHRIDEVI COLLEGE OF EDUCATION, ,Karnataka,"0816-3208448,2211768",Shridevi_iet@indiatimes.com,www.shridevieducation.org
"Shridevi College Of Nursing, Tumkur",TUMKUR ,Karnataka,-,-,-
"Shridevi College Of Nursing, Tumkur",TUMKUR ,Karnataka,-,-,-
Shridevi Institute of Engineering Technology, ,Karnataka,ShrideviInstituteofEngineeringTechnology,shridevi_iet@indiatimes.com,http://www.shrideviengineering.org/
"Shridevi School Of Nursing , Tumkur",TUMKUR ,Karnataka,-,-,-
Shridhar University, ,Rajasthan,+91-8003090120-25,info@shridharuniversity.ac.in,www.shridharuniversity.ac.in
SHRIHARYANA SHEKHAWATI BRAHMACHARYA ASHRAM, ,Haryana,-,-,-
Shriji Institute of Legal & Vocational Education And Researchs Silver Law College,BAREILLY ,Uttar Pradesh,-,-,-
"Shriji Institute of Legal, Vocational Education & Research",BAREILLY ,Uttar Pradesh,"0581-2602029,09837485855",-,-
SHRIMAD RAJCHANDRA INSTITUTE OF MANAGEMENT AND COMPUTER APPLICATION,SURAT ,Gujarat,02625-255744,bankim_patel@hotmail.com,www.bpkm.org.in
Shriman Bhausaheb Zadbuke Mahavidyalaya, ,Maharashtra,-,-,-
SHRIMAN BHAUSAHEB ZADBUKE WOMEN COLLEGE OF EDUCATION, ,Maharashtra,-,-,-
SHRIMAN DHARAMSINGH B. COLLEGE, ,Karnataka,-,-,-
"Shrimati Anitatai Naik School Of Nursing,Yavatmal",YAVATMAL ,Maharashtra,-,-,-
SHRIMATI B.F. KADRI P.T.C. COLLEGE, ,Daman and Diu,-,-,-
Shrimati Genda Devi Mahavidyalaya, ,Uttar Pradesh,-,-,-
Shrimati Indira Gandhi Government Degree College, ,Uttar Pradesh,-,-,-
SHRIMATI MANHHARI DEVI TEACHERS TRAINING COLLEGE, ,Haryana,-,-,-
SHRIMATI MANOHARI DEVI TEACHERS TRAINING COLLEGE, ,Rajasthan,-,-,-
Shrimati Savitarani Naryandas Jawandhiya Mahavidy, ,Maharashtra,-,-,-
SHRIMATI SHARBATI DEVI MAHILA TEACHERS TRAINING COLLEGE, ,Rajasthan,-,-,-
"Shrinath B. Sc. College Of Nursing,Rajsamand", ,Rajasthan,-,-,-
"Shrinath Education Institute Of Nursing, Rajsamand", ,Rajasthan,-,-,-
"Shrinath Institute Of Nursing, Udaipur",UDAIPUR ,Rajasthan,-,-,-
Shrinath Sanskrit College, ,Uttar Pradesh,-,-,-
Shrinathji Institute of Technology & Engineering,UDAIPUR ,Rajasthan,"02953-233238,234738,231748",info_shrinathji_institute@yahoo.co.in,http://www.shrinathjiinstitute.com
SHRINIDHI COLLEGE OF EDUCATION, ,Karnataka,-,-,-
"Shrinidhi College Of Nursing , Madurai",MADURAI ,Tamil Nadu,-,-,-
"Shrinidhi College Of Nursing,Bangalore",BANGALORE ,Karnataka,-,-,-
"Shrinidhi Institute Of Nursing , Bangalore",BANGALORE ,Karnataka,-,-,-
Shripatrao Chougule Arts & Commerce College, ,Maharashtra,-,-,-
Shripatrao Kadam Mahavidyalaya, ,Maharashtra,-,-,-
SHRIRAM COLLEGE OF EDUCATION AND TRAINING, ,Maharashtra,-,-,-
ShriRam College of Engineering & Management,GWALIOR ,Madhya Pradesh,"07532-255798,255873,255893,4071858",-,www.screm.org
SHRIRAM EDUCATION SOCIETY, ,Maharashtra,-,-,-
Shriram IGNOU Community College, ,Tamil Nadu,044-22384767/9962656099/9444106456,-,www.shriramignou.in
ShriRam Institute of Information Technology,GWALIOR ,Madhya Pradesh,07532-255798,sriitgwalior@gmail.com,-
SHRIRAM INSTITUTE OF MANAGEMENT & TECHNOLOGY, ,Uttaranchal,-,-,-
Shriram Sanskrit College, ,Uttar Pradesh,-,-,-
SHRIRMATI UMAWATI DEVI DEGREE COLLEGE, ,Uttar Pradesh,-,-,-
SHRISAI BABA TEACHER TRAINING COLLEGE, ,Haryana,-,-,-
SHRISHIVAJI MARATHA SOCIETY INSTITUTE OF MANAGEMENT & RESEARCH,PUNE ,Maharashtra,020-24222614,imrpune@rediffmail.com,www.imrpune.com
"Shrishti Anm Training Centre,Raipur",RAIPUR ,Chhattisgarh,-,-,-
"Shrishti College Of Nursing , Raipur",RAIPUR ,Chhattisgarh,0771-4262770,-,www.shrishtinursing.org
"Shrishti Institute Of Medical Science & Research Centre,Korba",KORBA ,Chhattisgarh,-,-,-
"Shrishti Institute Of Medical Sciences & Research Centre,Korba",KORBA ,Chhattisgarh,-,-,-
SHRIYUT SHIKSHA SAMITYS SHRIYUT PHYSICAL COLLEGE, ,Madhya Pradesh,-,-,-
SHRIYUT SHIKSHAN SAMITIS SHRIYUT COLLEGE, ,Madhya Pradesh,-,-,-
Shriyut Vidhi Mahavidyalaya,REWA ,Madhya Pradesh,09425185432(M),-,-
SHRREJEE TACHER TRAINING COLLEGE, ,Rajasthan,-,-,-
SHRUTI D ED COLLEGE, ,Karnataka,-,-,-
"Shruti School Of Nursing , Bidar",BIDAR ,Karnataka,-,-,-
Shubasheesh Shiksha Evam Vikas Sewa Sansthan, ,Uttar Pradesh,-,-,-
"Shubh Deep College Of Nursing , Indore",INDORE ,Madhya Pradesh,+91-731-2573620,-,-
SHUBH DEEP SHIKSHAN SANSTHAN, ,Madhya Pradesh,-,-,-
"Shubham Institute Of Nursing Sci. & Research Centre,Ahmedabad",AHMEDABAD ,Gujarat,-,-,-
"Shubham Institute Of Nursing Sci. & Research Centre,Ahmedabad", ,Gujarat,-,-,-
Shubhasheesh Shiksha Evam Vikas Seva Sansthan, ,Uttar Pradesh,05352217123,shubhasheeshsansthan@yahoo.com,www.shubhasheesh.com
"Shubhdeep School Of Nursing , Indore",INDORE ,Madhya Pradesh,-,-,-
Shukdeo Mahto Janta Mahavidyalaya, ,Bihar,-,-,-
SHUKDEO PRASAD TRIPATHI MAHAVIDYALAYA, ,Uttar Pradesh,-,-,-
SHUKDEO PRASAD TRIPATHI MAHAVIDYALAYA, ,Uttar Pradesh,-,-,-
SHUKDEVA KRISHNA TEACHER TRAINING COLLEGE FOR GIRLS, ,Punjab,-,-,-
Shunmuga Industries Arts And Science College,TIRUVANNAMALAI ,Tamil Nadu,-,-,-
SHUSHRUTHI INSTITUTE OF MANAGEMENT STUDIES,BANGALORE ,Karnataka,080-28360671080-28362040,mbasims@gmail.com,-
SHUSHRUTI COLLEGE OF EDUCATION, ,Karnataka,-,-,-
"Shushruti College Of Nursing, Bangalore",BANGALORE ,Karnataka,-,-,-
"Shushruti School Of Nursing , Bangalore",BANGALORE ,Karnataka,-,-,-
SHUTTARIA COLLEGE OF EDUCATION, ,Karnataka,-,-,-
"Shuttaria Institute of Pharmaceutical Science SIPS , Bangalore",BANGALORE ,Karnataka,080-23323068,-,-
"Shuttaria School Of Nursing , Bangalore",BANGALORE ,Karnataka,-,-,-
SHVI BAJRANG POST GRADUATE COLLEGE, ,Uttar Pradesh,-,-,-
SHVI P.L. VERMA TEACHER TRAINING COLLEGE, ,Uttar Pradesh,-,-,-
shwar Chand Vidya Sagar Institute of Management.,MATHURA ,Uttar Pradesh,05662-241072,ivsinstitute@gmail.com,-
SHYADRI INSTITUTE OF MANAGEMENT STUDIES,PUNE ,Maharashtra,-,-,www.sahyadriims.com
Shyam College of Engineering, ,Rajasthan,93140-53038,shyamcollege@gmail.com,-
Shyam college of Engineering of Technology, ,Rajasthan,88902-09999,shyamcollege@gmail.com,-
"Shyam Lal Chandra Shekhar Nursing School , Khagaria", ,Bihar,-,-,-
Shyam Lal College,DELHI ,Delhi,22324086,shyamlalcollegeday@yahoo.co.in,shyamlal.du.ac.in
Shyam Lal College (Evening),DELHI ,Delhi,22324883,shyamlal_e@yahoo.co.in,www.shyamlalcollegeeve.com
SHYAM LAL SARASWATI MAHAVIDYALAYA, ,Uttar Pradesh,-,-,-
Shyam Lal Sarawati Mahavidyalaya, ,Uttar Pradesh,-,-,-
Shyam Nandan Sahay College, ,Bihar,-,-,-
SHYAM NARAYAN URMILA GIRLS TEACHERS TRAINING COLLEGE, ,Uttar Pradesh,-,-,-
SHYAM PRASAD MUKERJI COLLEGE FOR WOMEN, ,Delhi,011-25224499,spmcollegedu@gmail.com,www.spmcollegedu.com
Shyam Shah Medical College,REWA ,Madhya Pradesh,07662-241655/251147,deanmcrewa@rediffmail.com,-
"Shyam Shah Medical College, Rewa",REWA ,Madhya Pradesh,07662-241655/251147,deanmcrewa@rediffmail.com,www.ssmcrewa.com
Shyam Sunder Narayan Mushran Institute of Management & Technology, ,Madhya Pradesh,-,-,-
Shyam Tara Mahila Mahavidyalaya, ,Uttar Pradesh,-,-,-
SHYAM TEACHER TRAINING COLLEGE, ,Haryana,-,-,-
SHYAM TEACHERS TRAINING COLLEGE, ,Rajasthan,-,-,-
Shyama Prasad Institute of Education & Training, ,West Bengal,-,siae@syamaprasadinstt.org,-
Shyama Prasad Mukherjee College,DELHI ,Delhi,"25224499,25225598",-,www.spmcollegedu.com
SHYAMA PRASAD MUKHERJI COLLEGE, ,Delhi,-,-,-
SHYAMA PRASAD MUKHERJI COLLEGE, ,Delhi,-,-,-
Shyama Prasad Singh Mahila College, ,Bihar,-,-,-
Shyameshwar Degree College, ,Uttar Pradesh,-,-,-
Shyamlal Memo. E.S. Shyamlal College of Engineering, ,Maharashtra,-,-,-
Shyamlal Pandviya Government College, ,Madhya Pradesh,-,-,-
SHYAMLAL SARASWATI MAHAVIDYALAYA, ,Uttar Pradesh,-,-,-
SHYAMTEACHER TRAINING COLLEGE, ,Haryana,-,-,-
"Sibar Institute of Dental Sciences , Pedakakani Mandal",GUNTUR ,Andhra Pradesh,"0863-2292149,2292249",info@sids.ac.in,www.sids.ac.in
Sibsagar College, ,Assam,-,-,-
Sibsagar Commerce College, ,Assam,-,-,-
Sibsagar Girls College, ,Assam,-,-,-
Sibsagar Law College,SIBSAGAR ,Assam,-,-,-
SIDANA INSTITUTE OF EDUCATION, ,Punjab,-,-,-
Sidana Institutes of Management & Technology, ,Punjab,+91-1858-21745,sidanacollege@gmail.com,www.sidanainstitutes.com/simt/‎
"Siddaganga  Polytechnic, Tumkur", ,Karnataka,08160-2284425,-,-
SIDDAGANGA COLLEGE OF EDUCATION, ,Karnataka,-,-,-
SIDDAGANGA D ED COLLE, ,Karnataka,-,-,-
Siddaganga Institute of Technology,TUMKUR ,Karnataka,0816-2214000/2214001,principal@sit.ac.in,www.sit.ac.in
SIDDARAMESHWAR D.ED COLLEGE, ,Karnataka,-,-,-
Siddardha College Of Computer Science,NELLORE ,Andhra Pradesh,-,-,-
Siddarth Arts Commerce & Science College, ,Maharashtra,-,-,-
SIDDARTHA COLLEGE OF EDUCATION, ,Karnataka,-,-,-
SIDDARTHA COLLEGE OF TEACHER EDUCATION, ,Tamil Nadu,-,-,-
"Siddartha Degree College, Bhupalpally",BHOOPALPALLY ,Andhra Pradesh,-,-,-
Siddartha Inst. Of Higher Learning,MADANPALLE ,Andhra Pradesh,08571–220359,-,-
Siddartha Inst. Of Hotel Management And Catering Technology,VIJAYAWADA ,Andhra Pradesh,"0866–2493042,2476086,2574593,2435927",vjwsacademy@sancharnet.in,-
SIDDARTHA INSTT. OF COMPUTER SCIENCES,IBRAHIMPATNAM ,Andhra Pradesh,-,-,-
SIDDARTHA TEACHERS TRAINING INSTITUTE, ,Karnataka,-,-,-
SIDDESWAR D.ED COLLEGE, ,Karnataka,-,-,-
Siddha Narayan Ramharsh Degree College, ,Uttar Pradesh,-,-,-
Siddhant College of Engineering,PUNE ,Maharashtra,02027420449,enquiry@caymet.com,www.caymet.com
"Siddhant College of Pharmacy , Maval",MAVAL ,Maharashtra,"(02114)281962,(020)30944798,30961038",-,www.caymet.com
SIDDHANT INSTITUTE OF BUSINESS MANAGEMENT,PUNE ,Maharashtra,020-32502673,siddhantinstitute@yahoo.com,www.caymel.org
Siddharatha Institute Of Technology, ,Karnataka,-,-,-
Siddharatha Institute Of Technology, ,Karnataka,"+91-08162200314,2201073",principal@ssit.edu.in,http://ssit.edu.in/
Siddhardha Degree College,EAST GODAVARI ,Andhra Pradesh,-,-,-
SIDDHARTH B.ED COLLEGE, ,Karnataka,-,-,-
Siddharth College Of Arts Science And Commerce, ,Maharashtra,-,-,-
Siddharth College Of Commerce And Economics, ,Maharashtra,-,-,-
Siddharth College of Law,MUMBAI ,Maharashtra,"022-22823935,22043868,22043614	",principal@siddharthlawcollege.com,-
"Siddharth Degree College, Pydiparru",PYDIPARRU ,Andhra Pradesh,08819–221496,-,-
Siddharth Government College, ,Himachal Pradesh,-,-,-
Siddharth Institute of Engineering & Technology, ,Andhra Pradesh,"08577-224666,224999",sietk_ptr@yahoo.com,www.sietk.org
siddharth institute of engineering & technology, ,Andhra Pradesh,08577-224666,sietk_ptr@yahoo.com,http://www.sietk.org/
"Siddharth Institute Of Nursing Education,sangli",SANGLI ,Maharashtra,-,-,-
"Siddharth Institute Of Nursing, , Jaipur",JAIPUR ,Rajasthan,-,-,-
Siddharth Institute Of Pg Studies,SATTENPALLI ,Andhra Pradesh,08641-237862/63/64/65,principal@nalandacolleges.com,-
Siddharth Institute of Technology, ,Rajasthan,98280-62225,siddharathinstitute@gmail.com,-
Siddharth Law College,GANDHI NAGAR ,Gujarat,79-23226135,principal@siddharthlawcollege.com,-
"Siddharth Law College, Surat",SURAT ,Gujarat,-,principal@siddharthlawcollege.com,-
SIDDHARTH SHIKSHA SANSTHAN, ,Rajasthan,-,-,-
Siddhartha College Garuda Campus, ,Orissa,-,-,-
SIDDHARTHA COLLEGE OF EDUCATION, ,Karnataka,816-2200306,srisiddharthaedu@gmail.com,www.srisiddharthaedu.org
SIDDHARTHA COLLEGE OF EDUCATION, ,Karnataka,-,-,-
Siddhartha Degree College,WARANGAL ,Andhra Pradesh,08718–222455,-,-
Siddhartha Degree College For Women,NARSAMPET ,Andhra Pradesh,-,-,-
"Siddhartha Degree College For Women, Hyderabad",HYDERABAD ,Andhra Pradesh,040–24064179,Siet_08@yahoo.co.in,-
"Siddhartha Degree College, Hyderabad",HYDERABAD ,Andhra Pradesh,-,Siet_08@yahoo.co.in,-
"Siddhartha Degree College, Kamareddy",KAMAREDDY ,Andhra Pradesh,08468–223697,siddhartha@gmail.com,-
"Siddhartha Degree College, Nalgonda",NALGONDA ,Andhra Pradesh,08689–263306,-,-
"Siddhartha Degree College, Rangareddy",SAROORNAGAR ,Andhra Pradesh,-,-,-
"Siddhartha Degree College, Tuni",TUNI ,Andhra Pradesh,"08854–255125,254625",-,-
