Thandra Paparaya Institute of Science & Technology,BOBBILI ,Andhra Pradesh,-,-,-
Thane Municiple Councils Law College,THANE ,Maharashtra,-,lawcollegethane@hotmail.com,-
Thangal Kunju Musaliar College, ,Kerala,-,-,-
Thangam Muthu Polytechnic College, ,Tamil Nadu,"04546235234,9865165996",	tmpc343@yahoo.com,-
Thangam Muthu Polytechnic College,MADURAI ,Tamil Nadu,"04546235234,9865165996",	tmpc343@yahoo.com,-
Thangavelu College Of Science & Management,CHENNAI ,Tamil Nadu,"044-24501408,24501409,24501045,24501377",tec@satyam.net.in,www.thangavelucolleges.com
Thangavelu Engineering College,CHENNAI ,Tamil Nadu,"044-24501377,24501045",tec@satyam.net.in,http://www.thangavelucolleges.com
Thanjavur Medical College,THANJAVUR ,Tamil Nadu,04362-240851/240951/240124,libtmc@md4.vsnl.net.in,-
"Thanjavur Medical College Hospital , School Of Nursing, Thanjavur",THANJAVUR ,Tamil Nadu,-,-,-
Thanthai Hans Roever College,PERAMBALUR ,Tamil Nadu,-,office@roevercollege.ac.in,-
THANTHAI HANS ROEVER COLLEGE EDUCATION, ,Tamil Nadu,-,-,-
Thanthai Hans Roever Institute Of Management,TRICHY ,Tamil Nadu,-,-,-
Thanthai Hans Roever Institute Of Management, ,Tamil Nadu,621212,info@ingeniousdatasolutions.com,www.roevertech.ac.in
Thanthai Periyar E.V.R. Government Polytechnic College,MADURAI ,Tamil Nadu,-,tpevr109@gmail.com,-
Thanthai Periyar Government Institute of Technology, ,Tamil Nadu,0416-2227762,info@tpgit.edu.in,www.tpgit.edu.in
"Thanthai Roever College Of Nursing , Perambalur",PERAMBALUR ,Tamil Nadu,-,-,-
"Thanthai Roever College Of Nursing , Perambalur",PERAMBALUR ,Tamil Nadu,-,-,-
"Thanthai Roever College of Pharmacy , Perambalur",PERAMBALUR ,Tamil Nadu,91-4328-278114,-,-
Thanthai Roever Inst.of  Polytechnic College, ,Tamil Nadu,"04328-278320,04328-276405,9443179605",roeverspoly@yahoo.co.in&roeverspoly@gamil.com,www.roeverpolytechnic.ac.in
Thanthai Roever Inst.of  Polytechnic College, ,Tamil Nadu,"04328-278320,04328-276405,9443179605",roeverspoly@yahoo.co.in&roeverspoly@gamil.com,www.roeverpolytechnic.ac.in
Thanthai Roever Institute Of Polytechnic College,VELLORE ,Tamil Nadu,-,-,-
"Thanthai Roever School Of Nursing, , Perambalur",PERAMBALUR ,Tamil Nadu,-,-,-
Thanthai Rover College of Physiotherapy,TRICHY ,Tamil Nadu,-,-,-
"Thapar College of Pharmacy , Dr.Shyam Lal Thapar Nursing , Moga",MOGA ,Punjab,"+91-9646132501,+91-9646132502,+91-96",mail@thaparfoundation.org,www.thaparfoundation.org
Thapar Institute Of Engineering Technology, ,Punjab,91-175-6419164,info@tiet.ac.in,www.tiet.ac.in
Thapar University, ,Punjab,+91-175-2393021,registrar@thapar.edu,www.thapar.edu
"Thasiah College Of Nursing , Kanyakumari",KANYAKUMARI ,Tamil Nadu,-,-,-
Thassim Beevi Abdul Kadar College For Women,RAMANATHAPURAM ,Tamil Nadu,-,-,-
THATAVATI IT & BUSINESS SCHOOL,KRISHNA ,Andhra Pradesh,-,-,-
"Thatha School Of Nursing , Hyderabad",HYDERABAD ,Andhra Pradesh,-,-,-
THAVATHIRU KUNDRAKUDI ADIGALA COLLEGE OF EDUCATION FOR WOMEN, ,Tamil Nadu,-,-,-
Thavathiru Santhalinga Adigalar Arts Science And Tamil College,COIMBATORE ,Tamil Nadu,-,tsaastcollege@yahoo.com,-
"The Academy Of Nursing Science & Hospital , Kedarpur", ,Madhya Pradesh,-,-,-
"The Academy Of Nursing Science And Hospital ,Gwalior",GWALIOR ,Madhya Pradesh,-,-,-
"The Academy Of Nursing Sciences & Hospital , Gwalior",GWALIOR ,Madhya Pradesh,0751-2437080,-,-
"The Academy Of Nursing Sciences And Hospital , Gwalior",GWALIOR ,Madhya Pradesh,-,-,-
The Adoni Arts Science College,ADONI ,Andhra Pradesh,"08512–230582,253849,98497-06269",aase01@yahoo.com,-
"The Amalapuram Degree College, Amalapuram",AMALAPURAM ,Andhra Pradesh,08856-230303,-,-
The American College,MADURAI ,Tamil Nadu,"91-452-2530070,2530967,2530973",ProfessionalEducation@theamericancollege.edu,-
THE ASIAN SCHOOL FOR TERACHER EDUCATION, ,Uttaranchal,-,-,-
The Assam Kaziranga University, ,Assam,+913762351433,-,http://www.kazirangauniversity.in/
The Assembly of God Church Teacher's Training Junior College, ,West Bengal,-,agcttjc@yahoo.com,-
"The Badagara Co operative Institute Of Nursing,Kozhikode",KOZHIKODE ,Kerala,-,-,-
THE BERKLEY COLLEGE, ,Punjab,0172-5032033/9988920020,chairman@theberkleycollege.com,www.theberkleycollege.com
THE BEST COLLEGE OF EDUCATION, ,Tamil Nadu,-,-,-
"The Bhaskar Pandurang Hivale Education Society's Institute of Management Studies, Career Development & Research", ,Maharashtra,(0)(0241)-0-2346532,imscdr_anr@sancharnet.in,www.imscdr.in
THE BHOPAL SCHOOL OF SOCIAL SCIENCE, ,Madhya Pradesh,-,-,-
THE BIJAPUR DIST. MINORITY NATIONALEDUCATION SOCIETY, ,Karnataka,-,-,-
The C N S Bank Arts And Sh B A Patel Sh D B Vyas Commerce College, ,Gujarat,-,-,-
The Calcutta Homoeopathic Medical College and Hospital, ,West Bengal,-,-,-
"The Calcutta Medical Research Institute , Kolkata",KOLKATA ,West Bengal,-,-,-
The Calcutta Technical School, ,West Bengal,2244-9550/4413,-,-
"The Capitol College Of Nursing , Bangalore",BANGALORE ,Karnataka,-,-,-
"The Capitol School Of Nursing , Bangalore",BANGALORE ,Karnataka,-,-,-
The Chikitsak Samute Sir Sitram And Lady Shantabai Patkar College, ,Maharashtra,-,-,-
The Christian Institute For Technical Education,TRICHY ,Tamil Nadu,-,info@cimrajkot.edu.in,-
The Christian Institute for Technical Education, ,Tamil Nadu,04553240202,cptcodc1@yahoo.co.in,www.cfchcambilikkai.org
"The City School Of Nursing , Bhopal",BHOPAL ,Madhya Pradesh,-,-,-
"The Clarke School for the Deaf, Sadhna",CHENNAI ,Tamil Nadu,044-28572422/28544910,clarkskn@md2.vsnl.net.in,-
THE CO-OPERATIVE TEACHERS TRAINING INSTITUTE, ,Pondicherry,-,-,-
The College of Law and Legal Aid,SHAHDOL ,Madhya Pradesh,07652-240862,-,-
The College Of Law And Legal Ed, ,Madhya Pradesh,-,-,-
The College of Law and Legal Ed, ,Madhya Pradesh,-,-,-
"The College Of Medical Technology , School Of Nursing , Ongole",ONGOLE ,Andhra Pradesh,"08592233845,09849804564/62",veds_1985@yahoo.co.in,www.vignaninstitutes.com
THE COLLEGE OF PHYSICAL EDUCATION, ,Gujarat,-,-,-
THE COLLEGE OF PHYSICAL EDUCATION, ,Gujarat,-,-,-
THE CONGREGATION OF THE FRANCISCAN SISTER OF THE PRESENTATION OF THE BLESSED VIRGIN MARY, ,Tamil Nadu,-,-,-
The Deaf and Dumb Relief Association,AMRAVATI ,Maharashtra,"0721-2573385,2572897",-,-
THE DEPARTMENT OF PHYSICAL EDUCATION, ,Punjab,175-3046598,dept.phy.edu.@gmail.com,-
The Dharmapuri District Co-Op. Sugar Mills Polytechnic College, ,Tamil Nadu,-,-,-
"THE ERODE COLLEGE OF PHARMACY,Erode", ,Tamil Nadu,"0424-2339929,",ecperode@hotmail.com,www.ecperode.in
"THE ERODE COLLEGE OF PHARMACY,Erode",ERODE ,Tamil Nadu,"0424-2339929,",ecperode@hotmail.com,www.ecperode.in
"The Evangelical Mission Hospital , Raipur",RAIPUR ,Chhattisgarh,-,-,-
"The Excellence College Of Nursing ,Vidisha",VIDISHA ,Madhya Pradesh,-,-,-
"The Excellence School Of Nursing Sciences And Research Hospital, Vidisha",VIDISHA ,Madhya Pradesh,-,-,-
"The Gandhigram Institute Of Rural Health & Famil Welfare Trust ,Dindigul",DINDIGUL ,Tamil Nadu,-,-,-
"The Gandhigram Institute of Rural Health And Family Welfare Trust , Ambathurai",DINDIGUL ,Tamil Nadu,0451�2452346,girhfwt@sancharnet.in,http://www.winentrance.com
"The Gandhigram Institute of Rural Health And Family Welfare Trust , Ambathurai",DINDIGUL ,Tamil Nadu,0451�2452346,girhfwt@sancharnet.in,http://www.winentrance.com
The Global Open University,DIMAPUR ,Nagaland,09342409955,info@tgouonline.com,www.tgouonline.com
The Glocal University, ,Uttar Pradesh,+918192004293,-,www.theglocaluniversity.in
The Goa Eduation Society Dhempe College Arts Science, ,Goa,-,-,-
THE GOOD SAMARITAN ELEMENTAR TEACHER TRAINING INSTITUTE, ,Tamil Nadu,-,-,-
The Government Guru Teg Bahadur College, ,Punjab,-,-,-
The Graduate School College for Women, ,Jharkhand,-,-,-
The Graduate School College Woman, ,Jharkhand,-,-,-
THE GRANTHAM COLLEGE PHYSICAL VIDISHA, ,Madhya Pradesh,-,-,-
"The Gujarat Cancer & Research Institute, Ahmedabad", ,Gujarat,"+91-79-22681433,22688017",gcriad1@bsnl.in,http://www.cancerindia.org/
The Guru Nank Vidyak Societys College Of Arts Science & Commerce, ,Maharashtra,-,-,-
The H N S Bank Ltd Science College, ,Gujarat,-,-,-
THE HINDU COLLEGE,MACHILIPATNAM ,Andhra Pradesh,-,-,-
"The Hindu College, Guntur",GUNTUR ,Andhra Pradesh,-,-,-
"The Hitech College Of Nursing,Bhubaneswar",BHUBANESWAR ,Orissa,-,-,-
The Hotel School Haldwani, ,Uttaranchal,7055516606,thehotelschoolhaldwani@gmail.com,http://thehotelschool.in
The Ideal Fine Arts Society College Of Visual Art, ,Karnataka,-,-,-
The Indian Polytechnic College , ,Tamil Nadu,"04637-232042,04637-231810,9791503280",info@rajas.edutipc_2007@yahoo.com,www.rajas.edu
THE INSTITUTE OF CERTIFIED MANAGEMENT ACCOUNTANTS OF INDIA,JAIPUR ,Rajasthan,"0141-4202466,2205924",ksgautam@yahoo.cm,-
The Institute of Chartered Financial Analysts of India University, ,Mizoram,0389-2361231/32,aizawl@iumizoram.edu.in,www.iumizoram.edu.in
The Institute Of Education, ,Karnataka,-,-,-
The Institute of Engineering and Emerging Technologies,SUNDER NAGAR ,Himachal Pradesh,01795-247353/247886,emergetech@indiatimes.com,-
THE INSTITUTE OF MANAGEMENT FOR STUDIES, ,Uttar Pradesh,-,-,-
The Institute Of Mathematical Science, ,Tamil Nadu,"91-44-22543100,22541856",-,www.imsc.res.in
THE INSTITUTE OF PROFESSIONAL EDUCATION & TECHNOLGY, ,Uttar Pradesh,-,-,-
"The Institute of Road Transport Perundurai Medical College, Perundurai",ERODE ,Tamil Nadu,04294-220910-13/220915,irtpmc@yahoo.co.in,-
"The Institute of Road Transport Perunthurai Medical College, Perunthurai",ERODE ,Tamil Nadu,04294-220910-13/220915,pmcrc@erd.tn.nic.in,-
The institute of Rural Education (IRE), ,Manipur,-,-,-
THE INTEGRAL UNIVERSITY, ,Uttar Pradesh,-,-,-
The Jijamata Mahavidyalaya, ,Maharashtra,-,-,-
The K.P.E. Socitys Law College, ,Karnataka,-,-,-
The K.P.E. Socitys Law College, ,Karnataka,-,-,-
THE KAGAL EDUCATION SOCIETYS B ED COLLEGE, ,Maharashtra,-,-,-
"The Karnataka College Of Nursing , Bangalore",BANGALORE ,Karnataka,-,-,-
"The Karnataka College Of Nursing , Bangalore",BANGALORE ,Karnataka,-,-,-
The Karur Polytechnic College,SALEM ,Tamil Nadu,-,principal@kce.edu.in,-
"The Karur Polytechnic College, Athur", ,Tamil Nadu,04324-226260,karurpolytechnic@gmail.com,-
THE KAVERY COLLEGE OF EDUCATION, ,Tamil Nadu,-,-,-
The Kavery College of Engineering, ,Tamil Nadu,"04298-279158,95249-28156,82156.","principal804@hotmail.com,tkec@rediffmail.com",www.kaveryengg.com.
The Kavery Engineering College,SALEM ,Tamil Nadu,04298-279158,tkec@rediffmail.com,www.kaveryengg.com
The Kavery Institude Of Tedchnology, ,Tamil Nadu,"04298278146,9524909156",kaverytech@rediffmail.com,-
The Kavery Polytechnic College,NAMAKKAL ,Tamil Nadu,"04298278156,9524990156",kaaverypoly@rediffmail.com,www.kaverypolytechnic.com
The Kavery Polytechnic College, ,Tamil Nadu,"04298278156,9524990156",kaaverypoly@rediffmail.com,www.kaverypolytechnic.com
The Kerala Law Academy Law College, ,Kerala,-,-,-
The Kevin Polytechnic College, ,Tamil Nadu,"04622484314,04622484315,9442316725",tkpcprincipal@yahoo.com,www.rajaas.edu
"The Khanaya Medical Mission , Menathottam Hospital, School Of Nursing", ,Kerala,-,-,-
The Konghu Polytechnic College, ,Tamil Nadu,"0427-2422212,0427-2422312,9942308177",principal1tkpc@yahoo.co.in,thekongucollege.org.
THE KRISHNA EDUCATION RESEARCH AND TECHNOLOGICAL INSTITUTE, ,Haryana,-,-,-
The Lallubhai Motilal College Pharmacy, ,Gujarat,-,-,-
The Lallubhai Motilal College Pharmacy, ,Gujarat,-,-,-
The Law Academy Law college, ,Kerala,-,-,-
The Law College,CUTTACK ,Orissa,-,-,-
"The Little Flower School Of Nursing , Hyderabad",HYDERABAD ,Andhra Pradesh,"040-24020762,32404050",-,-
THE LORDS UNIVERSAL COLLEGE OF EDUCATION, ,Maharashtra,-,-,-
The M T B Arts College, ,Gujarat,-,-,-
The M.D.T. Hindu College,TIRUNELVELI ,Tamil Nadu,-,-,-
The M.E.S. Arts And Commerce College, ,Karnataka,-,-,-
The Madurai Diravyam Thayumanavar Hindu College,TIRUNELVELI ,Tamil Nadu,91-462-2342054&2342914,-,http://www.mdthinducollegetirunelveli.org
THE MAHARASHTRA EDUCATION & SPORTS ACADEMY, ,Maharashtra,-,-,-
"The Mandvi Education Society Institute of Business Management and Computer Studies, Mandvi", ,Gujarat,"(02623)222462,9099063472,9327365853",mgmtmes@gmail.com,http://mestech.ac.in/
The Mothers Degree College For Women,HYDERABAD ,Andhra Pradesh,040–27427452,-,-
THE MRINALINI COLLEGE, ,Uttar Pradesh,-,-,-
THE MUDALGI EDUCATION SOCIETY S D.ED COLLEG, ,Karnataka,-,-,-
The Nalgonda Degree College,NALGONDA ,Andhra Pradesh,08682–228186,-,-
THE NATIONAL AND RURA EDUCATION ASSOCIATION, ,Karnataka,-,-,-
National Institute of Engineering, ,Karnataka,0821-2480475/2481220,principal@nie.ac.in,www.nie.ac.in
"The National Institute Of Engineering, Evening", ,Karnataka,-,-,-
The New College, ,Maharashtra,-,-,-
The New College,CHENNAI ,Tamil Nadu,-,-,-
The New Polytechnic College, ,Tamil Nadu,"0431-2695592,0431-2695590,9543097920",newpoly@yahoo.co.in,-
The New Royal College of Engineering & Technology,CHENNAI ,Tamil Nadu,044-27443116,-,-
THE NIBARK SHIKSHAN PRASHIKSHAN MAHAVIDYALAYA, ,Rajasthan,-,-,-
THE OXFORD COLLEGE OF  BUSINESS MGT,BANGALORE ,Karnataka,080-22452500080-26548658,oxfmgmtcollege@theoxford.edu,www.theoxford.edu
The Oxford College of Business Management, ,Karnataka,-,-,-
THE OXFORD COLLEGE OF EDUCATION, ,Karnataka,-,-,-
The Oxford College of Engineering, ,Karnataka,"080-22452855,26659532,30410501/02",info@theoxford.edu,http://www.theoxford.edu/
The Oxford College Of Hotel Management, ,Karnataka,"080-22452855,26659532,30410501/02",info@theoxford.edu,http://www.theoxford.edu/hotel_management/contact_
The Oxford College of Law, ,Karnataka,30266391,infor@theoxford.edu,www.theoxford.edu/college_of_law/
"The Oxford College of Pharmacy , Bangalore",BANGALORE ,Karnataka,080-30219801/02,info@theoxford.edu,www.theoxford.edu
The Oxford College of Science, ,Karnataka,-,-,-
"The Oxford Dental College , Bangalore",BANGALORE ,Karnataka,"080-30219601/02,30219701/02",info@theoxford.edu,http://www.theoxford.edu/dental
"The Oxford Institute of Pharmacy , Bangalore",BANGALORE ,Karnataka,"080-22452855,26659532,30410501/02",info@theoxford.edu,www.theoxford.edu
The Oxford Polytechnic, ,Karnataka,080-22452500-04,-,-
THE PEDANANDIPADU COLLEGE OF ARTS & SCIENCE,GUNTUR ,Andhra Pradesh,-,-,-
"The Pharmaceutical College , Bargarh",BARGARH ,Orissa,"06646-256369,256401","pharmabarpali@yahoo.com,pharmabarpali@rediffmail.com",www.pharmabarpali.org
THE PINNACLE SCHOOL, ,Delhi,-,-,-
The Poona Dioccsan Education Societys Vidya Bhavan College Of Commerce, ,Maharashtra,-,-,-
"The Poona School & Home for the Blind, Teachers Training Centre", ,Maharashtra,020-2622686,-,-
THE POST GRANDUNTE COLLEGE, ,Uttar Pradesh,-,-,-
THE PRESIDENCY COLLEGE OF EDUCATION, ,Karnataka,-,-,-
The Quaide Milleth College For Men,KANCHIPURAM ,Tamil Nadu,-,-,-
The Rajaas Engineering College, ,Tamil Nadu,"04637-230066,230142,231810,231811",info@rajas.edu,www.rajas.edu
The Rajiv Gandhi National University of Law, ,Punjab,"0175-2304188,2304491,2221002",info@rgnul.ac.in,http://www.rgnul.ac.in
The Ramakrishna Mission Blind Boys Academy, ,West Bengal,24772201,bbarkm@vsnl.net,-
THE REGENCY COLLEGE O EDUCATION, ,Karnataka,-,-,-
The Regency PU College, ,Karnataka,08023642370/08064502511,theregencypucollege@gmail.com,www.regencyinstitutions.com
The Richmond Fellowship Post Graduate College For, ,Karnataka,-,-,-
The Richmond Fellowship Society (India),BANGALORE ,Karnataka,080-26645583/26672983/26342075,rfsindia@vsnl.com,-
The Rural College, ,Karnataka,-,-,-
THE RURAL EDUCATION SOCIETY(REGD.), ,Karnataka,-,-,-
The Salem Co Op Sugar Mills Polytechnic College, ,Tamil Nadu,04286255211,scsmpc@gmail.com,-
The Salem Co-Operative Sugar Mills Polytechnic College,SALEM ,Tamil Nadu,-,principal@scsmptc.com,-
The Salem Polytechnic College, ,Tamil Nadu,"04272281170,04272281673,	9791850390",tspt_slm@yahoo.com,www.salempolytechnic.org
"The Salvation Army Catherine Booth Hospital , School Of Nursing, Nagercoil",NAGARCOIL ,Tamil Nadu,-,-,-
"The Salvation Army, Mac Robert Hospital, School Of Nursing , Gurdaspur",GURDASPUR ,Punjab,-,-,-
THE SCHOLARS ARENA GIRLS TEACHER TRAINING COLLEGE, ,Rajasthan,-,-,-
The School of Indian Legal Thought,KOTTAYAM ,Kerala,"0481-2310165,2312868",mgu@mgu.ac.in,www.mguniversity.edu
"The School Of Nursing, Porompat Under The , Modern Clinic & Village Ind.Imphal",IMPHAL ,Manipur,-,-,-
"The School Of Nursing,Kozhikode",KOZHIKODE ,Kerala,-,-,-
The School of P.G. Studies In Law,RAIPUR ,Chhattisgarh,0771-2262540,comprsu@bomb.vsnl.net.in,-
The Selvam Women Excellence Engineering Technology, ,Tamil Nadu,04312680210,principal.smw@gmail.com,www.jscollege.org
The Sethupathy Government Arts College,RAMANATHAPURAM ,Tamil Nadu,-,-,-
The Shripur Education Society's RC Patel Institute of Technology, ,Maharashtra,-,-,-
THE SOUTH INDIAN EDUCATION SOCIETY SIES COLLEGE OF MANAGEMENT STUDIES,THANE ,Maharashtra,(0)(022)-27708373/76/77,sies@siescoms.edu,www.siescoms.edu
The Spastic Society of Tiruchirapalli,TRICHY ,Tamil Nadu,"0431-2772001,Mob-09345230582,",pasticsociety_trichy@yahoo.in,www.spastictrichy.com
The Spastics Society of India,BHANDARA ,Maharashtra,-,-,-
The Standard Fire Works Rajaratnam College For Women,SIVAKASI ,Tamil Nadu,-,-,-
The Surabi College Of Polytechnic, ,Tamil Nadu,04286268844,surabipolytech@yahoo.co.in,www.surabhiinstitutions.com
The Techno School, ,Orissa,"0674-2472525,2471416",contact@tts.ac.in,http://www.tts.ac.in/
The Temple of Hahnemann Homoeopathic Medical College,MUNGER ,Bihar,-,-,-
THE THASSIM BEEVI ABDUL KHADER COLLEGE FOR WEMENS,RAMANATHAPURAM ,Tamil Nadu,-,-,-
The Ugar Education Trusts Arts & Comme Ugar, ,Karnataka,-,-,-
"The Unity Institute Of Nursing Sciences , Chitradurga",CHITRADURGA ,Karnataka,-,-,-
The Unity Law College,NAINITAL ,Uttaranchal,"05944-244205,987343222",-,-
THE VYSYA COLLEGE OF EDUCATION, ,Tamil Nadu,-,-,-
The WB National University of Juridical Sciences, ,West Bengal,033-23350534/7379/0765,nujs@cal3.vsnl.net.in,-
The Winners Polytechnic College, ,Tamil Nadu,"04202221884,04202221883,	9884142506",	thewinnerspolytechnic@gmail.com,	www.winnerspolytechnic.org
"The Yash Foundations Institution Of Nursing & Medical Research Institute , Ratnagiri",RATNAGIRI ,Maharashtra,-,-,-
"The Yash Foundations School Of Nursing,Ratnagiri",RATNAGIRI ,Maharashtra,-,-,-
The YMCA College of Physical Education Nandanam,CHENNAI ,Tamil Nadu,044-24344816/24355311/24337983,-,-
The Younis Sultan College Of Engineering,CHEVELLA ,Andhra Pradesh,-,-,-
THEERA JYOTHI TEACHER TRAINING INSTITUTE, ,Kerala,-,-,-
Theivanai Ammal College for Women,VILLUPURAM ,Tamil Nadu,-,info@tacw.in,-
THEIVIKA THIRUMURUGAN PASUMPO THEVAR TEACHER TRAINING, ,Tamil Nadu,-,-,-
THELLAR COLLEGE OF EDUCATION, ,Tamil Nadu,-,-,-
Theni College Of Arts And Science,THENI ,Tamil Nadu,-,-,-
"Theni Government Medical College, Theni",THENI ,Tamil Nadu,04546-244502,gtmch07@gmail.com,-
Theni Kammavar Sangam College of Technology,THENI ,Tamil Nadu,"(04546)250496,(04546)250497",admin@tkscte.in/chairman@tkscte.in/secretary@tksct,www.tkscte.in
Theni Kammavar Sangam Polytechnic College, ,Tamil Nadu,"04546250841,04546250842,	9443208133",tkspoly@yahoo.co.in,-
"Theophilus College Of Nursing , Kottayam",KOTTAYAM ,Kerala,-,-,-
Theosophycal Women First Grade College, ,Karnataka,-,-,-
Thevanesam Erudhaya Ammal Polytechnic College, ,Tamil Nadu,"04638262125,04638262135,9941501372",	tepc2k11@ymail.com,	www.thevaerudhayamtrust.ac.in
Thiagarajar College,MADURAI ,Tamil Nadu,+914522311875,"registrar@tce.edu,pnatharaja@tce.edu,principaltca",www.tcarts.in
THIAGARAJAR COLLEGE OF EDUCATION, ,Tamil Nadu,-,-,-
Thiagarajar College of Engineering,MADURAI ,Tamil Nadu,"0452-2482430,2482240,2482241,2482242",tce@vsnl.com,http://www.tce.edu/
Thiagarajar College of Preceptors,MADURAI ,Tamil Nadu,-,-,-
THIAGARAJAR COLLEGE OF PRECEPTORS, ,Tamil Nadu,-,-,-
Thiagarajar Polytechnic College,ERODE ,Tamil Nadu,"0427-4099399,0427-2447552,9442269599",slm_tpt@sancharnet.in,www.tpt.edu.in
Thiagarajar Polytechnic College, ,Kerala,"0480-2751346,0480-2751659",mail@thiagarajarpolytechnic.org,www.thiagarajarpolytechnic.org
Thiagarajar Polytechnic College, ,Tamil Nadu,"0427-4099399,0427-2447552,9442269599",slm_tpt@sancharnet.in,www.tpt.edu.in
Thiagarajar School of Management,MADURAI ,Tamil Nadu,-,-,-
THIAGI DHARMAKKAN AMIRTHAM COLLEGE OF EDUCATION, ,Tamil Nadu,-,-,-
THIMEGOWDA COLLEGE OF TEACHERS, ,Karnataka,-,-,-
THIRAVIUM COLLEGE OF EDUCATION, ,Tamil Nadu,-,-,-
"Thiravium College Of Nursing , Theni",THENI ,Tamil Nadu,-,-,-
Thiru A. Govindaswamy Government Arts College,VILLUPURAM ,Tamil Nadu,-,-,-
THIRU G V C COLLEGE OF EDUCATION, ,Tamil Nadu,-,-,-
Thiru Kolangiappar Government Arts College,CUDDALORE ,Tamil Nadu,-,-,-
Thiru Ramakrishna Nallammai Polytechnic College,TRICHY ,Tamil Nadu,"04258230333,04258320099,9443215135",	INFO@TRNPOLYTECHNIC.COM,www.trnpolytechnic.com
Thiru Ramakrishna Nallammai Polytechnic College, ,Tamil Nadu,"04258230333,04258320099,9443215135",	INFO@TRNPOLYTECHNIC.COM,www.trnpolytechnic.com
Thiru Seven Hills Polytechnic College,DHARMAPURI ,Tamil Nadu,"04424764492,04424764632,9884300424",tshp373yahoocom,wwwtshpccom
Thiru Seven Hills Polytechnic College, ,Tamil Nadu,"04424764492,04424764632,9884300424",tshp373yahoocom,wwwtshpccom
Thiru-Vi-Ka Government Arts College,TIRUVARUR ,Tamil Nadu,-,-,-
Thirumagal Polytechnic College, ,Tamil Nadu,04427190870,thirumagalpolytechnic@gmail.com,www.thirumagalpolytechnic.com
THIRUMALA COLLEGE OF EDUCATION, ,Tamil Nadu,-,-,-
Thirumala Devaswom Board  Medical College, ,Kerala,-,-,-
Thirumala Devaswom Board Medical College, ,Kerala,-,-,-
Thirumalai Engineering College, ,Tamil Nadu,"044-27277898,27277866,37208044",thirumalaiengg1999@yahoo.co.in,www.thirumalaiengg.in
Thirumalai Madhanur Polytechnic College, ,Tamil Nadu,"04174-256798,9043525530,9043525530",thmpcvellore@gmail.com,	www.thirumalaimadhanurpolytechniccollege.com
THIRUMALAI SRINIVASA COLLEGE, ,Tamil Nadu,-,-,-
"Thirumalai Srinivasa Para Medical Institution , School Of Nursing, Trichy",TRICHY ,Tamil Nadu,-,-,-
THIRUMALAI TEACHER TRAINING INSTITUTE, ,Tamil Nadu,-,-,-
Thirumathi Elizabeth Polytechnic College,CHENNAI ,Tamil Nadu,"04328292273,04328292234,9442870105",	tepa2anm@yahoo.co.in,www.elizabethpoly.org
Thirumathi Elizabeth Polytechnic College, ,Tamil Nadu,"04328292273,04328292234,9442870105",	tepa2anm@yahoo.co.in,www.elizabethpoly.org
Thirumurugan Arts And Science College,CHENNAI ,Tamil Nadu,-,-,-
Thirupattur Arts And Science College,VELLORE ,Tamil Nadu,-,-,-
Thiruthangal Nadar College,CHENNAI ,Tamil Nadu,-,tnc_98@yahoo.com,-
Thiruthani Polytechnic College, ,Tamil Nadu,"04427864990,9994640777",	tiruttani556@gmail.com,www.tptc.com
Thiruvalluvar Arts And Science College,CUDDALORE ,Tamil Nadu,-,-,-
Thiruvalluvar College,TIRUNELVELI ,Tamil Nadu,-,-,-
THIRUVALLUVAR COLLEGE OF EDUCATION, ,Tamil Nadu,-,-,-
Thiruvalluvar College of Engineering and Technology,TIRUVANNAMALAI ,Tamil Nadu,04183-225986,admin@tiruvalluvar.net,-
Thiruvalluvar Government Arts College,NAMAKKAL ,Tamil Nadu,-,Principaltgac@gmail.com,-
Thiruvalluvar Government Arts College,NAMAKKAL ,Tamil Nadu,04287-231802,Principaltgac@gmail.com,www.tgacrasi.org
"Thiruvalluvar Polytechnic College, Vellamadai", ,Tamil Nadu,0422-2903450,tpccbe110@yahoo.com,-
THIRUVALLUVAR TEACHER TRAINING INSTITUTE, ,Tamil Nadu,-,-,-
Thiruvalluvar University, ,Tamil Nadu,91-416-2217778,contact@tvuni.in,www.tvuni.org
"Thiruvarur Govt. Medical College, Thiruvarur", ,Tamil Nadu,04366-244486,deantvr@tn.gov.in,-
ThockchomIbotombi Institute of Teacher Education and Training, ,Manipur,-,-,-
Thompson WomensSecondary Training School, ,Orissa,0671-2419651,headmistress.twti@gmail.com,www.thompsoncuttack.org
THOMS CANGAN MEMORIAL TEACHER TRAINING COLLEGE, ,Rajasthan,-,-,-
"Thoothukudi Medical College, Thoothukudi", ,Tamil Nadu,"0461-239598,2321051",-,-
Thoubal College, ,Manipur,-,-,-
THOZHILATHIBAR TEACHER TRAININGINSTITUTE, ,Tamil Nadu,-,-,-
THREE DOTS GIRLS TRAINING COLLEGE, ,Uttar Pradesh,-,-,-
"Thrupti Institute Of Nursing , Bangalore",BANGALORE ,Karnataka,-,-,-
THUNCHAN SMARAKA TEACHER TRAINING INSTITUTE, ,Kerala,-,-,-
Thushara Degree College,HANAMAKONDA ,Andhra Pradesh,"0870–2540771,2542213","thusharadegreecollege@yahoo.com,thusharapgcollege@yahoo.in",-
Thushara Pg School Of Information Science,WARANGAL ,Andhra Pradesh,-,-,-
TI MES COLLEGE OF EDUCATION, ,Madhya Pradesh,-,-,-
Tihu College, ,Assam,-,-,-
Tikaram Jagannath Arts Commerce & Science College, ,Maharashtra,-,-,-
TIKARAM TEACHER TRAINING COLLEGE, ,Haryana,-,-,-
Tikka Ram College Education, ,Haryana,-,-,-
Tilak Ayurved Mahavidyalaya, ,Maharashtra,-,-,-
Tilak College Of Education, ,Maharashtra,-,-,-
Tilak Degree College, ,Uttar Pradesh,-,-,-
Tilak Dhari Mahavidyalaya,JAUNPUR ,Uttar Pradesh,260939,-,-
Tilak Dhari Mahila Mahavidyalaya, ,Uttar Pradesh,-,-,-
Tilak Dhari PG College, ,Uttar Pradesh,-,-,-
"Tilak Maharashtra University, Institute Of Nursing Education & Research , Pune",PUNE ,Maharashtra,-,-,-
Tilak Maharashtra Vidyapeeth, ,Maharashtra,910212466068,tmv@tmv.ernet.in,www.tmv.edu.in
TILAK MAHARASHTRA VIDYAPEETH, ,Maharashtra,-,-,-
TILAK NATH POST GRADUATE COLLEGE, ,Uttar Pradesh,-,-,-
TILAK POST GRADUATE COLLEGE, ,Uttar Pradesh,-,-,-
TILAK POST GRADUATE COLLEGE, ,Uttar Pradesh,-,-,-
TILAK POST GRADUATE MAHAVIDYALAYA, ,Uttar Pradesh,-,-,-
TILAK RAJ CHADHA INST. OF MGT. & TECH, ,Haryana,"01732-220103,01732-234110",info@timt.ac.in,http://www.timt.ac.in
TILAK RAM SAINI DEGREE COLLEGE FOR GIRLS, ,Uttar Pradesh,-,-,-
TILAK TEACHERS TRAINING COLLEGE FOR WOMENS, ,Rajasthan,-,-,-
