V - TECH. INSTITUTE OF INTEGRATED TECHNOLOGY, ,Uttar Pradesh,-,-,-"Vishal Junnar Seva Mandals Institute of Pharmacy , ALE",PUNE ,Maharashtra,"02132-263264,262841","vjsmiop@indiatimes.com,vjsm_secretary@rediffmail.com",www.vishaljunnareducation.com
VISHAL TEACHER TRAINING INSTITUTE, ,Karnataka,-,-,-
"Vishal Vate Memorial College Of Nursing , Bhopal",BHOPAL ,Madhya Pradesh,-,-,-
Vishawasrao Naik College, ,Maharashtra,-,-,-
"Vishnu Dental College , Bhimavaram",WEST GODAVARI ,Andhra Pradesh,91-8816-250893,info@vdc.edu.in,http://vdc.edu.in/
Vishnu Institute of Technology, ,Andhra Pradesh,+9108816251333,info@vishnu.edu.in,http://vishnu.edu.in/
VISHNU LAKSHMI TRUST VISHNU LAKSHMI TRUST, ,Tamil Nadu,-,-,-
"Vishnu School Of Nursing , Kolar",KOLAR ,Karnataka,-,-,-
Vishnu Sree Institute Of Technology, ,Andhra Pradesh,"08685-275310,9949152888,9652315999",-,-
VISHNU TEACHER TRAINING INSTITUTE, ,Karnataka,-,-,-
VISHVA BHARTI TEACHER TRAINING COLLEGE, ,Haryana,-,-,-
VISHVESHWARYA INSTITUTE OF ENGINEERING & TECHNOLOGY, ,Uttar Pradesh,-,-,-
Vishveshwarya Institute of Engineering & Technology-, ,Uttar Pradesh,0120-2662173-75,vietadmin@rediffmail.com,http://www.vgi.ac.in/
Vishveshwarya School of Management, ,Uttar Pradesh,+919411278140,directoradmin@vgi.ac.in,www.vgi.ac.in
VISHWA BHARATHI COLLEGE OF EDUCATION, ,Tamil Nadu,-,-,-
"Vishwa Bharathi College of Pharmaceutical Sciences Perechereta Junction , Guntur",GUNTUR ,Andhra Pradesh,0863–2290958,vbcops@rediffimail.com,-
"Vishwa Bharathi Instt Of Nsg Sci & Tech , Mysore",MYSORE ,Karnataka,-,-,-
"Vishwa Bharathi School Of Nursing , Kurnool",KURNOOL ,Andhra Pradesh,"08518-645466,229266,+919000831968.",-,www.viswabharathiinstitutions.com
"VISHWA BHARTI B,ED COLLEGE", ,Rajasthan,-,-,-
VISHWA BHARTI SHIKSHA SHASHTRI COLLEGE, ,Rajasthan,-,-,-
VISHWA BHARTI TEACHER TRAINING COLLEGE, ,Rajasthan,-,-,-
VISHWA BHARTI TEACHER TRAINING COLLEGE, ,Haryana,-,-,-
VISHWA BHARTI TEACHERS TRAINING COLLEGE, ,Rajasthan,-,-,-
"Vishwa Darshana School Of Nursing , Ankola", ,Karnataka,-,-,-
VISHWA VISHWANI INSTITUTE OF SYSTEMS AND MANAGEMENT,SECUNDERABAD ,Andhra Pradesh,-,-,-
"Vishwabharathi College Of Nursing,Mysore",MYSORE ,Karnataka,-,-,-
Vishwabharati Academy's College of Engineering,AHMEDNAGAR ,Maharashtra,-,principal_vacoea@yahoo.com,-
Vishwabharati Polytechnic Institute, ,Maharashtra,-,-,-
VISHWADARSHANA TEACHERS TRAINING INSTITUTION, ,Karnataka,-,-,-
Vishwakarma Institute Of Information Technology,KONDHWA ,Maharashtra,(020)24472105/24470798/24472105,prinviit@viit.ac.in,www.viit.ac.in
VISHWAKARMA INSTITUTE OF MANAGEMENT, ,Maharashtra,020-26932800/900,info@vimpune.com,www.vim.ac.in
"Vishwakarma Institute of Technology, Bibwewadi",PUNE ,Maharashtra,(020)24472105,prinvitl@vsnl.com,www.vit.edu
VISHWAKSENA COLLEGE OF EDUCATION, ,Tamil Nadu,-,-,-
Vishwanath Bidhi Sansthan,MUNGER ,Bihar,-,-,-
Vishwanath Singh Mahavidyalaya, ,Uttar Pradesh,-,-,-
VISHWAS TEACHER TRAINING COLLEGE, ,Haryana,-,-,-
"Vishwas Training Institute For Professional Sciences ,Morena", ,Madhya Pradesh,-,-,-
"Vishwasattya School Of Nursing,Nashik",NASHIK ,Maharashtra,-,-,-
VISHWASHANTI GURUKUL TEACHER TRAINING ACADEMY, ,Maharashtra,-,-,-
"Vishwavidya Samsthes P.B.College of Pharmacy , Yadgiri", ,Karnataka,-,-,-
VISHWESHRAIYA COLLEGE OF EDUCATION, ,Uttar Pradesh,"09997795731,09557952310",vcetdelhi@rediffmail.com,-
Vishweshvarya Regional College Of Engineering, ,Maharashtra,-,-,-
Vishweshwaraiya B.Ed. College, ,Jharkhand,-,"sksdhn@yahoo.com,ksdhn@yahoo.com",-
"Vision Anm female Health Worker , Koraput", ,Orissa,-,-,-
Vision Institute of Advanced Studies,DELHI ,Delhi,-,-,-
Vision Institute of Science and Technology,BAPATLA ,Andhra Pradesh,-,-,-
VISION INTERNATIONAL TEACHER TRAINING COLLEGE(WOMEN), ,Haryana,-,-,-
VISION INTERNATIONAL TEACHER TRAINING COLLEGEFOR WOMEN, ,Haryana,-,-,-
Vision School Of Commerce, ,Rajasthan,-,-,http://www.aravalieducation.org
VISION SCHOOL OF MANAGEMENT, ,Rajasthan,"91-9414156602,9414109779",info@visionmanagement.org,-
Vision School Of Management, ,Rajasthan,"+91-1472-249605,240276",vision_mgmt@yahoo.com,http://www.aravalieducation.org
"Vision School Of Nursing,Betul",BETUL ,Madhya Pradesh,-,-,-
Vismayam college of art and media, ,Kerala,4952722242,vismayamcollege@gmail.com,http://vismayamvfx.net/
Visvabharati University,BIRBHUM ,West Bengal,910346352672,root@vbharat.ernet.in,www.visva-bharati.ac.in
Visvesvaraya College of Engineering Technology, ,Andhra Pradesh,08414-252677/392/393,vcethyd@yahoo.com,www.vcethyd.ac.in
"Visvesvaraya National Institute of Technology (VNIT), Nagpur", ,Maharashtra,91-7122226240,director@vnitnagpur.ac.in,http://www.vnit.ac.in
Visveswaraiah Technological University, ,Karnataka,-,"registrar@vtu.ac.in,info[at]vtu.ac.in",www.vtu.ac.in
Visveswarapura College Of Arts And Commerce, ,Karnataka,-,-,-
Visveswarapura College of Law,BANGALORE ,Karnataka,"080–22729272,65736167",info@vvpuramlawcollege.com,www.vvpuramlawcollege.com/principal.html
"Visveswarapura Institute of Pharmaceutical Sciences , Bangalore",BANGALORE ,Karnataka,"+91(80)26711851,+91(80)26711861",PRINCIPAL@VIPS.EDU.IN,www.vips.edu.in
VISVESWARAYA COLLEGE, ,Karnataka,-,-,-
Visveswarpura College Of Science, ,Karnataka,-,-,-
Visveswarpura Evening College Of Arts & Commerce, ,Karnataka,-,-,-
Visvodaya Engineering College, ,Andhra Pradesh,08626-243930,pbr_vits@rediffmail.com,www.visvodayata.ac.in
Visvodaya Government College,VENKATAGIRI ,Andhra Pradesh,"08625–257063,257043",-,-
Viswa Bharathi College of Law,KUKATPALLY ,Andhra Pradesh,23892721,-,-
Viswa Bharathi College Of Technology & Management, ,Andhra Pradesh,"0863-2290958,2290466",-,http://www.vbtm.org.in/
Viswa Bharathi Degree College,HYDERABAD ,Andhra Pradesh,"23060496,23705726,23892724",viswabharathi@rediffmail.com,-
"Viswa Bharathi Degree College, Rangareddy",RANGAREDDY ,Andhra Pradesh,-,-,-
Viswa Bharathi P.G.College of Engineering & Management,HYDERABAD ,Andhra Pradesh,-,viswabharathi@rediffmail.com,http://www.vbpgenggmgt.com
"Viswa Bharathi School Of Nursing , Bangalore",BANGALORE ,Karnataka,-,-,-
VISWA BHARTI INSTITUTE, ,Chhattisgarh,-,-,-
"Viswa Sai College Of Nursing,Bangalore",BANGALORE ,Karnataka,-,-,-
"Viswa Sai School Of Nursing , Bangalore",BANGALORE ,Karnataka,-,-,-
"Viswa Sai School Of Nursing , Kovvur",KOVVUR ,Andhra Pradesh,-,-,-
Viswa Vikas Degree College,JADCHERLA ,Andhra Pradesh,08542–234565,-,-
VISWABHARATHI COLLEGE OF EDUCATION, ,Tamil Nadu,-,-,-
"Viswabharathi College Of Nursing,Kurnool",KURNOOL ,Andhra Pradesh,-,-,-
Viswabharathi Degree College,KRISHNA ,Andhra Pradesh,"08854–223111,98488–37557",-,-
"Viswabharathy Degree College, Tirupati",TIRUPATI ,Andhra Pradesh,0877–2243981,-,-
VISWADARSHINI TEACHER TRAINING INSTITUTE, ,Kerala,-,-,-
Viswaganga Institute Of Technology,ANANTAPUR ,Andhra Pradesh,-,-,-
Viswajyothi College of Engineering & Technology,ERNAKULAM ,Kerala,0485-2262211/2262255,"vjcvklm@sify.com,vjcet@vjcet.org",www.vjcet.org
"Viswam Degree College, Madanapally",MADANPALLE ,Andhra Pradesh,"08571–280125,280099",-,-
VISWANADHA BUSINESS SCHOOL,VISAKHAPATNAM ,Andhra Pradesh,"09492816684,09966822213",admissions@vbs.edu.in,www.vbsvizag.comwww.vbs.edu.in
Viswanandha Institute of Technology & Management, ,Andhra Pradesh,0891-2539007/2539008/2539009/2539025,vitam_coe@yahoo.co.in,http://www.vitamcoe.edu.in/
"Viswavani School Of Nurisng , Nandyal",NANDYAL ,Andhra Pradesh,9848130506,-,-
"Visweswarapura Institute of Pharmaceutical Sciences , Bangalore",BANGALORE ,Karnataka,"+91(80)26711851,+91(80)26711861",principal@vips.edu.in,www.vips.edu.in
"VIT COLLEGE OF EDUCATION,JATORLI", ,Uttar Pradesh,-,-,-
Vitasta School of Law,SRINAGAR ,Jammu and Kashmir,0194-2103573,-,-
Vithaldas Thakordas Choksi Sarvajanik Law College,SURAT ,Gujarat,0261-2254048,vtc_law@yahoo.com,www.vtclaw.org
VITHOBAJI AMLE COLLEGE OF EDUCATION, ,Maharashtra,-,-,-
Vitthalbhai Patel And Rajrathanp T Patel Science College, ,Gujarat,-,-,-
VIVA INSTITUTE OF MANAGEMENT STUDIES, ,Maharashtra,0250-2509142,caontact@vivaims.org,www.vivaims.org
VIVEK COLLEGE OF EDUCATION, ,Uttar Pradesh,-,-,-
VIVEK COLLEGE OF EDUCATION, ,Uttar Pradesh,-,-,-
Vivek College of Law,BIJNOR ,Uttar Pradesh,01342-251317,-,-
Vivek College Of Management Technology, ,Uttar Pradesh,"+91-8057100200,9219416417",vivekcollege@gmail.com,www.vivekcollege.com
"Vivek College of Technical Education , Bijnor",BIJNOR ,Uttar Pradesh,"+918057100200,9219416417",vivekcollege@gmail.com,www.vivekcollege.com
VIVEK JYOTI B.ED. COLLEGE, ,Madhya Pradesh,-,-,-
Vivek Jyoti College, ,West Bengal,-,-,-
VIVEK SHIKSHAN PRASHIKSHAN VIDYALAYA, ,Rajasthan,-,-,-
Vivek Vardhini (Afternoon) College of Arts, ,Andhra Pradesh,-,-,-
Vivek Vardhini Afternoon College Arts,HYDERABAD ,Andhra Pradesh,24722366,-,-
Vivek Vardhini College,HYDERABAD ,Andhra Pradesh,"24744366,24745650",vivekvardhini@rediffmail.com,http://www.vivekvardhini.org
Vivek Vardhini School of Business Management, ,Andhra Pradesh,"040-24617666,65162622",vivekvardhini@rediffmail.com,http://www.vivekvardhinisbm.ac.in/
Viveka Arts & Science College,PRAKASAM ,Andhra Pradesh,"08490–246333,247171,246399",-,-
VIVEKANAD COLLEGE OF EDUCATION, ,Uttar Pradesh,-,-,-
VIVEKANAD TEACHER TRAINING COLLEGE, ,Haryana,-,-,-
Vivekanada Degree College,ECHODA ,Andhra Pradesh,-,-,-
Vivekananada Degree & Pg College,KARIMNAGAR ,Andhra Pradesh,"08722–222358,2222421",kaa_vndckn1@sancharnet.in,-
"Vivekananada Degree College, Rangareddy",CHEVELLA ,Andhra Pradesh,08417–243004,-,-
Vivekanand Arts & Sardar dilip Singh Science & Commerce College, ,Maharashtra,-,-,-
Vivekanand Arts College, ,Gujarat,-,-,-
Vivekanand College,KANYAKUMARI ,Tamil Nadu,-,-,-
Vivekanand College,MADURAI ,Tamil Nadu,-,"principal@vivekanandacollege.org,info@vivekana",-
Vivekanand College, ,West Bengal,-,-,-
Vivekanand College,DELHI ,Delhi,22150100,principal@vivekanand.du.ac.in,vivac2008@gmail.com
VIVEKANAND COLLEGE, ,Delhi,-,-,-
VIVEKANAND COLLEGE, ,Delhi,-,"vivac2008@gmail.com,principal@vivekanandacollege.edu.in,info@vivekanandacollege.edu.in",-
VIVEKANAND COLLEGE, ,Delhi,-,-,-
Vivekanand College Commerce, ,Gujarat,-,-,-
Vivekanand College Education, ,Gujarat,-,-,-
Vivekanand College For Women, ,West Bengal,-,-,-
"Vivekanand College of Agriculture,Buldana", ,Maharashtra,-,-,-
Vivekanand College Of Arts Sc. & Commerce, ,Karnataka,-,-,-
Vivekanand College of Computer Science, ,Andhra Pradesh,0281-2227664,nfo@vivekanandcollege.com,http://vivekanandcollege.com/
VIVEKANAND COLLEGE OF EDUCATION, ,Maharashtra,-,-,-
VIVEKANAND COLLEGE OF EDUCATION, ,Uttar Pradesh,-,-,-
Vivekanand College of Law,AHMEDABAD ,Gujarat,79-25453220,vccinfo@yahoo.com,-
"Vivekanand College Of Nursing ,Vivekanand Hospital & Research Centre,Moradabad",MORADABAD ,Uttar Pradesh,-,-,-
VIVEKANAND COLLEGE OF TEACHERS EDUCATION, ,Rajasthan,-,-,-
"Vivekanand Education Society College of Pharmacy , RANEBENNUR",HAVERI ,Karnataka,"022-61144144,022-25543600","vespharm@yahoo.co.in,vescop@gmail.com",www.vesip.org
VIVEKANAND EDUCATION SOCIETY INSTITUTE OF MANAGEMENT  STUDIES & RESEARCH,MUMBAI ,Maharashtra,022-39504161,vesimsr@hotmail.com,www.vesimsr.org
Vivekanand Education Society Polytechnic, ,Maharashtra,25227638,vespolytechnic@yahoo.co.in,www.vespolytechnic.org
Vivekanand Education Society's Institute of Management Studies and Research, ,Maharashtra,022-25537110&022-25531396,mailus@vesimsr.org,http://www.vesimsr.org
Vivekanand Education Society's Institute of Technology,MUMBAI ,Maharashtra,(022)-25227460,vesit@vsnl.com,www.veit.edu
Vivekanand Education Societys College of Law,CHEMBUR ,Maharashtra,022-25277791,veslaw09@rediffmail.com,-
VIVEKANAND GIRLS TEACHERS TRAINING COLLEGE, ,Rajasthan,-,-,-
VIVEKANAND GRAMODYOG P.G. COLLEGE, ,Uttar Pradesh,-,-,-
Vivekanand Gramoudyog M. Degree College, ,Uttar Pradesh,-,-,-
Vivekanand Institute of Hotel & Tourism Management, ,Gujarat,"+91-281-3203006,09427213888,8866250049",info@vihtm.com,http://www.vihtm.com/
VIVEKANAND INSTITUTE OF MANAGEMENT & TECHNOLOGY, ,Uttar Pradesh,-,-,-
"Vivekanand Institute of Medical Sciences & Research, Valia", ,Gujarat,"02643-270583,270332,271340,271341",drrpsinha@hotmail.com,-
Vivekanand Institute of Polytechnic, ,Maharashtra,210179,lectpoly@gmail.com,www.vipolytechnic.org
"Vivekanand Institute of Technology, Bhilwara", ,Rajasthan,94141-65556,vit003@yahoo.com,-
Vivekanand Law College,PUTTUR ,Karnataka,"2620455,2621564",-,-
Vivekanand Mahavidyalaya Semari, ,Uttar Pradesh,-,-,-
Vivekanand Polytechnic College Rajota, ,Rajasthan,01593-234794,vpsashoksingh@gmail.com,-
"Vivekanand Polytechnic College, Haunmangarh", ,Rajasthan,89500-45355,vivekanandpolytechnic@gmail.com,-
VIVEKANAND SHIKSHAK PRASHIKSHAN MAHAVIDYALAYA, ,Rajasthan,-,-,-
VIVEKANAND TEACHER TRAINING COLLEGE, ,Haryana,-,-,-
VIVEKANAND TEACHER TRAINING COLLEGE, ,Rajasthan,-,-,-
VIVEKANAND TEACHER TRAINING COLLEGE, ,Rajasthan,-,-,-
Vivekanand Vanijya Mahavidyalaya, ,Gujarat,-,-,-
VIVEKANAND VIDYA SHARAM TEACHER TRAINING COLLEGE, ,Rajasthan,-,-,-
"Vivekananda Charitable Trust Anm Training Centre , Kalahandi",KALAHANDI ,Orissa,-,-,-
Vivekananda College, ,West Bengal,-,-,-
Vivekananda College, ,West Bengal,-,-,-
Vivekananda College,SECUNDERABAD ,Andhra Pradesh,27670799,-,-
Vivekananda College of Commerce and Law,AHMEDABAD ,Gujarat,25453220,-,-
Vivekananda College Of Education, ,Karnataka,-,-,-
Vivekananda College of Education, ,Assam,-,-,-
VIVEKANANDA COLLEGE OF EDUCATION, ,Karnataka,-,-,-
VIVEKANANDA COLLEGE OF EDUCATION, ,Tamil Nadu,-,-,-
VIVEKANANDA COLLEGE OF EDUCATION, ,Karnataka,-,-,-
VIVEKANANDA COLLEGE OF EDUCATION, ,Karnataka,-,-,-
VIVEKANANDA COLLEGE OF EDUCATION, ,Tamil Nadu,-,-,-
VIVEKANANDA COLLEGE OF EDUCATION, ,Tamil Nadu,-,-,-
VIVEKANANDA COLLEGE OF EDUCATION, ,Tamil Nadu,-,-,-
VIVEKANANDA COLLEGE OF EDUCATION, ,Karnataka,-,-,-
Vivekananda College of Engineering & Technology,PUTTUR ,Karnataka,08251-234555/235955,vcet_puttur@yahoo.co.in,www.pesputtur.org
Vivekananda College of Law,BANGALORE ,Karnataka,080-3577194/3371952,secretary@vivekananda-jes.com,www.vivekananda-jes.com/law.htm
"Vivekananda College Of Nursing , Chitradurga",CHITRADURGA ,Karnataka,-,-,-
"Vivekananda College Of Nursing , Namakkal",NAMAKKAL ,Tamil Nadu,-,-,-
"Vivekananda College Of Nursing,Lucknow", ,Uttar Pradesh,+915222321277,vcon@vinil.edu.in,http://www.vinil.edu.in/
"Vivekananda College, Chennai",CHENNAI ,Tamil Nadu,-,admin@vivekanandacollege.net,-
"Vivekananda College, Visakhapatnam",NARSIPATNAM ,Andhra Pradesh,08932–225934,-,-
Vivekananda Degree College,PRAKASAM ,Andhra Pradesh,"08404–271246,254235",-,-
Vivekananda Degree College, ,Karnataka,080-23579511/23577334,	secretary@vivekananda-jes.com,http://www.vdc-jes.org
"Vivekananda Degree College, Huzurabad",HUZURABAD ,Andhra Pradesh,08721–255666,-,-
"Vivekananda Degree College, Kukatpally",KUKATPALLY ,Andhra Pradesh,-,vivekanandacollegekukatpally.com,www.vdckukatpally.com
"Vivekananda Degree College, Mahabubnagar",MAHABUBNAGAR ,Andhra Pradesh,-,-,-
"Vivekananda Degree College, Nellore",NELLORE ,Andhra Pradesh,"0861–2332714,2310576",-,-
"Vivekananda Degree College, Tangutur",PRAKASAM ,Andhra Pradesh,"08592–243233,98484–06029",-,-
"Vivekananda Degree College, Vempalli",VEMPALLI ,Andhra Pradesh,-,-,-
Vivekananda Degree College,BANGALORE ,Karnataka,080-23579511/23577334,	secretary@vivekananda-jes.com,http://www.vdc-jes.org
Vivekananda First Grade Coll. Of Arts Sc.& Comm, ,Karnataka,-,-,-
Vivekananda Group of Institutions, ,Andhra Pradesh,(08415)201437,principalvgih10@gmail.com,http://www.vgi.edu.in/
VIVEKANANDA INSTITUTE OF  INFORMATION TECHNOLOGY,GUNTUR ,Andhra Pradesh,-,-,-
Vivekananda Institute of Engineering and Technology,KEESARA ,Andhra Pradesh,9848295544,lakkakulavieb@yahoo.co.in,-
VIVEKANANDA INSTITUTE OF INFORMATION MANAGEMENT STUDIES,NAMAKKAL ,Tamil Nadu,04288-234060,veengw@yahoo.com,www.vietw.org
"Vivekananda Institute of Medical Sciences, Kolkata",KOLKATA ,West Bengal,033-4753636,rkmsp@cal2.vsnl.net.in,-
Vivekananda Institute of Professinal Studies, ,Delhi,91(11)25928101/125,vipsedu@vips.edu,www.vips.edu
Vivekananda Institute of Professional Studies, ,Delhi,25928101,vipsedu@vsnl.com,www.vips.edu
Vivekananda Institute Of Social Work & Social Science,BHUBANESWAR ,Orissa,06742597333,"info@viswass.org,jobs@viswass.org",-
"Vivekananda Institute Of Social Work & Social Science , V I S W A S S School Of Nursing,Kumarbas", ,Orissa,-,-,-
Vivekananda Institute of Tech & Science Bommakal, ,Andhra Pradesh,"0878-6503861,0878-2279181",principal_vits@yahoo.co.in.,http://www.vits.ac.in/
Vivekananda Institute Of Tech. & Science,KARIMNAGAR ,Andhra Pradesh,-,-,-
Vivekananda Institute of Technology, ,Karnataka,"080-23473144,23371952,23324994",principal@vitb.ac.in,http://www.vitb.ac.in/
Vivekananda Institute of Technology & Science, ,Uttar Pradesh,0120-2678836,directorvits@yahoo.com,http://www.vitsgzb.com/
Vivekananda Law College,PUTTUR ,Karnataka,"08251-230561,09449233850",-,-
Vivekananda Mahavidyalaya, ,West Bengal,-,-,-
Vivekananda Mahavidyalaya, ,West Bengal,-,-,-
Vivekananda Mission Asram,EAST MEDINIPUR ,West Bengal,03224-286221/286081,vmannn@dte.vsnl.net.in,-
Vivekananda Mission Mahavidyalaya, ,West Bengal,-,-,-
"Vivekananda Parvatiya Krishi Anusandhan Sansthan, Almora", ,Uttaranchal,(05962)230208,-,http://www.vpkas.nic.in/
VIVEKANANDA PG CENTRE,KARIMNAGAR ,Andhra Pradesh,-,-,-
Vivekananda Polytechnic College,VIRUDUNAGAR ,Tamil Nadu,"04577266483,04577266583,9787106689",vpcoll1@yahoo.co.in,-
Vivekananda Polytechnic College, ,Tamil Nadu,"04577266483,04577266583,9787106689",vpcoll1@yahoo.co.in,-
"Vivekananda Polytechnic College, Neyveli", ,Tamil Nadu,262287-04142,vivekananda545@yahoo.com,-
"Vivekananda Polytechnic College,Kanyakumari", ,Tamil Nadu,04652-270350,principalvpc@yahoo.com,http://vivekanandapolytechnic.net
"Vivekananda Polytechnic, Puttur (Dk)", ,Karnataka,08251233698,-,-
Vivekananda Primary Teacher Training Institute, ,West Bengal,-,-,-
Vivekananda Ramkrishna Mission B.Ed. College, ,West Bengal,-,-,-
"Vivekananda School Of Nursing , Chitradurga",CHITRADURGA ,Karnataka,-,-,-
"Vivekananda School Of Nursing, , Salem",SALEM ,Tamil Nadu,-,-,-
VIVEKANANDA SCHOOL OF PG STUDIES, ,Andhra Pradesh,"+914023740928,23744908",vspgs@vspgs.com,www.vspgs.com
Vivekananda School Og Pg Studies,RANGAREDDY ,Andhra Pradesh,-,-,-
Vivekananda Setavarsiki Mahavidyalaya, ,West Bengal,-,-,-
VIVEKANANDA SHIKSHANA SAMSTHE, ,Karnataka,-,-,-
VIVEKANANDA TEACHER TRAINING INSTITUTE, ,Karnataka,-,-,-
Vivekananda Teacher's Training College, ,West Bengal,-,-,-
VIVEKANANDA VIDYALAYA COLLEGE OF EDUCATION, ,Tamil Nadu,-,-,-
Vivekanandha Business School for Women, ,Tamil Nadu,04288-234241,vivekaadmission@gmail.com,www.vivekanandha.ac.in
Vivekanandha College Of Arts And Science,NAMAKKAL ,Tamil Nadu,-,admin@vivekanandacollege.net,-
Vivekanandha College of Arts and Science for Women, ,Tamil Nadu,-,-,-
VIVEKANANDHA COLLEGE OF EDUCATION FOR WOMEN, ,Tamil Nadu,-,-,-
Vivekanandha College of Engineering for Women, ,Tamil Nadu,04288-234560,vcenggw@yahoo.com,www.vivekanandha.ac.in
"Vivekanandha College Of Nursing ,Namakkal",NAMAKKAL ,Tamil Nadu,-,-,-
Vivekanandha College of Technology for  women, ,Tamil Nadu,04288-234343,vctw.3engg@gmail.com,www.vctw.org
Vivekanandha Dental College For Women,NAMAKKAL ,Tamil Nadu,-,vivekaadmission@gmail.com,-
"Vivekanandha Dental College For Women , Tiruchengode",NAMAKKAL ,Tamil Nadu,"04288-234427,234676",-,-
Vivekanandha Institute of Engineering and Technology for Women,NAMAKKAL ,Tamil Nadu,04288-234060,-,www.vietw.org
Vivekanandha Institute of Information and  Management Studies, ,Tamil Nadu,-,-,www.viims.ac.in
Vivekannanda Government College,HYDERABAD ,Andhra Pradesh,27610997,-,-
Vivekavardhani Degree College,NALGONDA ,Andhra Pradesh,08683–251530,-,-
Vivekavardhani Degree College For Women,KOTHAGUDEM ,Andhra Pradesh,08744–245771,-,-
Vivekavardhini Bhaskar Degree College,SEETHANAGARAM ,Andhra Pradesh,-,-,-
Vivekavardhini Degree College,KHAMMAM ,Andhra Pradesh,08744–241006,-,-
"Vivekavardhini Degree College, Mancherial",MANCHERIAL ,Andhra Pradesh,08736–259074,-,-
VIVEKVARDHANI COLLEGE OF EDUCATION FOR WOMEN, ,Maharashtra,-,-,-
Viya Institute of Creative Teaching, ,Uttar Pradesh,-,-,-
VIYAY COLLEGE OF EDUCATION, ,Uttar Pradesh,-,-,-
Vizag Institute Of Technology, ,Andhra Pradesh,+918922248070,vizaginstitute@yahoo.co.in,http://www.vit-vizag.ac.in/
"VJT Institute, HR Mahajani Marg", ,Maharashtra,-,-,-
VK Krishna Menon College of Commerce & Economics & Science, ,Maharashtra,-,-,-
VKK Vijayan Engineering College,KANCHIPURAM ,Tamil Nadu,044-27190706/27190709,vkkvec@gmail.com,-
"VKR & VNB Polytechnic,Gudiwada", ,Andhra Pradesh,-,-,-
"VKR, VNB & AGK College Of Engineering", ,Andhra Pradesh,"08674-242188,242189,9246542188",gudivadaengineering@yahoo.com,www.gudivadaenggcollege.org
VLJAY VALLABH COLLEGE OF PHYSICAL EDUCATION, ,Himachal Pradesh,-,-,-
VMR Institute of Technology & Management Sciences, ,Andhra Pradesh,08418-260577,info@vmrcollege.com,-
VMS Institute of Management Batala, ,Punjab,01871-225757,vmsbatala@rediffmail.com,www.vmsinstitutes.net
"VMVS Polytechnic, Hungund", ,Karnataka,08351-200149,cvcrph_123@yahoo.co.in,-
VNS COLLEGE OF PHYSICAL EDUCATION AND MANAGMENT STUDIES, ,Madhya Pradesh,-,-,-
VNS Institute of Technology,BHOPAL ,Madhya Pradesh,"07672-223301,227011,223631,225683",dprvits@yahoo.com,www.vitsdpr.ac.in
VOC COLLEGE OF EDUCATION, ,Tamil Nadu,-,-,-
"Voctoria Jubilee Hospital Trust, School Of Nursing , Ahmedabad",AHMEDABAD ,Gujarat,-,-,-
Vodithala Srinivasa Rao Degree College,HUZURABAD ,Andhra Pradesh,-,-,-
Vogue Institute of Fashion Technology, ,Karnataka,080-22224333,info@vogueacademy.com,http://www.voguefashioninstitute.com
Voice Of God Polytechnic College, ,Tamil Nadu,04286253337,vog_edu@yahoo.com,www.vogedu.org
Voorhees College,VELLORE ,Tamil Nadu,-,-,-
VP Muthaiah Pillai Meenakshi Ammal Engineering College For Women,VIRUDUNAGAR ,Tamil Nadu,"04563-289001,289337",vpmmecw@rediffmail.com,-
VP TEACHER TRAINING COLLEGE, ,Haryana,-,-,-
VPN COLLEGE FOR TEACHER EDUCATION, ,Tamil Nadu,-,-,-
VPSPMS Arts Commerce & Science College, ,Maharashtra,-,-,-
VPV College Of Engineering, ,Tamil Nadu,+91-4546-235010,vpveducentre@gmail.com,www.vpvedu.org
VR College of Engineering, ,Maharashtra,-,-,-
VR Institute of PG Studies,NELLORE ,Andhra Pradesh,-,-,-
VR Sidhartha Engineering College, ,Andhra Pradesh,"+918662582333,2584930","gsr@vrsiddhartha.ac.in,principal@vrsiddhartha.ac.",http://www.vrsiddhartha.ac.in/
"Vriddhi Polytechnic College, Jaipur", ,Rajasthan,0141-5102443,jdci@gmail.com,-
Vrindavan Law College,MATHURA ,Uttar Pradesh,-,info@vrindavancollege.in,-
VRS & YRN College of Engineering & Technology,CHIRALA ,Andhra Pradesh,-,-,-
"VRS & YRN College of Engineering & Technology,Chirala", ,Andhra Pradesh,+918594239523,vycet@hotmail.com,http://www.vycet.org/
"Vrundavan Institute Of Nursing Education , Bardez",GOA ,Goa,-,-,-
VS Lakshmi Engineering College For Women, ,Andhra Pradesh,08842315007,-,http://www.vslengg.com/
VSA Educational and Charitable Trusts Group of Institutions,SALEM ,Tamil Nadu,0427-2339988,vsacollege@gmail.com,www.vsagroup.ac.in
"VSB Engineering College,",KARUR ,Tamil Nadu,"04324-651408,648121,286408","principal@vsbenggcollege.com,admission@vsbenggcollege.com",www.vsbenggcollege.com
VSK TEACHER TRAINING INSTITUTE, ,Tamil Nadu,-,-,-
VSLakshmi Women's Degree & PG College, ,Andhra Pradesh,-,-,-
VSM College Of Engineering, ,Andhra Pradesh,"08857-246400,200212",vsmcoe@gmail.com,http://vsmcollege.org/
VSPM COLLEGE OF EDUCATION, ,Maharashtra,-,-,-
VSS Medical College, ,Orissa,-,-,-
"VSS Medical College, Burala", ,Orissa,91-663-2430511,vssmcburlaorissa@gmail.com,www.vssmedical.net
Vsv Nadar Polytechnic College, ,Tamil Nadu,04562280173,vsvnpoly@gmail.com,vsvnpolytechnic.in
VTJM & IVTRDegree College, ,Andhra Pradesh,-,-,-
Vvss Shri Khasgatesh College Of Arts & Comm, ,Karnataka,-,-,-
"Vyas College Of Nursing,Jodhpur",JODHPUR ,Rajasthan,-,-,-
"Vyas Dental College & Hospital , Jodhpur",JODHPUR ,Rajasthan,"0291-2636300,2621315",vdchjodhpur@gmail.com,www.vyaseducation.org
VYAS INSITITUTE OF MANAGEMENT,JODHPUR ,Rajasthan,-,rvseducation@yahoo.co.in,-
Vyas Institute Of Engineering & Technology, ,Rajasthan,"0291-2648273,2721011-14",rvseducation@yahoo.co.in,http://www.vcetjodhpur.org
"Vyas Nursing Institute, School Of Nursing,Jodhpur",JODHPUR ,Rajasthan,-,-,-
VYAS TEACHER TRAINING COLLEGE, ,Rajasthan,-,-,-
Vyasanagar Junior College, ,Orissa,9040763699,info@vnautocollege.org,www.vnautocollege.org
Vyasnagar College, ,Orissa,-,-,-
Vyavsai Vidya Prathisthan'S Sanch College Of Engineering,RAJKOT ,Gujarat,"0281-2783394,223933",vvp_2003@indiatimes.com,www.vvpgdulink.ac.in
"Vydehi Institute of Dental Sciences & Research , Bangalore",BANGALORE ,Karnataka,"+91-80-28412956,+91-80-28413381/2/3/4/5",info@vims.ac.in,www.vims.ac.in
"Vydehi Institute of Medical Sciences & Research Centre, Bangalore", ,Karnataka,080-28413381-85,info@vims.ac.in,www.vims.ac.in
"Vydehi Institute Of Nursing Sciences & Res Centre , Bangalore",BANGALORE ,Karnataka,-,-,-
"Vydehi Institute Of Nursing Sciences & Res. Centre , Whitefield", ,Karnataka,-,-,-
"Vydehi Institute Of Nursing Sciences & Reseaarch Centre ,Bangalore",BANGALORE ,Karnataka,-,-,-
Vyshnavi Degree College,YEMMIGANUR ,Andhra Pradesh,"08512-256924,9346476298",-,-
Vysya College,SALEM ,Tamil Nadu,"0427-2240107,2241428",principal@vysyacollege.org.,http://www.vysyacollege.org
