V - TECH. INSTITUTE OF INTEGRATED TECHNOLOGY, ,Uttar Pradesh,-,-,-Vasavi Mahila Kalasala,KURNOOL ,Andhra Pradesh,"08518–244131,220209,245137","vasavimahilakalasala@rediffmail.,com",-
"Vasavi Polytechnic. ,Banaganapally", ,Andhra Pradesh,9912342056,-,-
Vasavi Vidyaniketan College For Women, ,Karnataka,-,-,-
Vashishta Degree College,NIRMAL ,Andhra Pradesh,08734–247047,vashistadegreecollege@yahoo.co.in,-
"Vashisth Polytechnic College, Suratgarh", ,Rajasthan,01507-222600,vpc.suratgarh@gmail.com,-
Vasireddy Venkatadri Institute of Technology, ,Andhra Pradesh,08632118036,admin@vvitguntur.com,http://www.vvitguntur.com/
Vasistha Degree College,KAMAREDDY ,Andhra Pradesh,08468–224382,-,-
Vassireddy Sri Laxmi & Meka Rama Krishna (Vsl&Mrk) Degree College,TENALI ,Andhra Pradesh,08644–229351,-,-
Vasu Degree College,BODHAN ,Andhra Pradesh,08467–222254,vasu-262@yahoo.com,-
VASU TEACHER TRAINING INSTITUTE, ,Tamil Nadu,-,-,-
Vasudha Kalyani Special Education Institute,CHANDAULI ,Uttar Pradesh,-,-,-
Vasundara Degree College For Women,RANGAREDDY ,Andhra Pradesh,27135587,-,-
"Vasundhara Degree College, Adilabad",ADILABAD ,Andhra Pradesh,-,-,-
Vasundhara Mahila P.G. Mahavidyalaya, ,Rajasthan,-,-,-
VASUNDHARA MAHILA SHIKSHAK PRASHIKSHAN MAHAVIDYALAYA, ,Rajasthan,-,-,-
VASUNDHARA MAHILA SHIKSHAK PRASHIKSHAN MAHAVIDYALAYA, ,Rajasthan,-,-,-
Vasundhra Raje Homoeopathic Medical College and Hospital,GWALIOR ,Madhya Pradesh,-,-,-
VATHSALA JOHNSON COLLEGE OF TEACHER EDUCATION, ,Tamil Nadu,-,-,-
Vathsalya Institute of Science & Technology,BHONGIR ,Andhra Pradesh,-,-,-
VATHSALYA MAHILEYARA MATTU MAKKALA ASHRAYA SAMSTHE, ,Karnataka,-,-,-
"Vatsalya Institute Of Nursing & Paramedical Sciences,Allahabad",ALLAHABAD ,Uttar Pradesh,-,-,-
"Vatsalya Institute Of Nursing & Paramedicla Sciences, Allahabad",ALLAHABAD ,Uttar Pradesh,-,-,-
"Vavilala Degree College, Kurnool",KURNOOL ,Andhra Pradesh,"08518-232464,94411-14392",-,-
Vayuputra Degree College,NALGONDA ,Andhra Pradesh,8684–223823,-,-
Vazir Sultan College of Engineering, ,Andhra Pradesh,:08742210064,vsce95@yahoo.co.in,www.apengineeringcolleges.info
VB INSTITUTE OF TEACHER TRAINING & RESEARCH, ,Haryana,-,-,-
VEAKATESHWARA INSTITUTE OF COMPUTER SCIENCE & TECHNOLOGY, ,Uttar Pradesh,-,-,-
"Ved Nursing College , Panipat",PANIPAT ,Haryana,-,-,-
"Ved Nursing Training Instt,Panipat",PANIPAT ,Haryana,-,-,-
"Ved Nursing Training Instt,Panipat",PANIPAT ,Haryana,-,-,-
Veda Vyasa Institute of Technology,MALAPPURAM ,Kerala,0495-2832154/2832157,vvit@vedavyasa.org,www.vedavyasa.org
VEDANT COLLEGE OF EDUCATION, ,Uttar Pradesh,-,-,-
Vedanta P.G. Girls's College, ,Rajasthan,-,-,-
VEDANTH D ED COLLEGE, ,Karnataka,-,-,-
VEDAVATHI D.ED COLLEGE, ,Karnataka,-,-,-
Vedhantha Institute of Technology, ,Tamil Nadu,04149?209607,-,-
Vedic Kanya College, ,Rajasthan,-,-,-
Vedic Kanya P.G. Mahavidyalaya, ,Rajasthan,-,-,-
"Vedica College of Pharmacy Polytechnic , Bhopal",BHOPAL ,Madhya Pradesh,-,-,-
Vedica Institute of Technology,GANDHINAGAR ,Madhya Pradesh,0755-2742870,Vedicainstituit@rediffmail.com,-
VEDIV TEACHER TRAINING COLLEGE, ,Haryana,-,-,-
Vedvyas Mahavidyalaya, ,Orissa,-,-,-
"Vee Care College Of Nursing , Thiruvallur",TIRUVALLUR ,Tamil Nadu,-,-,-
"Vee Care School Of Nursing , Thiruvallur",TIRUVALLUR ,Tamil Nadu,-,-,-
"Veena Institute of Tech. Edu., (Mahila Poly. College) Karauli", ,Rajasthan,99280-54003,vmsseewa@gmail.com,-
Veena Memorial Law College,KOTA ,Rajasthan,"07464–220281,9414033800,9414033856",-,-
VEENA MEMORIAL TEACHER TRAINING COLLEGE, ,Rajasthan,-,-,-
"Veena Vadini College Of Nursing ,",GWALIOR ,Madhya Pradesh,-,-,-
"Veena Vadini College Of Nursing , Bhopal",BHOPAL ,Madhya Pradesh,-,-,-
VEENA VADINI EDUCATIONAL AND PRASHIKSHAN SANSTHA, ,Madhya Pradesh,-,-,-
VEENA VADINI TEACHERS TRAINING INSTITUTE, ,Madhya Pradesh,-,-,-
Veer Abhimanyu Polytechnic, ,Haryana,"9355511888,9991511888",-,-
VEER BAHADUR SINGH DEGREE COLLEGE, ,Uttar Pradesh,-,-,-
Veer Bahadur Singh Purvanchal University,JAUNPUR ,Uttar Pradesh,05452-252310,"unsiet97@yahoo.co.in,vicechancellor.vbspu@gmail.com,drramjeelal@rediffmail.com",www.vbspu.ac.in
"Veer Chandra Singh Garhwali Govt. Medical Sc. & Research Instt, Srinagar, Pauri Garhwal",PAURI ,Uttaranchal,"01346-252342,244702",principal.smc@gmail.com,gov.ua.nic.in/smc
Veer Kunwar Singh Mahila College, ,Bihar,-,-,-
Veer Kunwar Singh University,ARRAH ,Bihar,"91-6182-23559,23288",-,http://www.vksu-ara.org/
VEER KUNWER DEGREE COLLEGE, ,Uttar Pradesh,-,-,-
Veer Narmad South Gujarat University, ,Gujarat,+91(0261)2227141to2227146,info@vnsgu.ac.in,http://www.vnsgu.ac.in/
Veer Surendra Sai University of Technology, ,Orissa,(0663)2430211,info@vssut.ac.in,http://www.vssut.ac.in/
Veer Wajekar Arts Science & Commerce College, ,Maharashtra,-,-,-
VEERALAKSHMI TEACHER TRAINING INSTITUTE FOR WOMEN, ,Tamil Nadu,-,-,-
Veerammal Engineering College, ,Tamil Nadu,"04543-268444,04543-268633",veerammal@hotmail.com,http://www.pvpcollege.com
"Veerangana Awanti College Of Nursing , Chhatarpur",CHHATTARPUR ,Madhya Pradesh,-,-,-
VEERANGANA NARSUERY TEACHER TRAINING INSTITUTE, ,Uttar Pradesh,-,-,-
"Veerangna Awanti Bai Nursing College , Chhatarpur",CHHATTARPUR ,Madhya Pradesh,-,-,-
Veerangna Awanti Bail Mahila Mahavidalaya, ,Uttar Pradesh,-,-,-
"Veerappa Nisty Engineering College, Gulbarga", ,Karnataka,08443-292044,ds_nisty@rediffmail.com,-
Veeravalli College of Law,RAJAHMUNDRY ,Andhra Pradesh,0883–2468006,-,-
Veeravalli Vidya Sundar Pg College,RAJAHMUNDRY ,Andhra Pradesh,-,-,-
Veerayatan B.Ed. College, ,Bihar,-,-,-
VEERB BHADUR SINGH MAHILA MAHAVIDYALAYA, ,Uttar Pradesh,-,-,-
VeerKunwarSingh University, ,Bihar,-,-,-
Veermata Jijabai Technical Institute,MUMBAI ,Maharashtra,24146972-76,director@vjti.ac.in,www.vjti.ac.in
Veermata Jijabai Technical Institute, ,Maharashtra,-,-,-
Veesam Jayaprada & Dogiparthy Lakshmi Bhagavathi Degree College,MAGALAGIRI ,Andhra Pradesh,08645–236263,-,-
VEKATESWARA COLLEGE OF EDUCATION, ,Pondicherry,-,-,-
VEKKALIYAMMAN COLLEGE OF EDUCATION, ,Tamil Nadu,-,-,-
VEL COLLEGE OF EDUCATION, ,Tamil Nadu,-,-,-
Vel High Tech Sri Rangarajan Sakunthala Engineering College, ,Tamil Nadu,044-26840181,veltech@vsnl.com,http://www.velhightech.com
"Vel R S Medical College , Chennai",CHENNAI ,Tamil Nadu,-,-,-
"Vel R S Medical College , Chennai",CHENNAI ,Tamil Nadu,-,-,-
"Vel R.S. Medical College, College of Physiotherapy",CHENNAI ,Tamil Nadu,-,-,-
"Vel S School Of Nursing, , Chennai",CHENNAI ,Tamil Nadu,-,-,-
Vel Sri Ranga Sanku College Of Arts And Science,CHENNAI ,Tamil Nadu,-,-,-
VEL TEACHERS TRAINING INSTITUTE, ,Tamil Nadu,-,-,-
VEL Tech, ,Tamil Nadu,044-26840262/26841601,veltech@vsnl.com,www.veltechengg.com
Vel Tech, ,Tamil Nadu,"044-26376061,9445049409",veltech@vsnl.com,www.veltechpoly.com
Vel Tech High Tech Dr.Rangarajan Dr.Sakunthala Engineering College, ,Tamil Nadu,04426840181,veltech@vsnl.com,www.velhightech.com
Vel Tech Polytechnic College,VELLORE ,Tamil Nadu,-,-,-
Vel'S College of Physiotherapy,CHENNAI ,Tamil Nadu,-,velscollege@gmail.com,-
Vel's Srinivasa College of Engineering and Technology,CHINGLEPUT ,Tamil Nadu,"044-27475528,27435627",vscet.mail@gmail.com,http://www.velsrinivasa.com/
Velagapudi Ramakrishna Siddhartha Engineering College, ,Andhra Pradesh,"+918662582333,2584930","gsr@vrsiddhartha.ac.in,principal@vrsiddhartha.ac.",http://www.vrsiddhartha.ac.in/
VELAMMAL COLLEGE OF EDUCATION, ,Tamil Nadu,-,-,-
Velammal College of Engineering & Technology, ,Tamil Nadu,"0452-2465265,2465289",vcetmadurai@yahoo.co.in,www.vcet.ac.in
VELAMMAL COLLEGE OF MANAGEMENT AND COMPUTER STUDIES,CHENNAI ,Tamil Nadu,"044-26591537,044-26591507",director@vcmcs.com,http://www.vcmcs.com
Velammal Engineering College,CHENNAI ,Tamil Nadu,"044-26591870,26591860",velammal@vsnl.net,www.velammal.org
Velammal Institute of Technology, ,Tamil Nadu,044-27984407/27994065/27994066,vitprincipal@yahoo.com,www.velammalit.com
VELANGINI INSTITUTE OF MGT,MANDAL ,Andhra Pradesh,-,-,-
Velankanni Institute of Management Studies, ,Andhra Pradesh,2320053,velankanninlr@yahoo.co.in,http://www.velankanniinstitutions.com/
VELANKANNI INSTITUTE OF MGT. STUDIES, ,Andhra Pradesh,0861-2320053,velankanninlr@yahoo.co.in,www.velankanniinstitutions.com
Vellakoil Arts And Science College,ERODE ,Tamil Nadu,-,-,-
Vellalar College for Women,ERODE ,Tamil Nadu,0424–2431325,"vellalar@sancharnet.in,	vcwprinicipal@rediffmail.com",www.vellalar.com
VELLALAR COLLEGE OF EDUCATION, ,Tamil Nadu,-,-,-
Vellalar College of Engineering & Technology,ERODE ,Tamil Nadu,0424-430333/431725/430325,"velalar@rediffmail.com,vcet@vellalar.com",www.vellalar.com
"Vellalar College Of Nursing , Erode",ERODE ,Tamil Nadu,-,-,-
VELLORE COLLEGE OF EDUCATION, ,Tamil Nadu,-,-,-
Vellore Institute of Technology - VIT University, ,Tamil Nadu,91-416-2243091/93,"info@vit.ac.in,ugadmission@vit.ac.in,pgadmission@vit.ac.in",http://www.vit.ac.in
Vellore Polytechnic College, ,Tamil Nadu,"0416-2247788,9751692365",vellorepolytechnic@yahoo.com,-
Vellu Thampi Memorial N.S.S. College,TRIVANDRUM ,Kerala,"0471-2232240,0479-2302468",vtmnsscollege@yahoo.com,-
"Vels College of Pharmacy , Pallavaram",CHENNAI ,Tamil Nadu,"+91-44-22662500/01/02/03,+91-44-",velscollege@gmail.com,www.velscollege.com
"Vels College of Pharmacy , Pallavaram",CHENNAI ,Tamil Nadu,"+91-44-22662500/01/02/03,+91-44-",velscollege@gmail.com,www.velscollege.com
Vels College Of Science,CHENNAI ,Tamil Nadu,"91-44-22362712,22362716,22403471","velsccollege@vsnl.net,velscollege@gmail.com,centrehead@vaelsbillabonghigh.com,principal@vaelsinternationalschool.com",http://www.velscollege.com
Vels University,CHENNAI ,Tamil Nadu,"91-44-22662500,01,02,03","admission@velsuniv.org,vistas@velsuniv.org",www.velsuniv.org
Veltech Multi Tech Dr.Rangarajan Dr.Sakunthala Engineering College, ,Tamil Nadu,04426841061,veltech@vsnl.com,www.veltechmultitech.org
VELUDAYAR SCHOOL OF EDUCATION, ,Tamil Nadu,-,-,-
Velumailu Siddha Medical College,KANCHIPURAM ,Tamil Nadu,-,info@dharmagroup.in,-
Vemalpalli Kodanda Ramayya College,KRISHNA ,Andhra Pradesh,-,-,-
Vemana Institute of Technology, ,Karnataka,"+918025529874/75,25534194",vemanait@gmail.com,http://www.vemanait.edu.in/
VEMU Institute of Technology, ,Andhra Pradesh,08572-208020,vemurecruitments@gmailcom,www.vemu.co.in
Vengurla Homoeopathic Medical College & Hospital, ,Maharashtra,-,-,-
Venigalla Jayasri Ram College,GUNTUR ,Andhra Pradesh,"08644–243040,94400–82660",-,-
VENKAT INTERNATIONAL COLLEGE OF EDUCATION, ,Karnataka,-,-,-
VENKAT TEACHER TRAINING INSTITUTE, ,Tamil Nadu,-,-,-
"Venkata Padma School Of Nursing , Vizianagaram",VIZIANAGARAM ,Andhra Pradesh,9885196009,-,-
Venkata Rama Degree College,KRISHNA ,Andhra Pradesh,"08678–276833,275311",-,-
"Venkata Sai School Of Nursing , Medak",MEDAK ,Andhra Pradesh,-,-,-
VENKATACALAPATHY TEACHER TRAINING INSTITUTE, ,Tamil Nadu,-,-,-
VENKATAGIRI AITHAL MEMORIAL D ED COLLEGE, ,Karnataka,-,-,-
Venkatesh Mahajan Senior College, ,Maharashtra,-,-,-
VENKATESHA TCH COLLEGE, ,Karnataka,-,-,-
VENKATESHWAR INSTITUTE OF COMPUTER SCIENCE & TECHNOLOGY, ,Uttar Pradesh,"08859500710,08859500715,",-,http://www.venkateshwaragroup.in/
Venkateshwar Institute of Technology,MEERUT ,Uttar Pradesh,"0121-3250912,4006862",sudhir_vicst73@yahoo.co.in,-
Venkateshwara Institute Computer Science Tech, ,Delhi,-,-,-
VENKATESHWARA INSTITUTE OF COMPUTER SCIENCE & TECHNOLOGY, ,Uttar Pradesh,-,-,-
VENKATESVARA COLLEGE OF EDUCATION, ,Tamil Nadu,-,-,-
VENKATESWARA COLLEGE O EDUCATION, ,Karnataka,-,-,-
VENKATESWARA COLLEGE OF EDUCATION, ,Pondicherry,-,-,-
"Venkateswara College Of Nursing,Chitradurga",CHITRADURGA ,Karnataka,-,-,-
"Venkateswara College of Pharmacy , Thanjavur",THANJAVUR ,Tamil Nadu,-,-,-
Venkateswara Homoeopathic Medical College and Hospital, ,Tamil Nadu,-,-,-
Venkateswara Mahila Degree College,KRISHNA ,Andhra Pradesh,08678–275287,-,-
"Venkateswara Nursing College , Chennai",CHENNAI ,Tamil Nadu,-,-,-
Venkateswara Polytechnic College,CHENNAI ,Tamil Nadu,"04322265355,04322266438,9976143151",vptcollege516@rediffmail.com,www.516vptc.com
Venkateswara Polytechnic College, ,Tamil Nadu,"04322265355,04322266438,9976143151",vptcollege516@rediffmail.com,www.516vptc.com
"Venkatnayadu Mphw f Trg Institute,East Godawari",EAST GODAVARI ,Andhra Pradesh,-,-,-
Venkatramana Polytechnic College, ,Tamil Nadu,04324-281566,venkatramanapolytechnic@gmail.com,venkatramanaptc.org.in
VENKETESHWAR TEACHER TRAINING COLLEGE, ,Haryana,-,-,-
Venkteshwar Institute of Technology, ,Madhya Pradesh,9425900437;9425900463,"director@venkteshwarinstitute.ac.in,",http://venkteshwarinstitute.ac.in
VENKTESHWARA TEACHER TRAINING COLLEGE, ,Haryana,-,-,-
VENTESHWARA TEACHER TRAINING COLLEGE, ,Haryana,-,-,-
Venutai Chavan College, ,Maharashtra,-,-,-
Venutai Yashwantrao Chavan Homoeopathic Medical College,KOLHAPUR ,Maharashtra,-,-,-
Verrasaiva College, ,Karnataka,-,-,-
Vesaja Patel College, ,Orissa,-,-,-
Vestal Academy of Information Technology & Management, ,Andhra Pradesh,08812-215955,vestal.academy@gmail.com,http://vestalcollege.org/
VESTAL INSTITUTE OF MGT. AND INFORMATION TECH,ELURU ,Andhra Pradesh,-,vestal.institute@gmail.com,-
VESTLEY COLLEGE OF EDUCATION, ,Tamil Nadu,-,-,-
VET BVL Polytechnic, ,Karnataka,080-2658680826584760,-,-
VET COLLEGE OF EDUCATION, ,Tamil Nadu,-,-,-
VET COLLEGE OF EDUCATION, ,Tamil Nadu,-,-,-
Vetaleshwar Shikshan Sanstha's Rajiv Gandhi Instiute of Polytechnic, ,Maharashtra,268071,rgiphasegaon@gmail.com,-
VETALWADIS COLLEGE OF EDUCATION FOR WOMEN, ,Maharashtra,-,-,-
Vethathiri Maharishi Inatitude Of Technology, ,Tamil Nadu,044-27878111,vmitajpet@yahoo.com,www.vmit.com
Vetri Vinayaha College Of Engineering And Technology, ,Tamil Nadu,04326277333,vetrivinayaha@yahoo.co.in,www.vetrivinayaha.org
Vetri Vinayaha Polytechnic College , ,Tamil Nadu,"04326277444,04326277554,9443290346",	vetrivinayaha@yahoo.co.in,-
VETTRI VEL COLLEGE OF EDUCATION, ,Tamil Nadu,-,-,-
"Viashnavi Institute Of Proffesional Studies ,Gwalior",GWALIOR ,Madhya Pradesh,-,-,-
VIBHAS TRUST, ,Gujarat,-,-,-
VICION INTERNATIONAL TEACHER TRAINING COLLEGE, ,Haryana,-,-,-
Vickram College of Engineering, ,Tamil Nadu,04575-203611,msrrajsanthosh@yahoo.com,http://www.vickramce.org/
VICKRAM COLLEGE OF TEACHER EDUCATION, ,Tamil Nadu,-,-,-
Vickram Polytechnic College, ,Tamil Nadu,"04575220190,9443015277",renga_muthu@yahoo.com,www.vickrampc.org
Victor Dantas Law College,SINDHUDURG ,Maharashtra,"02362-220427,02365-255251,9860519555",-,-
"Victor Institute Of Nursing And Paramedical Sciences , Mohali",MOHALI ,Punjab,-,-,-
VICTOR PUBLIC COLLEGE, ,Uttar Pradesh,-,-,-
Victor Public College, ,Uttar Pradesh,-,-,-
VICTORIA COLLEGE OF EDUCATION, ,Madhya Pradesh,-,principal@vcebhopal.ac.in,-
VICTORIA COLLEGE OF EDUCATION, ,Madhya Pradesh,-,-,-
VICTORIA DED COLLEGE, ,Karnataka,-,-,-
"Victoria Hospital, School Of Nursing , Fort Bangalore",BANGALORE ,Karnataka,-,-,-
Victoria Institution, ,West Bengal,-,-,-
"Victoria Memorial Hospital , Hanamkonda",HANAMAKONDA ,Andhra Pradesh,-,-,-
VICTORY COLLEGE OF EDUCATION, ,Tamil Nadu,-,-,-
"Victory College Of Nursing,Bangalore",BANGALORE ,Karnataka,-,-,-
VICTORY COLLEGE OF TEACHER EDUCATION, ,Kerala,-,-,-
VICTORY TEACHER TRAINING INSTITUTE, ,Tamil Nadu,-,-,-
VICTORY TEACHER TRAINING INSTITUTE, ,Tamil Nadu,-,-,-
Vidarbha Ayurved Mahavidyalaya, ,Maharashtra,-,-,-
VIDARBHA BHU-UDDESHIYA SHIKSHAN SANSTHA, ,Maharashtra,-,vidarbhabuss@yahoo.co.in,-
Vidarbha Mahavidyalaya, ,Maharashtra,-,-,-
Vidarbha Rural Reconstruction Foundation, ,Maharashtra,(07235)234399,-,-
VIDARBHA SHARIRIK SHIKSHAN MAHAVIDYALAYA, ,Maharashtra,-,-,-
Vidarbha Youth Welfare Soc.'s Prof. Ram Meghe Institute of Technology & Research,AMRAVATI ,Maharashtra,(0721)-2662618,principal@coebadnera.com,www.coebadnera.com
Vidarbha Youth Welfare Society Polytechnic, ,Maharashtra,91-721-2681306,info@polybadnera.com,http://polybadnera.org/
"Vidarbha Youth Welfare Society, Institute of Pharmaceutical Education and Research , WARDHA",WARDHA ,Maharashtra,07152-240284,dr_yeolepg@rediffmail.com,www.iperwardha.com
"Vidarbha Youth Welfare Societys Dental College & Hospital , Amravati",AMRAVATI ,Maharashtra,"072-12662466,072-12666490",info@dchamt.com,www.dchamt.com
VIDHAVATI MUKEND MAHILA MAHAVIDHYALAYA, ,Uttar Pradesh,-,-,-
Vidhi Mahavidyalaya, ,Bihar,06274-225618,-,-
"Vidhya Bhawan Polytechnic, Udaipur", ,Rajasthan,0294-2451309,vidyabhawanpolytechnic@yahoo.co.in,-
Vidhya Mandhir Institute of Technology, ,Tamil Nadu,"04294-230240,230230,230666",vmiterode@gmail.com,www.vmit.ac.in
Vidhya Prasaaraka Mandal Polytechnic, ,Karnataka,-,-,-
VIDHYA SAGAR WOMENS COLLEGE EDUCATION, ,Tamil Nadu,-,-,-
"Vidhya Sagar Womens College, Chenglepet",KANCHIPURAM ,Tamil Nadu,-,vswcollege@eth.net,-
VIDHYA SAGAR WOMENS TEACHER TRAINING INSTITUTE, ,Tamil Nadu,-,-,-
VIDHYA VIKAS COLLEGE OF EDUCATION, ,Tamil Nadu,-,-,-
VIDHYA VIKAS PLUS THE INSTITUTE OF EDUCATION, ,Tamil Nadu,-,-,-
VIDHYADSHRAM INSTITUTE OF TEACHERS TRAINING, ,Rajasthan,-,-,-
VIDHYALAYA TEACHER TRAINING INSTITUTE, ,Tamil Nadu,-,-,-
Vidhyan Chal Mahavidyakaya,REWA ,Madhya Pradesh,-,-,-
"Vidhyanavi Vidhya Peeth School Of Nursing , Gwalior",GWALIOR ,Madhya Pradesh,-,-,-
VIDHYAWATI TEACHER TRAINING COLLEGE, ,Haryana,-,-,-
Vidnyan Mahavidyalaya, ,Maharashtra,-,-,-
Vidnyan Mahavidyalaya, ,Maharashtra,-,-,-
Viduttma Kanya Mwahavidyalaya, ,Uttar Pradesh,-,-,-
"Vidwan Degree College, Vizianagaram",BOBBILI ,Andhra Pradesh,"08944–254754,254341",-,-
Vidya Academy of Science and Technology,TRICHUR ,Kerala,04885-287751/52/287919,principal@vidyaacademy.ac.in,www.vidyaacademy.ac.in
VIDYA BHARATHI  INSTITUTE OF RESEARCH & P.G. STUDIES IN SCIENCE & MANAGEMENT,AMRAVATI ,Maharashtra,0721-2662740,director@vbirsm.org,www.vbirsm.org
Vidya Bharathi College,KAMRUP ,Assam,-,-,-
"Vidya Bharathi Degree College, Tandoor",TANDOOR ,Andhra Pradesh,-,-,-
Vidya Bharathi Institute Of Technology, ,Andhra Pradesh,"08716288146,08716288289","webmaster_vbit@yahoo.com,vbit_placements@yahoo.co",http://www.vbit.co.in/
Vidya Bharathi Mahavidyalaya, ,Maharashtra,-,-,-
VIDYA BHARTI TEACHER TRAINING COLLEGE, ,Rajasthan,-,-,-
VIDYA BHARTI TEACHER TRAINING COLLEGE, ,Rajasthan,-,-,-
VIDYA BHAVAN TEACHER TRAINING COLLEGE, ,Haryana,-,-,-
Vidya Bhawan Gs Teachers Training College, ,Rajasthan,-,-,-
Vidya Bhawan Mahila Mahavidyalaya, ,Bihar,-,-,-
VIdya Bhawan Rural Institute, ,Rajasthan,-,-,-
Vidya College of Engineering,MEERUT ,Uttar Pradesh,0121-2439192,info@vidya.in,www.vidya.in
"Vidya College Of Nursing ,udupi",UDUPI ,Karnataka,-,-,-
"Vidya College Of Nursing ,udupi",UDUPI ,Karnataka,-,-,-
VIDYA DAN SAMITIS SMT.M.B.HUILGOL COLLEGE OF EDUCATION, ,Karnataka,-,-,-
Vidya Dayani College,HYDERABAD ,Andhra Pradesh,"24536273,24532434",-,-
Vidya Dayini College Of Information Tech,RANGAREDDY ,Andhra Pradesh,-,-,-
Vidya Dhari Degree College,SRIKAKULAM ,Andhra Pradesh,223467,-,-
"Vidya Institute Of Nursing Sciences , Nashik",NASHIK ,Maharashtra,-,-,-
Vidya Jyothi Degree & Pg College,WARANGAL ,Andhra Pradesh,08711–220282,vjdc@nettlinks.com,-
Vidya Jyothi Institute of Technology,HYDERABAD ,Andhra Pradesh,-,vjithyd@gmail.com,http://vjit.ac.in/college
Vidya Kendram Degree College,SATTENPALLI ,Andhra Pradesh,"08641–235015,232667",-,-
"Vidya Kirana School Of Nursing , Bangalore",BANGALORE ,Karnataka,-,-,-
Vidya Latha Degree College Of Commerce & Business Management,KARIMNAGAR ,Andhra Pradesh,"08722–233851,247604",-,-
Vidya Mandir Degree College, ,Uttar Pradesh,-,-,-
Vidya Niketan Institute of Engineering & Technology(VNIET), ,Maharashtra,9561112202,"vnietcollege@gmail.com,principal@vniet.org",www.vniet.org
VIDYA NIKETAN SAMITIS, ,Madhya Pradesh,-,-,-
"Vidya Nikunj Nursing School , Rajkot",RAJKOT ,Gujarat,+(91)-9898847080,-,-
VIDYA PRACHARA SANGHA VIJAYA TEACHER TRAINING COLLEGE, ,Karnataka,-,-,-
VIDYA PRASARAK MANDAL, ,Karnataka,-,-,-
Vidya Prasarak Mandal Polytechnic, ,Maharashtra,25364494,vpm_polytechnic@vpmthane.org,www.vpmthane.org
Vidya Prasarak Mandals K.G. Joshi Arts & N.G. Bedekar Coll. Of Comm, ,Maharashtra,-,-,-
VIDYA PRASARAK SAMITI KILLA, ,Karnataka,-,-,-
VIDYA PRASARINI SABHAS D.ED. COLLEGE BHAJE, ,Maharashtra,-,-,-
VIDYA PRATISHTAN COLLEG OF EDUCATION, ,Maharashtra,-,-,-
Vidya Pratishthan's Institute of Information Technology,BARAMATI ,Maharashtra,(02112)-243691/239200,registar@vpcoe.org,www.vpcoe.org
Vidya Pratishthan's Polytechnic College Indapur, ,Maharashtra,02111-225600,bandal.ganesh@gmail.com,http://www.vppolytechnic.org
Vidya Pratishthans Arts Science & Comerce College, ,Maharashtra,-,-,-
Vidya Pratishthans Law College,PUNE ,Maharashtra,"02112-243341,02112-239192/93/91",-,-
Vidya Pratisthan's Institute of Information Technology, ,Maharashtra,"91-2112-239551,239552,239553,239554",		webmaster@viitindia.org,http://www.viitindia.org
VIDYA RASHMI TEACHER TRAINING INSTITUTION, ,Karnataka,-,-,-
Vidya Ratna Dr. K.G.A. Gupta Degree College,ANANTAPUR ,Andhra Pradesh,08493–284663,-,-
Vidya Sagar,CHENNAI ,Tamil Nadu,-,-,-
VIDYA SAGAR COLLEGE, ,Madhya Pradesh,-,-,-
"Vidya Sagar College Of Nursing , Mansa",MANSA ,Punjab,-,-,-
"Vidya Sagar School Of Nursing , Mansa",MANSA ,Punjab,-,-,-
VIDYA SAGAR TEACHER TRAINING COLLEGE, ,Punjab,-,-,-
Vidya Sagar Teacher's Training College, ,West Bengal,-,-,-
VIDYA SAMVARDHAK MANDA, ,Karnataka,-,-,-
VIDYA SAMVARDHAKA TEACHER TRAINING INSTITUTE, ,Karnataka,-,-,-
VIDYA SCHOOL OF BUSINESS, ,Uttar Pradesh,0121-2439192,info@vidya.in,-
"Vidya School Of Nursing , Udupi",UDUPI ,Karnataka,-,-,-
"Vidya Shikshan Prasarak Mandals Dental College & Research Centre , Nagpur",NAGPUR ,Maharashtra,07104-236290/23,-,www.vspmdentalcollege.com
VIDYA TEACHER TRAINING COLLEGE, ,Haryana,-,-,-
VIDYA TRAINING INSTITUTE, ,Delhi,-,-,-
VIDYA VAHINI SHIKSHA MAHAVIDYALAYA, ,Madhya Pradesh,-,-,-
VIDYA VAHINI T.CH COLLEGE, ,Karnataka,-,-,-
Vidya Vaibhav Shikshan Mandal Dapoli Homoeopathic Medical College,RATNAGIRI ,Maharashtra,-,-,-
Vidya Vardhak Sanghs Arts And Commerce College, ,Karnataka,-,-,-
Vidya Vardhaka Law College,MYSORE ,Karnataka,0821-2426220,kbvasudeva@yahoo.co.in,www.vvic.org
VIDYA VIHAR SHIKSHAN SANSTHA, ,Maharashtra,-,-,-
VIDYA VIHAR TEACHER TRAINING INSTITUTE, ,Tamil Nadu,-,-,-
Vidya Vikas Arts Commerce & Science College, ,Maharashtra,-,-,-
VIDYA VIKAS COLLEGE OF EDUCATION, ,Karnataka,-,-,-
"Vidya Vikas College Of Nursing , Mysore",MYSORE ,Karnataka,-,-,-
"Vidya Vikas Education Trust Polytechnic, Mysore", ,Karnataka,08212476347,-,-
Vidya Vikas Institute of Engineering and Technology,MYSORE ,Karnataka,0821-2471232/2471635,info@vidyavikas.net,www.vidyavikas.net
Vidya Vikas Institute of Technology, ,Andhra Pradesh,+91-08417-243222,principal_vvit@yahoo.co.in,www.vvit.in/
Vidya Vikas Mandals Arts And Commerce College, ,Maharashtra,-,-,-
Vidya Vikas Polytechnic, ,Karnataka,-,-,-
"Vidya Vikas Pratishthan Polytechnic, Solapur", ,Maharashtra,"(0217)6452444,6053555",	vvpps@rediffmail.com,http://www.vvppolytechnic.org/
VIDYA VIKAS TEACHERS TRAINING INSTITUTE, ,Karnataka,-,-,-
VIDYA VIKAS TEACHERS TRAINING INSTITUTE, ,Karnataka,-,-,-
"Vidya Vikas Trust College of Pharmacy , BIDAR",BIDAR ,Karnataka,0821-2415592,-,www.vidyavikas.net
"Vidya Vikas Trusts, School Of Nursing , Bidar",BIDAR ,Karnataka,-,-,-
Vidya Vikkas College Engineering Technology, ,Tamil Nadu,"04288-282222,281122",vvcetedu@vvcet.ac.in,www.vvcet.ac.in
Vidyaarthi Degree College,VISAKHAPATNAM ,Andhra Pradesh,"0891–2525316,2716307",vidyaardhicolleges@rediffmail.com,-
Vidyabharathy Degree College For Women,HYDERABAD ,Andhra Pradesh,24750884,-,-
"Vidyabharati College of Pharmacy , AMRAVATI",AMRAVATI ,Maharashtra,"(0721)2552012,2662740Ext.No.204",ati_vbcp@rediffmail.com,www.vbcop.org
VIDYABHARATI PRATISHTHA (R), ,Karnataka,-,-,-
"Vidyakirana Institute Of Nursing Sciences,Bangalore",BANGALORE ,Karnataka,-,-,-
"Vidyakirana Institute Of Nursing Sciences,Bangalore",BANGALORE ,Karnataka,-,-,-
Vidyalankar Institute of Technology,MUMBAI ,Maharashtra,(022)24161126/24161140,principal@vit-edu.in,www.vit.edu.in
Vidyalankar Polytechnic, ,Maharashtra,24161126,principal@vpt.edu.in,www.vpt.edu.in
Vidyalaya Degree College,GUDIVADA ,Andhra Pradesh,"08674–241339,224705,245371",-,-
"Vidyalaya Degree College, Gudur",GUDUR ,Andhra Pradesh,08624–222511,-,-
VIDYAMANDIR TEACHER TRAINING COLLEGE, ,Haryana,-,-,-
"Vidyamani School Of Nursing , Bidar",BIDAR ,Karnataka,-,-,-
Vidyanagar College, ,West Bengal,-,-,-
VIDYANANDA GURUKULA EDUCATION TRUSTS D.ED COLLEGE, ,Karnataka,-,-,-
VIDYANIDHI EDUCATION SOCIETY, ,Karnataka,-,-,-
Vidyanidhi Info Tech Academy, ,Maharashtra,2226255629,kidz4it@gmail.com/dac.vita@gmail.com,www.vidyanidhi.com
Vidyaniketan Social Cultural Educational Multi Objectal Oriented Society,NANDURBAR ,Maharashtra,-,-,-
VIDYANIKETHAN D.ED COLLEGE, ,Karnataka,-,-,-
Vidyanjali College Of Arts & Science,SULLURPET ,Andhra Pradesh,08623–309797,-,-
Vidyanjali Degree College,KRISHNA ,Andhra Pradesh,08677–225539,-,-
"Vidyanjali Degree College, Mudinepalli",KRISHNA ,Andhra Pradesh,08674–233247,-,-
Vidyant Hindu Degree College, ,Uttar Pradesh,-,-,-
Vidyapati Bachelor of Education College, ,West Bengal,-,-,-
Vidyapeth College,HYDERABAD ,Andhra Pradesh,-,-,-
VIDYARANYA EDUCATION COLLEGE, ,Karnataka,-,-,-
VIDYARANYA VIDYA SAMASTHE(R), ,Karnataka,-,-,-
"Vidyarashmi School Of Nursing , Dakshina Kannada", ,Karnataka,-,-,-
"Vidyarathna College Of Nursing ,Udupi",UDUPI ,Karnataka,-,-,-
"Vidyarathna College Of Nursing ,Udupi",UDUPI ,Karnataka,-,-,-
Vidyarthi Degree College,ADILABAD ,Andhra Pradesh,08732–224943,-,-
